"Les ministres de l'agriculture de plus de cent nations sont attendus à la conférence ministérielle et à l'exposition de trois jours sur les sciences et les technologies agricoles, parrainées par le ministère américain de l'agriculture.","La ministre américaine de l'agriculture, Ann Veneman, donne le coup d'envoi de la conférence ministérielle et de l'exposition de trois jours sur les sciences et technologies agricoles, lundi.",3.75
La situation est compliquée par la présence de Libériens endurcis qui ont combattu dans les deux camps.,"Les combats se poursuivent sporadiquement à l'ouest, où ils sont compliqués par la présence de Libériens aguerris des deux côtés.",4.0
"Cette année, la Société Audubon organise une fois de plus son comptage annuel des oiseaux de Noël.","Il s'agit du recensement annuel des oiseaux de Noël de la National Audubon Society, qui en est à sa 104e saison.",3.5
"Avant d'être supprimé, le site répertoriait en anglais les règles à suivre par les pirates informatiques susceptibles de participer.","Les organisateurs ont créé un site web, http://defacerschallenge.com, qui énumère en anglais les règles à respecter par les pirates informatiques qui pourraient participer.",3.0
Les médecins ont émis l'hypothèse que l'œstrogène propre à l'organisme protège contre les dommages cellulaires et améliore la circulation sanguine.,Leur croyance était basée sur la spéculation selon laquelle les œstrogènes préviennent les dommages cellulaires et améliorent la circulation sanguine.,4.2
Ils ont également constaté que la brièveté était associée à des antécédents familiaux de perte auditive.,La brièveté a été constatée deux fois plus souvent chez les personnes souffrant d'une perte auditive.,3.4
"Les dirigeants de Cisco ont déclaré qu'ils étaient encouragés par les 1,3 milliard de dollars de cash-flow et l'augmentation du revenu net, mais qu'ils espéraient un rebond.","Les dirigeants de Cisco ont été encouragés par les 1,3 milliard de dollars de cash-flow et l'augmentation du revenu net, mais ont déclaré qu'ils restaient ""prudemment optimistes"" quant à un rebond.",4.6
"Dans un courrier électronique adressé au Knoxville News Sentinel, M. Shumaker a déclaré : ""Je n'envisage pas de démissionner.","Je n'envisage pas de démissionner"", a déclaré M. Shumaker dans une déclaration.",4.0
"Un sondage a montré que l'écoute du maire par le FBI avait donné un coup de pouce à son effort de réélection contre l'opposant du GOP, Sam Katz.",Un sondage publié cette semaine a montré que l'écoute du maire par le FBI a donné un coup de pouce à sa réélection.,4.0
"Le passager blessé à l'hôpital John Peter Smith est mort plus tard vendredi matin, a déclaré M. Jones.","Le passager blessé de John Peter Smith est mort plus tard dans la matinée ; son nom n'a pas été divulgué, a déclaré M. Jones.",3.643
"Les médecins avaient prévu de l'accoucher deux semaines plus tôt, soit le 14 novembre ou aux alentours de cette date.","Une césarienne était initialement prévue à la mi-novembre, avec deux semaines d'avance.",3.6
"Sobig.F se propage lorsque des utilisateurs d'ordinateurs peu méfiants ouvrent des pièces jointes à des courriels qui contiennent des titres aussi familiers que ""Merci"", ""Re : Détails"" ou ""Re : Ce film"".","Le virus se propage lorsque des utilisateurs d'ordinateurs sans méfiance ouvrent des pièces jointes à des courriels qui contiennent des titres familiers comme ""Merci"" et ""Objet : Détails"".",4.0
"L'indice composite du Nasdaq, basé sur la technologie, a augmenté de 17,26 points, soit 1,06 %, pour atteindre 1 640,06, selon les dernières données.","L'indice plus large Standard & Poor's 500 <.SPX> a gagné 5,51 points, soit 0,56 %, pour atteindre 981,73.",1.0
"Les fondateurs du groupe sont Matsushita Electric, Sony, Hitachi, NEC, Royal Philips Electronics, Samsung, Sharp et Toshiba.","Les membres fondateurs du CELF sont Hitachi, Matsushita, NEC, Philips, Samsung, Sharp, Sony et Toshiba.",3.4
"C'est dans l'approvisionnement alimentaire"", déclare David Ropeik, directeur de la communication sur les risques au Centre d'analyse des risques de Harvard.","""Ce n'est pas zéro"", a déclaré David Ropeik, directeur de la communication des risques au Centre d'analyse des risques de Harvard.",1.75
"Lors d'un match de hurlement en 1999, Carolyn a dit à John qu'elle couchait toujours avec Bergin.","À son tour, elle a parfois dit à John qu'elle couchait toujours avec un ex-petit ami, le beau gosse de ""Baywatch"" Michael Bergin.",3.0
"D'autre part, si cela peut contribuer à établir davantage l'innocence de Steve, nous nous en félicitons"".","Si l'assèchement des étangs du Maryland contribue à établir l'innocence de Steve, nous nous en félicitons"".",3.25
"M. Fletcher a déclaré qu'il s'attendait à avoir le soutien des législateurs des États agricoles, dont beaucoup font partie de la commission.",Il a déclaré qu'il s'attendait également à bénéficier du soutien des législateurs d'autres États agricoles.,3.4
"Sept cadets de 20 et 21 ans ont reçu une contravention de la police pour avoir consommé de l'alcool dans une chambre d'hôtel hors campus, tôt samedi, en compagnie de deux jeunes femmes âgées de 16 et 18 ans.",Sept cadets de 20 et 21 ans ont été pris dans une chambre d'hôtel hors campus tôt samedi avec deux adolescentes de 16 et 18 ans.,3.2
Une telle mesure pourrait soumettre la question au Conseil de sécurité de l'ONU.,La question pourrait alors être soumise au Conseil de sécurité des Nations unies.,2.8
"Il avait prévu de rester toute la journée jusqu'à la crête du fleuve, prévue pour la fin de la nuit dernière.",Lui et les autres avocats ont prévu de rester jusqu'à ce que le fleuve commence à reculer.,2.4
"Le camp accueille des retraites religieuses d'été pour les enfants et d'autres événements tout au long de l'année, selon son site web.","Le camp Sainte-Sophie accueille des retraites religieuses pour les enfants pendant les mois d'été ainsi que d'autres événements tout au long de l'année, selon son site web.",3.4
"Les opérateurs ont déclaré que la dynamique de baisse de la monnaie unique par rapport au dollar pourrait s'accélérer si elle passe en dessous de 1,15 dollar.","Les opérateurs ont déclaré que la tendance à la baisse de l'euro pourrait s'accélérer si l'euro passe en dessous de 1,15 dollar.",3.6
"Les actions de Gemstar ont augmenté de 2,6 %, ajoutant 14 cents à 5,49 $ à la clôture.","L'action Gemstar a progressé aux nouvelles, fermant 2,6 % à 5,49 $ sur le Nasdaq.",3.8
"Outre le fabricant de puces Intel, les entreprises comprennent Sony, Microsoft, Hewlett-Packard, IBM, Gateway et Nokia.","Outre le fabricant de puces Intel, les entreprises comprennent Sony, Microsoft, Hewlett-Packard, International Business Machines, Gateway, Nokia et d'autres.",4.8
"Kroger Co., qui possède Ralphs, et Albertsons Inc. négocient conjointement avec Safeway et mettent en lock-out leurs travailleurs syndiqués le lendemain.","En signe de solidarité, la société Kroger, propriétaire de Ralphs, et Albertson Inc. ont mis leurs employés en lock-out le lendemain matin.",3.8
"Selon le Bureau du recensement, la population hispanique a augmenté de 9,8 % par rapport aux chiffres du recensement d'avril 2000.","La population hispanique a augmenté de 9,8 % par rapport aux chiffres du recensement d'avril 2000, malgré des conditions sociales et économiques moins favorables que dans les années 1990.",3.333
"Ses actions sont passées de 50,90 dollars à la clôture de mercredi à 54,50 dollars en pré-ouverture.","Les actions ont fait un bond de près de 7 % dans la négociation avant l'ouverture, passant de 17,05 $ à la clôture de mardi à 18,26 $.",2.5
"La moyenne industrielle du Dow Jones <.DJI> a baissé de 58,69 points, soit 0,64 %, à 9 137,86.","La moyenne industrielle du Dow Jones, DJI, a baissé de 79,43 points, soit 0,86%, à 9 117,12 vendredi.",2.4
"Son avocate, Pamela MacKey, a déclaré que Bryant s'attendait à être complètement disculpé.","""M. Bryant est innocent et s'attend à être complètement disculpé"", a déclaré M. Mackey dans une déclaration.",3.8
"Il s'agit de la meilleure progression depuis le 1er octobre, lorsque l'indice a gagné 22,25.","L'indice Standard & Poor's 500 a augmenté de 15,66 à 1 046,79, sa meilleure progression depuis le 1er octobre, où il avait gagné 22,25.",3.0
"M. Mask a déclaré que M. Cullen serait sorti de la prison du comté de Somerset d'ici jeudi et transféré à l'hôpital médico-légal Ann Klein, juste à l'extérieur de Trenton, pour y recevoir des soins psychiatriques.","Charles Cullen, 43 ans, a été transféré de la prison du comté de Somerset à Somerville au Centre médico-légal Anne Klein, un établissement de traitement psychiatrique de 150 lits à Trenton.",3.692
Les scientifiques pensent que la poussière d'étoile a emprisonné des milliers de particules de poussière.,Stardust a été conçu pour recueillir des milliers de particules de poussière provenant de Wild 2.,3.0
Le rapport du comité d'experts indépendants vise à dissiper tout soupçon sur la manière dont le gouvernement de Hong Kong a géré la crise du SRAS.,Un rapport très attendu sur la manière dont le gouvernement de Hong Kong a géré l'épidémie de SRAS a été publié.,2.75
Les deux dispositifs mettent en œuvre le dispositif eSCO de la norme v1.2 pour fournir la base de nouvelles applications de téléphonie sans fil.,BlueCore3 met également en œuvre le dispositif eSCO de la version 1.2 afin de fournir la base d'applications de téléphonie sans fil avancées pour la transmission Bluetooth.,3.25
"La baisse des prix de gros de base en avril a reflété la chute des prix des voitures, des camions, des vêtements pour hommes et garçons et des cigarettes.","Cette baisse, la plus importante depuis août 1993, est due à la chute des prix des voitures, des camions, des vêtements pour hommes et garçons et des cigarettes.",3.5
"Des secouristes internationaux fouillent les débris aplatis des survivants dans l'ancienne ville de Bam, sur la route de la soie, en Iran, après qu'un violent tremblement de terre ait tué plus de 20 000 personnes.","Les secouristes internationaux ont désespérément taillé dans les débris aplatis pour les survivants et les cimetières ont débordé hier dans l'ancienne ville de Bam, sur la route de la soie en Iran.",3.0
"Griffith, originaire du Mont Airy, vit aujourd'hui sur la côte de Caroline du Nord à Manteo.","Griffith, 77 ans, a grandi à Mount Airy et vit maintenant à Manteo.",4.0
"Le Conference Board a indiqué que l'indice de confiance des consommateurs américains a chuté à 83,5 en juin, contre 83,6 en mai.","L'indice de confiance des consommateurs s'est établi à 83,5 en juin, en légère baisse par rapport à un indice révisé de 83,6 en mai, selon le Conference Board.",4.667
"""Je constate un changement d'humeur dans leurs priorités"", a déclaré un homme politique.","""Je constate un changement d'humeur dans leurs priorités"", a déclaré un homme politique irakien après avoir rencontré M. Bremer.",3.333
"Heather, 35 ans, qui a perdu une jambe dans un accident de la route, aurait des plaques d'acier dans les hanches, ce qui rendrait l'accouchement naturel impossible.","L'ancien mannequin Lady McCartney a perdu une jambe dans un accident de la route en 1993. On croit savoir que des plaques d'acier ont été placées dans ses hanches, ce qui rendrait l'accouchement naturel difficile.",2.4
"Le réseau abandonne également son édition ""Dateline"" du vendredi soir.","Le réseau abandonnera une édition de ""Dateline"", sa franchise de magazine d'information.",3.857
"Le vice-président Dick Cheney et la candidate républicaine au poste de gouverneur du Mississippi, Haley Barbour, saluent les acclamations de la foule.",Le vice-président Dick Cheney a déclaré que le républicain du Mississippi Haley Barbour serait un bon gouverneur grâce à son sens du gouvernement et des affaires.,2.4
"Cette infirmière de 51 ans travaillait à l'hôpital général de North York, l'épicentre de la dernière épidémie.","Emile Laroza, 51 ans, a contracté le SRAS alors qu'il travaillait comme infirmier à l'hôpital général de North York, l'épicentre de la deuxième épidémie de SRAS.",3.0
Rusch a également autorisé cinq courses gagnées ou plus lors de chacun de ses trois derniers départs.,Redman a autorisé deux courses gagnées ou moins dans six de ses neuf départs.,2.0
M. Turner a transféré environ 10 millions d'actions à un trust caritatif avant qu'elles ne soient vendues.,Les ventes laissent à M. Turner environ 45 millions d'actions d'AOL.,1.6
Il a également recruté d'autres personnes pour participer au programme en les convainquant de recevoir des marchandises obtenues frauduleusement qu'il avait commandées pour lui-même.,Il a également recruté d'autres personnes pour prendre livraison des marchandises obtenues frauduleusement qu'il avait commandées.,4.0
Les New York Mets ont ensuite sélectionné le voltigeur Lastings Milledge du lycée Lakewood Ranch en Floride.,"Les Mets ont pris Lastings Milledge, un voltigeur de Floride, avec le 12e choix.",3.8
Le sénateur de Floride Bob Graham n'a pas été identifié par 61% des personnes interrogées.,"Kerry a été jugé favorablement par 66% des personnes interrogées, contre 57% pour Dean.",1.273
"L'indice Standard & Poor's 500 SPX a augmenté de 3,47 points, soit 0,36 %, pour atteindre 977,59.","L'indice composite du Nasdaq, IXIC, a perdu 8 points, soit 0,45 %, pour s'établir à 1645.",1.0
"En conséquence, 24 joueurs ont battu le par au premier tour.","Vingt-quatre joueurs ont brisé le par au premier tour, le troisième chiffre le plus élevé de l'histoire de l'U.S. Open.",3.0
La chaîne Ralphs d'Albertsons et Kroger a réagi en mettant ses employés en lock-out.,La chaîne Ralphs de Kroger et Albertsons ont immédiatement mis en lock-out leurs employés d'épicerie en signe de solidarité.,4.0
"L'indice composite du Nasdaq <.IXIC> a chuté de 37,78 points, soit 1,94 %, pour atteindre 1 912,36.","L'indice composite du Nasdaq a chuté de 2,95, soit 0,2 %, pour la semaine, à 1 912,36 après avoir chuté de 37,78 hier.",2.0
"Les actions de SCO ont clôturé à 10,93 $, en baisse de 28 cents, lundi, sur le marché boursier du Nasdaq.","Les actions d'IBM ont clôturé à 84,50 dollars à la Bourse de New York, en hausse de 1,75 dollar, soit 2,11 %.",1.0
"La Chambre a voté à 425 voix contre 2 pour approuver le projet de loi, le premier des 13 que le Congrès doit adopter chaque année pour financer le gouvernement fédéral.",Ce projet de loi est l'un des 13 premiers que le Congrès doit adopter chaque année pour financer le gouvernement fédéral.,3.0
"M. Knight a accepté un contrat de deux ans, d'une valeur de 2,38 millions de dollars, qui comprenait une prime à la signature de 300 000 dollars.","ESPN a rapporté que l'accord de deux ans de Knight vaut 2,38 millions de dollars, dont 300 000 dollars de prime à la signature.",4.75
"Par rapport à la monnaie japonaise, l'euro était à 135,92/6,04 yens contre le niveau de 136,03/14 à la fin de l'année à New York.","Le dollar était à 117,85 yens par rapport à la monnaie japonaise, en hausse de 0,1 %.",2.75
La procédure est généralement effectuée au cours du deuxième ou du troisième trimestre.,"Cette technique est utilisée au cours du deuxième et, parfois, du troisième trimestre de la grossesse.",4.5
"Outre Hampton et Newport News, la subvention finance des analyses de l'eau à Yorktown, dans le comté de King George, à Norfolk et à Virginia Beach.","La subvention finance également des essais sur la plage dans le comté de King George, à Norfolk et à Virginia Beach.",3.0
Il a déclaré que les attaquants avaient laissé des tracts demandant au personnel du Sheraton d'Ishtar de cesser de travailler à l'hôtel et exigeant que les forces américaines quittent l'Irak.,Il a déclaré que les agresseurs avaient laissé derrière eux des tracts exhortant les travailleurs de l'Ishtar Sheraton à ne plus travailler à l'hôtel.,3.0
"Alors que la diplomatie s'échauffe dans la crise nucléaire qui dure depuis près de 10 mois, le ministre chinois des affaires étrangères Li Zhaoxing doit se rendre en Corée du Sud du 13 au 15 août.","Alors que la diplomatie s'échauffe dans cette crise qui dure depuis près de 10 mois, le ministre chinois des affaires étrangères Li Zhaoxing s'envole dimanche pour le Japon, en route pour la Corée du Sud le 13 août.",3.0
Les taureaux des obligations voudraient que la Fed reconnaisse que les risques sont biaisés vers la faiblesse économique.,La Fed a également déclaré que les risques pour l'économie étaient orientés vers la faiblesse.,2.588
"""Il y a un réel potentiel d'effondrement secondaire"", a déclaré le gouvernement James McGreevey.","La zone endommagée du garage n'était pas stable, avec ""un réel potentiel d'effondrement secondaire"", a déclaré M. McGreevey.",3.6
"HP a vu ses ventes de serveurs Unix chuter de 3,6 %, à 1,36 milliard de dollars.","HP est tombé à la deuxième place avec des ventes de serveurs en hausse de 0,4 %, à 2,9 milliards de dollars.",2.333
"""Les gens sont manifestement incommodés"", a déclaré le Dr Jim Young, commissaire à la sécurité publique de l'Ontario.","""Nous sommes hyper vigilants"", a déclaré le Dr James Young, commissaire à la sécurité publique de l'Ontario.",2.25
"Les autres ont reçu des exemplaires de la ""Nouvelle révolution alimentaire du Dr Atkins"" et ont été invités à la suivre.","Les chercheurs ont donné des copies de ""La nouvelle révolution alimentaire du Dr Atkins"" aux coupeurs de carburateurs.",2.5
"L'avocat du rappeur, Mark Gann, n'a pas répondu aux appels de commentaires.","L'avocat du rappeur de 27 ans dans l'affaire civile, Mark Gann, n'a pas répondu aux appels de commentaires.",4.5
"La nouvelle selon laquelle General Motors GM.N prévoit d'émettre 10 milliards de dollars de dettes, en partie pour combler un trou dans son plan de retraite, a également pesé sur le marché.","La nouvelle selon laquelle General Motors GM.N allait émettre 10 milliards de dollars de dettes, en partie pour combler un trou dans son plan de retraite, a également fait mal.",4.75
Russin n'a pas fait de commentaires ; son avocat n'a pas assisté à l'audience et n'a pas répondu aux messages téléphoniques.,"Son avocat, un cousin, Basil Russin, n'a pas assisté à l'audience et n'a pas répondu aux messages téléphoniques.",3.4
"Les recettes tirées des licences ont toutefois chuté de 21 %, à 107,6 millions de dollars.","Les ventes de licences, une mesure clé de la demande, ont chuté de 21 % pour atteindre 107,6 millions de dollars.",4.0
"Les Hispaniques, le groupe ethnique qui se développe le plus rapidement aux États-Unis, ont dépassé les Noirs pour devenir la plus grande minorité aux États-Unis, selon les chiffres du gouvernement récemment publiés.","Les Hispaniques ont officiellement dépassé les Afro-Américains en tant que groupe minoritaire le plus important aux États-Unis, selon un rapport publié par le Bureau américain du recensement.",3.5
"L'évêque d'Armidale, Peter Brain, a été franc.","""Il n'a pas vraiment le choix"", a déclaré l'évêque d'Armidale, Peter Brain.",2.0
"Lorsqu'elle sera pleinement opérationnelle, l'installation devrait employer jusqu'à 1 000 personnes.","L'usine emploiera 1 000 personnes lorsqu'elle sera entièrement construite, a déclaré la société.",4.0
L'indice BTK de la Bourse américaine a fait un bond de 5 %.,"L'indice des semi-conducteurs .SOXX de la Bourse de Philadelphie a fait un bond de 6,10 %.",1.4
"""Je l'aimais vraiment et je l'aime toujours"", a déclaré Cohen Alon au Herald hier.","Et je l'aimais beaucoup, et je l'aime toujours.",3.2
"Sur l'ensemble de la période de 12 mois se terminant le 30 juin 2003, les lignes de services avancés pour l'ADSL ont augmenté de 37 % et les connexions par modem câble de 75 %.","Pour la période de 12 mois se terminant le 30 juin, les lignes à grande vitesse installées dans les foyers et les entreprises ont augmenté de 45 %.",1.8
"Le commissaire d'État à l'éducation, Kent King, a déclaré mercredi que les résultats des tests du Missouri Assessment Program l'avaient déçu.","Le commissaire à l'éducation du Missouri, Kent King, s'est dit déçu par les résultats.",3.2
Les agents ont trouvé plus de 1 000 cartes de crédit et duplicateurs de cartes de crédit lors d'une recherche à l'adresse de Ragin.,"Lorsque l'adresse de Ragin a été perquisitionnée, les autorités ont trouvé plus de 1 000 cartes de crédit et des duplicateurs.",4.8
"Lowe's, qui compte environ la moitié moins de magasins, a enregistré une augmentation de 33 % de ses bénéfices au troisième trimestre, après un bond de 12 % des ventes dans les mêmes magasins.","Home Depot a annoncé une hausse de 22 % de ses bénéfices au troisième trimestre, après une augmentation de près de 8 % des ventes dans les mêmes magasins.",1.4
Caldera a acquis le logiciel de serveur Unix du SCO initial et a changé son nom en groupe SCO.,"SCO a changé son nom en Tarantella, et Caldera a ensuite changé son nom en groupe SCO.",2.6
"Les officiers l'ont jeté à terre et l'ont menotté, et Reyna lui a mis un genou dans le dos, selon le témoignage.","C'est alors que les officiers l'ont jeté à terre et lui ont passé les menottes, selon le témoignage.",3.25
"Le titre le plus performant a été celui d'Altria Group Inc. qui a augmenté de plus de 27 % pour clôturer à 42,31 dollars l'action.","Altria Group Inc. Le MO.N a baissé de 50 cents, soit 1,2 %, pour atteindre 41,81 dollars.",1.75
"Les autorités essaient de récupérer les corps dans l'eau"", a déclaré l'officier de police J.D. Tambe à Reuters, ajoutant que 26 des morts étaient des femmes.","Les fonctionnaires essaient de récupérer les corps dans l'eau"", a déclaré à Reuters le fonctionnaire de police J.D. Tambe.",3.0
"Selon une étude de marché réalisée par The NPD Group, le nombre de personnes qui téléchargent de la musique est passé de 14,5 millions en avril à 10,4 millions en juin.","Le nombre de ménages qui acquièrent de la musique est passé d'un maximum de 14,5 millions en avril à 12,7 millions en mai et 10,4 millions en juin, selon le NPD.",3.5
"""C'est un cas facile à mes yeux et totalement sans fondement, tant sur le plan des faits que sur celui du droit.""","""Cette affaire est totalement sans fondement, tant sur le plan factuel que juridique"", s'est moqué le juge Denny Chin.",3.25
Le service météorologique a signalé des vents maximums soutenus de près de 105 miles à l'heure avec des rafales plus fortes.,"Les vents maximums soutenus étaient d'environ 40 mph, avec des rafales plus fortes.",2.25
"Les pots WiFi devaient être dévoilés cet été, lors de festivals de musique en Grande-Bretagne.",Le premier pot-portail du monde allait bientôt être déployé lors des festivals d'été en Grande-Bretagne.,4.0
"Les hommes qui boivent du thé, en particulier du thé vert, peuvent réduire considérablement leur risque de cancer de la prostate, selon une étude marquante de WA.","Boire du thé vert peut réduire considérablement le risque que les hommes contractent un cancer de la prostate, a découvert une étude menée par des chercheurs australiens.",4.25
Les prévisionnistes ont dit que les avertissements pourraient augmenter pour Cuba plus tard jeudi.,Des veilles ou des avertissements pourraient être émis pour l'est de Cuba plus tard dans la journée de jeudi.,4.0
Les chiites représentent 20 % de la population du pays.,"Les sunnites représentent 77 % de la population pakistanaise, les chiites 20 %.",3.0
"La CWA, qui représente plus de 2 300 employés de Comcast, a qualifié cela d'excessif alors qu'un employé syndiqué typique gagne environ 27 000 dollars par an.","Le Syndicat des travailleurs des communications, qui représente plus de 2 300 employés de Comcast, a qualifié le salaire des cadres d'excessif alors qu'un employé syndiqué typique gagne environ 27 000 dollars par an.",3.4
"Le groupe de consommateurs a généré 4,47 milliards de dollars de bénéfices et 20 milliards de dollars de revenus de janvier à juin, soit 53 % des bénéfices et des revenus de Citigroup.","Elle a généré 4,47 milliards de dollars de bénéfices et 20 milliards de dollars de recettes au cours du premier semestre de l'année, soit 53 % du total de Citigroup.",3.8
"GALLOWAY TOWNSHIP, N.J. Annika Sorenstam a attiré les foules, Michelle Wie a fait de la publicité mais Angela Stanford a remporté sa première victoire en LPGA.","GALLOWAY TOWNSHIP, N.J. >> Annika Sorenstam et Michelle Wie ont attiré les foules, mais Angela Stanford a remporté sa première victoire en LPGA.",4.0
Les liaisons New York-Londres de British Airways prendront fin en octobre.,British Airways prévoit de retirer ses sept Concordes à la fin du mois d'octobre.,2.5
"La nouvelle politique accorde le plus grand poids aux notes, aux résultats des tests et au programme d'études secondaires d'un élève.","Les résultats scolaires - y compris les notes, les résultats aux tests et le programme d'études secondaires - bénéficient de la plus haute priorité.",4.5
