Un avion est en train de décoller.,Un avion est en train de décoller.,5.0
Un homme joue d'une grande flûte.,Un homme joue de la flûte.,3.8
Un homme étale du fromage râpé sur une pizza.,Un homme étale du fromage râpé sur une pizza non cuite.,3.8
Trois hommes jouent aux échecs.,Deux hommes jouent aux échecs.,2.6
Un homme joue du violoncelle.,Un homme assis joue du violoncelle.,4.25
Certains hommes se battent.,Deux hommes se battent.,4.25
Un homme est en train de fumer.,Un homme fait du patinage.,0.5
L'homme joue du piano.,L'homme joue de la guitare.,1.6
Un homme joue de la guitare et chante.,Une femme joue de la guitare acoustique et chante.,2.2
Une personne jette un chat au plafond.,Une personne jette un chat au plafond.,5.0
L'homme a frappé l'autre homme avec un bâton.,L'homme a donné une fessée à l'autre homme avec un bâton.,4.2
Une femme prend et tient un bébé kangourou.,Une femme prend et tient un bébé kangourou dans ses bras.,4.6
Un homme joue de la flûte.,Un homme joue de la flûte de bambou.,3.867
Une personne est en train de plier un morceau de papier.,Quelqu'un est en train de plier un morceau de papier.,4.667
Un homme court sur la route.,Un chien panda court sur la route.,1.667
Un chien essaie de se débarrasser de son bacon.,Un chien essaie de manger le bacon sur son dos.,3.75
L'ours polaire glisse sur la neige.,Un ours polaire glisse sur la neige.,5.0
Une femme est en train d'écrire.,Une femme nage.,0.5
Un chat se frotte au visage de bébé.,Un chat se frotte contre un bébé.,3.8
L'homme est à cheval.,Un homme est monté sur un cheval.,5.0
Un homme verse de l'huile dans un pot.,Un homme verse du vin dans un pot.,3.2
Un homme joue de la guitare.,Une fille joue de la guitare.,2.8
Un panda glisse sur un toboggan.,Un panda glisse sur un toboggan.,4.6
Une femme est en train de manger quelque chose.,Une femme mange de la viande.,3.0
Une femme épluche une pomme de terre.,Une femme épluche une pomme de terre.,5.0
Le garçon est tombé de son vélo.,Un garçon tombe de son vélo.,4.8
La femme joue de la flûte.,Une femme joue de la flûte.,5.0
Un lapin court après un aigle.,Un lièvre court devant un aigle.,4.2
La femme fait frire une côtelette de porc panée.,Une femme prépare une côtelette de porc panée.,4.2
Une fille fait voler un cerf-volant.,Une fille qui court fait voler un cerf-volant.,4.0
Un homme monte un taureau mécanique.,Un homme était à cheval sur un taureau mécanique.,4.0
L'homme joue de la guitare.,Un homme joue de la guitare.,4.909
Une femme danse et chante avec d'autres femmes.,Une femme danse et chante sous la pluie.,3.0
Un homme est en train de couper un petit pain.,Un homme coupe un oignon en tranches.,2.4
Un homme verse de l'huile dans une casserole.,Un homme verse de l'huile dans une poêle.,4.2
Un lion joue avec les gens.,Un lion joue avec deux hommes.,3.4
Un chien fait du skateboard.,Un chien fait du skateboard.,5.0
Quelqu'un est en train de sculpter une statue.,Un homme est en train de sculpter une statue.,3.75
Une femme coupe un oignon.,Un homme est en train de couper un oignon.,2.75
Une femme épluche des crevettes.,Une femme est en train de peler des crevettes.,5.0
Une femme fait frire du poisson.,Une femme fait cuire du poisson.,4.0
Une femme joue de la guitare électrique.,Une femme joue de la guitare.,3.6
Un bébé tigre joue avec une balle.,Un bébé joue avec une poupée.,1.6
Une personne coupe une tomate en tranches.,Une personne coupe de la viande en tranches.,1.75
Une personne coupe un oignon.,Une personne est en train de couper un oignon.,5.0
Un homme joue du piano.,Une femme joue du violon.,1.0
Une femme joue de la flûte.,Un homme joue de la guitare.,1.0
Un homme est en train de couper une pomme de terre.,Un homme est en train de couper des carottes.,2.375
Un enfant joue de la guitare.,Un garçon joue de la guitare.,3.8
Un garçon joue de la guitare.,Un homme joue de la guitare.,3.2
Un homme joue de la guitare.,Un garçon joue de la guitare.,3.2
Un petit garçon joue du clavier.,Un garçon joue au clavier.,4.4
Un homme joue de la guitare.,Un homme joue de la guitare électrique.,3.75
Un chien lèche un bébé.,Un chien est en train de lécher un bébé.,4.75
Une femme coupe un oignon.,Un homme est en train de couper et d'ogner.,3.2
Un homme joue de la guitare.,Un homme joue de la batterie.,1.556
Une femme est en train de couper un poivron.,Une femme coupe un poivron rouge.,3.938
Un homme joue de la batterie.,Un homme joue du tambour.,5.0
Une femme monte à cheval.,Une femme monte à cheval.,5.0
Un homme mange une banane près d'un arbre.,Un homme mange une banane.,4.0
Un chat joue sur un clavier.,Un homme joue de deux claviers.,1.6
Un homme abat un arbre avec une hache.,Un homme a coupé un arbre avec une hache.,4.75
Un enfant joue avec un téléphone jouet.,Un petit garçon joue avec un téléphone jouet.,3.5
Un homme conduit une moto.,Un homme est à cheval.,1.4
Un homme conduit une moto.,Un homme est à cheval.,1.4
Un écureuil tourne en rond.,Un écureuil tourne en rond.,4.0
Un homme et une femme s'embrassent.,Un homme et une femme s'embrassent.,5.0
Un homme monte dans une voiture.,Un homme monte dans une voiture dans un garage.,3.833
Un homme est en train de danser.,Un homme parle.,0.6
Un homme joue de la guitare et chante.,Un homme joue de la guitare.,2.917
Une personne coupe des champignons.,Une personne coupe des champignons avec un couteau.,4.2
Un bébé tigre fait un bruit.,Un tigre se promène.,2.0
Une personne coupe des oignons.,Une personne est en train de peler un oignon.,2.6
Un homme joue du piano.,Un homme joue de la trompette.,1.6
Une femme épluche une pomme de terre.,Une femme épluche une pomme.,2.0
Un pankda mange du bambou.,Un panda est en train de manger du bambou.,4.2
Une personne est en train de peler un oignon.,Une personne est en train d'éplucher une aubergine.,2.0
Un singe pousse un autre singe.,Le singe a poussé l'autre singe.,4.8
Un écureuil tourne en rond.,Un écureuil tourne en rond.,4.4
Un homme est en train de lacer sa chaussure.,Un homme attache sa chaussure.,5.0
Un garçon chante et joue du piano.,Un garçon joue du piano.,3.0
Un chien mange de la pastèque.,Un chien mange un morceau de pastèque.,4.25
Une femme est en train de couper des brocolis.,Une femme coupe des brocolis avec un couteau.,4.25
Un homme est en train d'éplucher une pomme de terre.,Un homme a épluché une pomme de terre.,3.8
Une femme joue de la guitare.,Un homme joue de la guitare.,2.4
Une femme est en train de couper une tomate.,Un homme est en train de couper un oignon.,1.6
Un homme nage sous l'eau.,Une femme nage sous l'eau.,2.0
Un homme et une femme se parlent.,Un homme et une femme mangent.,1.6
Un petit chien poursuit une balle de yoga.,Un chien poursuit une balle.,4.0
Les hommes jouent au cricket.,Les hommes jouent au basket-ball.,2.2
Un homme part en moto.,Un homme est à moto.,4.4
Un homme joue de la guitare.,Un homme chante et joue de la guitare.,3.6
L'homme a parlé au téléphone.,L'homme parle au téléphone.,3.6
Un homme est en train de pêcher.,Un homme fait de l'exercice.,0.5
Un homme est en lévitation.,Un homme parle.,0.8
Deux garçons conduisent.,Deux baies dansent.,0.6
Un homme est monté sur un cheval.,Une fille monte à cheval.,2.6
Un homme est à vélo.,Un singe fait du vélo.,2.0
Un homme est en train de couper des pommes de terre.,Une femme épluche une pomme de terre.,2.2
Une femme épluche une pomme de terre.,Un homme coupe une pomme de terre.,2.4
Un homme joue de la guitare.,Someoen joue de la guitare.,3.6
Une femme est en train de couper un poireau.,Une femme est en train de couper du gingembre.,2.2
L'homme a coupé une assiette en papier.,Un homme coupe une assiette en papier.,4.8
L'homme joue de la guitare.,Un homme joue de la flûte.,1.643
Un homme joue du piano.,L'homme joue du violon.,1.75
Une femme est en train de découper de la viande.,Une femme est en train de paner un peu de viande.,2.25
Un homme joue sur son clavier.,Un homme joue d'un piano à clavier.,4.0
La dame a coupé les oignons verts.,La dame a coupé un oignon vert.,4.8
Quelqu'un met des nouilles dans l'eau.,Une femme fait bouillir des nouilles dans de l'eau.,3.2
Lionel Richie danse au plafond.,Lionel Ritchie danse debout au plafond.,4.0
Un homme joue du piano.,Une personne joue du piano.,4.4
Une femme joue de la flûte.,Une femme joue de la flûte.,4.6
Un garçon vérifie un calendrier.,Un garçon regarde un calendrier.,3.8
Une femme est en train de couper un oignon.,Une femme est en train de couper des oignons.,4.8
Un homme joue de la guitare.,Un homme joue de la guitare.,4.857
Une femme utilise une machine à coudre.,Une femme est en train de coudre sur une machine.,5.0
Une femme fait des crêpes.,Un chef de bande dessinée fait des crêpes.,2.533
Un homme court sur la route.,Une voiture est en train de rouler sur la route.,1.0
Un homme est monté sur un cheval.,Un homme parle au téléphone.,1.0
Un homme est à vélo.,Un homme est monté sur un cheval.,2.0
Une femme est en train de danser.,Un homme est en train de manger.,0.143
Un homme joue du piano.,Un homme joue de la flûte.,2.0
Un homme joue de la flûte.,Un homme joue du piano.,1.6
Un homme tourne.,Un homme est en train de danser.,1.6
Un singe se balance de membre en membre.,Un singe se balance d'arbre en arbre.,3.4
Les gens sont descendus du train.,Les gens sont descendus du train à la gare.,4.0
Un chien saute sur un trampoline.,Un chien rebondit sur un trampoline.,4.8
Un garçon joue d'un instrument.,Un homme joue de la trompette.,2.5
Une femme joue de la guitare.,Un homme chante et joue de la guitare.,1.75
Une femme choisit une boîte de conserve.,Une femme coupe une tomate.,1.0
Un homme est en train de grimper à une corde.,Un homme grimpe sur une corde.,5.0
Un homme soulève une voiture.,Un homme est en train d'escalader un mur.,1.4
Un homme et une femme descendent la rue dans une jeep.,Un homme et une femme roulent sur la route dans un véhicule en plein air.,4.0
L'homme torse nu s'est assis sur une chaise.,Un homme torse nu est assis sur une chaise.,3.8
Deux femmes luttent.,Deux femmes se battent sur le sol.,4.0
Le chiot jouait avec une balle de tennis bleue.,Un chiot joue avec une balle de tennis.,4.0
Un kangourou est en train de manger quelque chose.,Un kangourou est en train de manger.,4.8
Un chat joue du piano.,Un homme joue de la guitare.,0.6
L'homme a coupé du tapis avec un couteau.,Un homme coupe un tapis avec un couteau.,4.75
Une femme conduit un scooter motorisé sur une route.,Un homme conduit un scooter.,2.2
quelqu'un coupe un légume.,Quelqu'un est en train de couper une tomate.,3.0
Une femme est en train de danser.,Un homme parle.,0.0
Un chien lèche la bave d'un bébé.,Un chien lèche un bébé.,2.2
Un homme rame sur un bateau.,Un homme coupe une tomate en tranches.,0.4
Un homme coupe des pommes de terre.,Un homme coupe des pommes de terre.,4.8
Une femme est en train de hacher de l'ail.,La femme coupe l'ail en dés.,4.8
Un animal tourne en rond.,Un écureuil tourne en rond.,3.8
Un homme marche lentement sur un pont de corde.,Un garçon marche sur un pont.,3.0
Un homme joue de la guitare.,Un homme assis dans une pièce joue de la guitare.,4.0
Un homme joue de la flûte.,Un homme joue de la flûte.,5.0
Une femme casse deux œufs dans un bol en verre.,Une femme casse un œuf dans un bol.,3.8
Un homme coupe un poisson.,Un homme étripe un poisson.,3.0
Deux hommes font leurs valises dans le coffre d'une voiture.,Les hommes mettent des valises dans le coffre de la voiture.,4.4
Un homme verse de l'huile sur des tomates.,L'homme a versé de l'huile sur les tomates coupées.,3.8
Un homme est en train de découper quelque chose.,Un homme est en train de couper un petit pain.,3.0
Un homme pagaie dans un canoë.,Un homme joue de la harpe.,0.667
Un homme et une femme marchent ensemble à travers les bois.,Un homme et une femme marchent bras dessus bras dessous dans une zone boisée.,4.0
La femme a ramassé le kangourou.,Une femme ramasse un bébé kangourou.,3.75
Les poissons nagent.,Un poisson nage.,4.133
Deux femmes mélangent quelque chose dans un robot ménager.,Deux femmes font quelque chose dans un mixeur.,4.0
Une personne surfe sur une grande vague.,Une personne est en train de surfer.,3.6
Un homme joue de la guitare.,Un homme poignarde une cible.,1.2
Un homme joue de la flûte dans un groupe.,Un homme joue de la guitare.,1.6
L'homme a étalé du beurre sur la miche de pain.,Un homme étend du beurre sur du pain.,4.0
Une personne fait bouillir des nouilles.,Une femme fait bouillir des nouilles dans de l'eau.,4.0
Un groupe de personnes danse sur une colline.,Un groupe de personnes est en train de danser.,3.2
Un homme est en train de danser dehors.,Un homme joue de la flûte.,1.0
Une femme nourrit un homme.,Une femme est en train de mélanger de la viande.,1.0
Un homme met une casserole dans un four.,Une femme est en train de couper un oignon.,0.6
Une femme est assise à un bureau.,Une femme monte un âne.,0.4
Les médecins transportent un patient sur un brancard.,Un médecin précipite un patient sur une civière.,3.4
Une femme joue de la flûte sur scène.,La femme joue de la flûte.,3.6
Deux bébés pandas jouent.,Deux pandas sont couchés ensemble.,3.0
Un bébé rit.,Un bébé rit et glousse.,4.0
Un homme joue de la guitare.,Un garçon joue du piano.,1.2
Un homme est en train de plier du papier.,Une femme est en train de couper un poivron.,0.6
Trois femmes dansent.,L'homme est en train de danser.,1.6
Les chats jouent entre eux.,Deux chats s'affrontent.,2.6
Une personne est en train d'écrire.,Une personne écrit avec un crayon.,3.6
Un homme est en train de courir.,Un homme est en train de courir sur une route.,3.5
La femme est en train de rouler la pâte.,Une femme est en train de fariner et de rouler la pâte.,3.765
Une femme ajoute des épices sur une viande.,Une femme ajoute du sucre à la viande.,2.75
Une femme ajoute de l'huile sur des poissons.,Une femme verse de l'eau sur des poissons.,2.25
Un jeune garçon tient une guitare.,Un petit garçon joue de la guitare.,2.75
Un guépard est en train de courir.,Un guépard court à travers un champ.,3.8
L'homme mange une pizza.,Un homme mange une tranche de pizza.,4.8
Un orang-outan est dans un bus.,Un singe monte dans un bus.,3.6
Un homme et une femme discutent dans un restaurant.,Un homme et une femme sont à vélo.,1.2
Un homme joue de la guitare.,Un homme est en train de nettoyer une porte en verre.,0.4
Une fille chante et joue de la guitare.,Un jeune homme chante tout en jouant de la guitare.,2.4
Une fille communique avec le langage des signes.,Une jeune fille utilise le langage des signes.,3.941
Une femme fait des exercices de musculation.,Une femme se coiffe.,0.5
Un homme monte dans une voiture.,Un homme âgé monte dans une voiture rouge.,3.75
Une grosse balle verte renverse une pomme de terre.,Une grosse balle verte frappe une pomme de terre.,4.0
Un chat joue des claviers.,Un chat joue du piano.,3.0
Deux chiens nagent dans une piscine.,Les chiens nagent dans une piscine.,4.2
L'homme a utilisé un hachoir pour couper l'oignon.,L'homme a utilisé une machine pour hacher une pomme de terre.,2.0
Une femme coupe du tofu.,Une femme est en train de couper du tofu.,5.0
Un troupeau de cerfs traverse la rue.,Un troupeau de caribous traverse une route.,3.0
La personne est à cheval.,Un homme est à cheval.,3.8
Quelqu'un nourrit un animal.,Quelqu'un joue du piano.,0.0
Quelqu'un coupe des tortillas.,Quelqu'un monte à cheval.,0.0
Quelqu'un mélange les ingrédients.,Quelqu'un est en train de coudre des choses.,0.25
Un coq picore une souris morte.,Un poulet picore une souris morte.,4.0
Une femme tient un kangourou.,Une femme est en train de ramasser un kangourou.,3.25
Un homme joue avec des grenouilles,Un chat joue avec un appareil photo.,0.75
Deux hommes parlent.,Deux hommes jouent de la guitare.,1.5
Un homme étend du beurre sur un gros morceau de pain.,Un homme enduit du beurre sur une tranche de pain à l'ail.,3.5
Un homme court à travers un haut fil.,Un homme court sur une corde.,3.0
Un homme est en train de tondre une pelouse.,Une femme coupe un citron.,0.2
Un homme ouvre une porte.,Un homme joue de la guitare.,0.8
Un homme coupe une pomme de terre en morceaux.,Un homme coupe une pomme de terre.,4.2
La femme coupe un poulpe cuit.,Une femme est en train de découper un poulpe.,3.8
Un homme est en train de percer des planches.,Un chien court dans l'eau.,0.4
Un homme est en train de danser.,Un homme mange du pain.,0.8
Quelqu'un joue du piano.,Un homme joue de la guitare.,1.2
Deux renards mangent dans une assiette sur un patio en briques.,Les renards mangent dans une assiette.,2.8
Un garçon joue au clavier.,Un garçon joue du piano.,3.2
Une personne joue au clavier.,Quelqu'un joue du clavier.,5.0
Un homme tire au fusil.,Un homme est en train de cracher.,0.0
Quelqu'un est en train de couper un oignon.,Someoen est en train de peler une pomme de terre.,1.0
Un homme est en train de nager.,Une femme est en train de couper de la viande.,0.0
Un homme joue de la guitare.,Un homme joue d'une guitare acoustique.,3.75
Une femme coupe une citrouille.,Une femme monte un éléphant.,0.4
Une femme est en train de danser.,Une femme pétrit la pâte.,0.4
Une femme casse des œufs dans un bol.,Une femme place des brochettes sur une étagère.,0.6
Une voiture se déplace sur une route.,Une voiture est en train de rouler sur la route.,4.0
Quelqu'un graisse une casserole.,Smeone est en train de se coucher.,0.4
Un homme joue de la guitare.,Un homme est en train d'égoutter des pâtes.,0.4
Une femme boit de la vodka.,Une femme fait de l'exercice.,0.4
Une femme coupe de la viande en morceaux.,Une femme est en train de découper de la viande.,4.8
Un homme est en train de rincer un steak.,Un homme joue de la guitare.,0.6
Un homme vend des objets.,Un homme nettoie la maison.,0.8
Un homme saute un mur.,Un homme saute sur un court mur.,3.2
Les coureurs font la course autour d'une piste.,Les coureurs s'affrontent dans une course.,3.2
Un homme donne un coup de pied dans un ballon de foot.,Un homme est en train de mélanger un bol.,0.6
Une femme est en train de faire frire quelque chose.,Une femme monte à cheval.,0.6
Un chat lèche une ventouse.,Une femme est en train de couper un concombre.,0.0
Une femme danse près d'un feu.,Une femme prend un bain.,1.4
L'homme est en train d'ouvrir un poisson.,Un homme coupe une pomme de terre en tranches.,2.2
Le beurre fond dans une casserole.,Un homme fait fondre du beurre dans une poêle.,3.6
Trois garçons sont en train de danser.,Les enfants dansent.,3.111
Une femme joue un jeu avec un homme.,Un homme joue du piano.,0.6
L'homme conduit une voiture blanche.,Un homme donne une interview.,0.4
Un homme conduisait sa voiture.,Un homme conduit une voiture.,4.25
Une voiture recule d'un espace.,Une voiture sort d'une voie bloquée.,3.0
Un homme met du fromage sur une pizza.,L'homme a saupoudré du fromage sur la pizza.,5.0
Le garçon joue du piano.,Un garçon joue du piano.,5.0
L'homme jouait de la guitare.,Un homme joue de la guitare.,3.75
Un homme est à cheval.,Un homme joue du clavier.,0.2
Un homme marche sur une corde.,Un homme est à cheval sur un mo-pad.,0.4
Une fille joue de la flûte.,Un groupe joue sur une scène.,1.286
Les gens descendent d'un train.,Un groupe de personnes descend d'un train.,4.6
Une femme est en train de coudre sur une machine.,Une femme est en train de paner un peu de viande.,0.6
Un chien regarde dans la piscine.,Un chien se promène autour d'une piscine.,2.0
Un homme est en train de beurrer un morceau de pain.,Un homme applique du beurre sur du pain.,5.0
Un homme coupe des tomates en morceaux.,Une femme est en train de couper des légumes.,1.8
Trois adolescentes ont dansé dans la salle.,Des adolescentes dansent pour la caméra.,2.4
Un lion marche.,Un lion fait les cent pas dans un enclos.,2.4
Un homme qui tire sur une voiture.,Un homme coupe une pomme de terre.,0.4
Un cheval noir court partout.,Le cheval court.,4.2
Une femme est en train de déveiner des crevettes.,Un homme danse sous la pluie.,0.0
Un homme est à cheval.,Une femme est en train de laver un congélateur.,0.0
Un homme marche sur un chemin.,Un homme marche sur une corde tendue.,0.8
Un homme coupe une pomme de terre en tranches.,Une femme coupe un jalapeño.,1.4
Un chien aboie à un ballon.,Un chien nage après une balle de tennis.,1.5
Un enfant fuit un poisson qui se balance sur une canne à pêche.,Un petit enfant court autour d'une canne à pêche.,2.5
Un homme marche sur un chemin à travers la nature sauvage.,Un homme marche sur une route.,2.5
Un homme âgé s'exprime sur un podium.,Un homme fait un discours à la tribune.,3.5
Un homme monté sur un cheval au ralenti.,Un homme est monté sur un cheval.,3.4
Une personne est en train de couper du fromage burrata.,La personne est en train de trancher du fromage.,3.8
L'homme tire avec un fusil automatique.,Un homme tire au fusil.,3.8
Un homme écrase de l'ail avec le dos d'un couteau.,Une femme coupe de la viande avec un couteau.,1.5
Une femme lime ses ongles avec une planche à émeri.,Une femme nourrit son bébé avec un biberon.,0.5
Un homme fait du skateboard.,Une femme coupe une pomme de terre.,0.0
Une femme prend une douche.,Un homme monte un cheval blanc.,0.0
Un homme est en train de danser.,Un homme est à cheval.,0.8
Un homme rame sur un bateau.,Un homme tire au fusil.,0.85
Un homme se balance à l'aide d'une corde attachée au plafond.,Un homme se balance sur une corde.,3.4
Une femme monte à cheval sur une plage.,Un homme porte un autre homme sur son dos.,0.4
Un homme tient un petit animal dans une main.,Un homme montre un petit singe.,1.75
Une personne plie un morceau de papier carré.,Un homme est en train de plier du papier.,3.25
Une personne fait frire de la viande dans une poêle.,Une personne tient une moufette.,0.75
Un chimpanzé fait du mal à une femme.,Un homme conduit une voiture.,0.0
La femme est en train de peler des crevettes.,L'homme tient un lémurien.,0.0
Deux zèbres jouent.,Les zèbres se socialisent.,4.25
Une femme est en train de couper du beurre.,Une femme coupe du tofu.,1.8
Certains hommes jouent de la guitare.,Trois hommes jouent de la guitare et chantent ensemble.,3.2
Les éléphants se sont aspergés d'eau.,Les éléphants s'aspergent d'eau.,3.6
Un chien s'est assis au comptoir d'un magasin.,Le chien est debout au comptoir.,2.6
Quelqu'un perce un trou dans une bande de bois avec une perceuse électrique.,Un homme perce un trou dans un morceau de bois.,3.2
Une femme est en train de couper des légumes.,La femme coupe l'ail en dés.,2.8
Un blaireau est en train de creuser un trou.,Un blaireau est en train de creuser la terre.,4.6
Une femme fait du ski nautique sur un lac.,Un homme joue de la flûte.,0.0
Une fille joue du violon.,Un bébé rit et glousse.,0.25
Un hélicoptère se pose sur un héliport.,Un hélicoptère se pose.,3.923
Une femme est en train de découper un poulet.,Une femme est en train de couper de la viande.,2.75
Une femme est en train de couper un concombre.,Un homme joue de la guitare.,0.0
Une femme monte un éléphant devant une foule en adoration.,Une femme monte un éléphant.,3.0
Un chiot glisse à reculons sur le sol.,Un chiot se pousse en arrière.,3.8
Une femme fend des gousses d'ail.,Une femme casse une tête d'ail en gousse.,4.6
Un chien regarde dans la piscine.,Un chien se promène au bord d'une piscine.,2.6
Une femme mélange un soin de beauté dans un verre.,Une femme mélange une crème dans un verre avec une cuillère.,3.6
Un homme est en train de faire un dessin.,Une personne est en train de dessiner.,3.6
Une femme cueille des tomates.,Une femme verse de la pâte dans un bol.,1.0
Un homme regarde un écran d'ordinateur.,Un homme utilise un ordinateur portable.,2.75
Le garçon est sur un tricycle.,Une femme conduit un scooter des mers.,1.25
Deux hommes s'affrontent dans une course au roulement de pneus.,Deux personnes ont retourné des pneus de tracteur dans une course.,2.75
Une personne est en train de couper une viande.,Une personne chevauchant un taureau mécanique,0.0
Un homme joue du violon.,Une femme utilise une machine à coudre.,0.0
Le bébé a rampé dans l'embrasure de la porte.,Un bébé rampe sur le sol.,2.4
Un homme joue du clavier.,Une personne joue du piano.,2.2
Un homme sent deux pizzas.,Une femme nourrit un homme.,0.2
Un singe tire la queue d'un chien.,Un singe taquine un chien au zoo.,2.8
Un chien est couché sur le dos sur un plancher de bois.,Un chien est couché sur le sol.,4.0
Une femme fait frire quelque chose dans la poêle.,Un homme joue de la guitare.,0.0
Un homme met de l'assaisonnement dans un bol d'eau.,L'homme a ajouté de l'assaisonnement à l'eau dans un bol.,5.0
Une femme âgée verse de l'huile dans une poêle à frire.,Un homme ligoté se met à l'eau.,0.0
Une femme est en train de couper un oignon.,Une femme coupe partiellement un oignon en deux.,3.2
La femme a ramassé le kangourou.,Une femme porte un kangourou.,3.5
Un chien qui mord sur une boîte de conserve.,Un chien ouvre une boîte de nourriture.,1.75
Une femme est en train de désosser un poisson.,Un homme attrape un poisson.,1.25
Un homme tond l'herbe.,Un homme est en train de briser du béton.,0.833
Un chat regarde la télévision.,Un homme est en train de couper un congé.,0.0
Le garçon est coincé dans la porte de la niche.,Un enfant est coincé dans une niche pour chien.,3.75
Les gens se jettent dans une piscine.,Des hommes tombent dans une piscine.,2.75
Une femme nage sous l'eau.,Une femme nage.,3.8
