以色列是世界上最大的武器出口国之一：报告。,以色列是最大的武器出口国和进口国之一,3.8
埃及人将投票选举新总统,索马里议员将选举新总统,0.8
费德勒第七次夺得温网冠军,费德勒夺得第7个温网冠军,5.0
基地组织领导人呼吁在埃及绑架西方人。,基地组织领导人敦促绑架西方人。,3.6
中国股市周五收盘涨跌不一,中国股市周五午间收高,2.6
43人在巴士事故中丧生,印度有15人死于车祸,1.6
普京宣誓就任俄罗斯总统,普京宣誓就任俄罗斯总统，任期6年。,4.0
中国3月贸易恢复顺差,特拉维夫南部恢复了紧张的平静,0.0
副总统辩论的亮点,总统辩论的五个看点,2.2
全集。 夜线6/29：凯蒂-霍姆斯、汤姆-克鲁斯将离婚,克鲁斯-霍尔姆斯离婚案中，监护权、图像都是关键。,1.4
叙利亚政权否认在胡拉大屠杀中的作用。,叙利亚指责反叛分子屠杀了100多人的胡拉。,3.0
南苏丹指责苏丹在会谈前发生爆炸事件,S. 苏丹指责苏丹爆炸事件对谈判造成打击,4.4
巴基斯坦9人在枪击事件中丧生,乌克兰有500万公民获得非正式工资,0.0
叙利亚要求保证，叛军称和平计划注定失败。,叙利亚要求书面保证撤军,3.2
明尼苏达州码头在疏散后重新开放,明尼。 袋子导致疏散后，航站楼重新开放。,3.8
高尔夫：维斯特伍德在迪拜沙漠精英赛中领先,韦斯特伍德在迪拜沙漠精英赛前,4.0
苏丹因反伊斯兰教电影而封杀YouTube。,巴基斯坦总理因反伊斯兰教电影下令YouTube停播。,2.8
俄罗斯总统选举投票开始,塞内加尔总统选举投票结束,1.4
查韦斯再次前往古巴接受放射治疗。,查韦斯将在古巴进行更多的放射治疗。,4.4
罗马尼亚总统宣布胜利,中国国家主席结束对丹麦的国事访问,0.6
"俄罗斯人因 ""阴部暴动 ""争议而动员支持东正教教会。",俄罗斯东正教在受到批评后，召集信众开会,3.6
克林顿登陆印度为两国关系注入活力,克林顿警告不要损害格拉明银行的利益,1.4
马里临时领导人就职,马里临时总统宣誓就职,4.2
普京宣布在俄总统选举中获胜,"普京 ""赢得 ""俄罗斯总统选举",3.8
AL再次谴责叙利亚的暴力事件,美国因叙利亚暴力事件关闭驻大马士革使馆,1.6
欧盟对阿萨德家族进行制裁,欧盟制裁阿萨德的妻子；迫击炮袭击霍姆斯省。,3.4
空军教官因强奸罪面临判刑,妇女在空军教官被判刑时作证,1.8
30多名罢工矿工被杀,南非30多名罢工矿工遇难。,3.8
铁穹号拦截17枚火箭,"""铁穹 ""拦截向贝尔谢巴发射的两枚火箭弹",2.6
"马里伊斯兰教徒摧毁 ""更多的廷巴克图神庙",马里伊斯兰主义者摧毁更多的廷巴克图圣地。,4.5
午间中国股市因PMI而收高,中国股市周四高开,1.8
科学家用史前种子复活花朵,任天堂删减红墨水，下调年内预测。,0.0
梵蒂冈泄密案中男子被定罪,"巴特勒将在 ""Vatileaks ""案中受审。",2.6
罗姆尼、保罗争夺缅因州党团选举胜利,罗姆尼在缅因州党团选举中险胜,2.8
教派冲突震撼黎巴嫩城市的黎波里,教派冲突震撼黎巴嫩城市，3人死亡,3.8
雷普索尔公司就YPF的国有化问题向阿根廷进行抨击,雷普索尔公司就石油国有化对阿根廷进行抨击,3.4
阿根廷火车失事造成数人死亡，550人受伤,布宜诺斯艾利斯火车坠毁事故49人恐怕已死亡,1.4
昂山素季将向英国议员讲话,缅甸昂山素季6月访华将在议会发言,4.0
治安官。 男子42年后找回被盗汽车,美国男子被盗42年后找回汽车,4.0
谷歌CEO称Android很重要，不是关键,拉里-佩奇说，Android很重要，不是关键,4.0
伊朗可能会减少对更多欧盟国家的石油出口,伊朗议员称准备禁止向欧盟部分国家出口石油,3.6
巴基斯坦工厂大火造成至少260人死亡。,巴基斯坦枪战中至少有6人死亡,0.8
印尼失踪飞机上的四名澳大利亚人之一,伊朗画家Mansoureh Hosseini去世。,0.0
"罗姆尼发誓要恢复 ""美国的承诺","罗姆尼承诺 ""恢复美国",3.8
桑托勒姆的3岁女儿住院,"""科尼2012 ""主任住院",0.6
曼德拉出院,以色列总统出院,1.2
贾亚-普拉达都准备加入BJP。,贾雅-普拉达可能加入BJP，阿马尔-辛格将为她做决定。,3.8
真主党的纳斯鲁拉就反伊斯兰电影向美国提出警告,真主党呼吁举行更多反伊斯兰电影抗议活动,2.8
纳达尔力压德约科维奇夺得法网第7冠,网球：纳达尔击败德约科维奇夺得蒙特卡洛冠军,3.2
育儿费用上涨近6%,"儿童保育 ""每年花费15000英镑",3.0
奥巴马敦促对欧债危机采取果断行动,奥巴马敦促欧洲迅速采取行动应对危机,3.4
牛肉汉堡粉因沙门氏菌问题被召回,巧克力粉因沙门氏菌问题被召回,1.0
奥巴马和罗姆尼为首场辩论做准备,奥巴马和罗姆尼准备辩论,4.2
在肯尼亚近海发现的第一个重要天然气,突击队员在肯尼亚最近的土地冲突中杀死38人。,0.8
红十字会工作人员在巴基斯坦遇害,被绑架的英国援助人员在巴基斯坦被杀,2.2
从加沙向以色列南部发射8枚火箭；无人受伤,来自加沙的10枚火箭弹落在以色列南部；无人受伤,3.4
美军士兵在阿富汗南部枪击事件中丧生。,五名北约士兵在阿富汗被杀,1.6
埃及总统选举投票结束,新闻发布。 也门总统选举,0.8
"警方 ""没有联系 ""萨维尔的说法",英国广播公司（BBC）面临撤销萨维尔案的质疑,1.2
欧元区失业率保持在创纪录的11%。,欧元区失业率创历史新高,3.4
詹姆斯-默多克退出BSkyB,詹姆斯-默多克辞去了在BSkyB的职务。,4.2
标志性科幻作家雷-布拉德伯里去世，享年91岁。,科幻小说传奇人物雷-布拉德伯里去世，享年91岁。,4.8
埃及总统选举5月23日至24日,2012年美国总统选举,0.6
四名法国士兵在阿富汗自杀式爆炸中丧生,四名外国士兵在阿富汗东部被杀,3.4
联合国观察员发现叙利亚大屠杀的痕迹,联合国小组调查叙利亚屠杀事件,4.0
美联社民调。 美国多数人对黑人有偏见,美联社民调：多数人对黑人有偏见,3.6
美联社资料。 红皮将交易2号选秀权,红皮队交易2号选秀权,4.2
中国称2012年国防预算将增长11.2%。,中国国防开支将增长11.2%。,4.0
伊拉克一连串爆炸事件造成至少32人死亡。,意大利强震造成至少六人死亡,0.0
厄瓜多尔总统科雷亚称未就阿桑奇庇护问题做出决定,厄瓜多尔尚未就阿桑奇的庇护问题做出决定,3.8
美国为巴基斯坦武装分子提供1千万美元的援助,美国为巴基斯坦武装分子首领提供1000万美元的援助,3.8
6名北约士兵在阿富汗简易爆炸装置袭击中丧生。,6名北约士兵在阿富汗被杀,3.8
奥萨马-本-拉登的妻子将被监禁,奥萨马-本-拉登的电影将在印度拍摄。,0.8
埃及人在具有里程碑意义的总统选举中投票,埃及人参加历史性的选举投票,4.0
扰乱航班的捷蓝航空飞行员被宣布精神失常，无罪。,导致航班中断的捷蓝航空飞行员无罪。,3.8
海啸预警。 南极洲不必惊慌,亚齐地震后的海啸警报,2.2
美国向阿富汗当局移交巴格拉姆监狱,美国将巴格拉姆监狱转交给阿富汗控制,4.8
"杰里米-亨特与 ""越界 ""的顾问保持距离。",杰里米-亨特坚持，SpAd因新闻集团的电子邮件而退出。,2.0
奥巴马赞扬美拉贸易关系,奥巴马特勤局人员被送回国,0.4
Blitzbokke被斐济人赶走了,Blitzbokke被新西兰击败,2.0
奥巴马和罗姆尼关注摇摆州,安娜团队尚未决定是否参加州民调。,0.4
"""手榴弹袭击 ""导致一人死亡，至少11人受伤。",调查对妇女的性攻击,0.2
"在叙利亚发现 ""数十具尸体",在船上又发现八具尸体,1.4
枪手被控谋杀美国黑人少年,对黑人总统下的种族关系的思考,0.8
Jonny Bairstow和Eoin Morgan在孟买为英格兰队大放异彩。,巴斯托在印度巡回赛中打出了一吨的成绩,1.8
"风力发电场开发商如何 ""利用摄影机技巧使涡轮机看起来比实际小","风力发电场开发商利用 ""技巧 ""使涡轮机看起来更小。",4.4
美军无人机在巴基斯坦击毙6名武装分子：官员们。,美国导弹在巴基斯坦造成15人死亡：官员,2.4
尼日利亚： 尼日利亚军队在学生大屠杀中40人被杀后蜂拥而至。,尼日利亚警方在大学屠杀事件后实施逮捕。,2.6
紧张的心情已经平静下来了 -- 目前: 市场因西班牙银行救助而松了一口气,西班牙获得银行救助后焦点转向希腊,2.2
据报道，叙利亚阿勒颇发生了激烈的战斗。,据报大马士革发生激烈战斗,1.4
法国称希腊必须为欧元区展现信誉,法国奥朗德支持希腊，但敦促进行可信的改革,1.8
复仇者》创下票房纪录,饥饿游戏》打破美国票房纪录,1.2
据报道，4名法国士兵在阿富汗遇害。,英国士兵在阿富汗被杀,1.0
西班牙救市困境愈发严峻,西班牙的困境更加严重,3.4
北约士兵在阿富汗死亡,两名奥地利士兵在阿富汗受伤,0.6
中国股市周三低开,中国股市周五低开,2.4
巴勒斯坦领导人谴责以色列调停人要求推翻阿巴斯的呼吁,巴勒斯坦领导人支持法塔赫-哈马斯的多哈协议,1.0
米特-罗姆尼赢得马里兰州GOP初选,罗姆尼赢得马里兰州共和党初选,4.8
男子在eBay上找到被盗42年后的汽车。,德州男子在汽车被盗42年后找到了自己的汽车。,3.6
西尔维斯特-史泰龙的儿子在好莱坞被发现死亡。,西尔维斯特-史泰龙的儿子塞奇-史泰龙被发现死在霍尔果斯,3.4
北约：4名援助人员从阿富汗叛乱分子手中获救,5名援助人员在阿富汗行动中获释,2.8
"俄罗斯将 ""阴部暴动 ""抗议的小混混关进监狱两年",俄罗斯法院将对Pussy Riot的审判做出裁决,1.8
以色列禁止德国作家格拉斯因诗而来访,以色列因诗而禁锢德国作家格拉斯,4.4
笔记》2012年8月1日的必读文章,2012年7月4日周三《笔记》必读文章,1.8
北约美军因枪杀阿富汗平民被拘留,美国称对阿富汗平民遭枪击感到悲哀,2.4
奥朗德赢得法国总统选举,东帝汶在总统选举中投票,1.6
军队。 叙利亚化学库存威胁以色列,俄罗斯告诉叙利亚化学武器威胁是不可接受的。,1.8
惠誉将福特提升至投资级,惠誉将福特信用恢复到投资级,3.6
"反对派称叙利亚和平计划条件 ""不可接受""",叙利亚和平随着最后期限的过去而破灭,2.0
希腊人抗议更多削减，发生冲突,希腊投票临近，冲突爆发,2.4
勃朗峰雪崩9死11伤4失踪,勃朗峰雪崩6人死亡，数人失踪,2.4
"塔利班冒充 ""有魅力的女人，在Facebook上进行间谍活动。",塔利班士兵在脸书上冒充美女获取部队机密。,4.6
中国活动家陈先生在美国登陆,中国活动家再次呼吁打击不公正现象,1.2
城市房间。 帝国大厦枪击案,帝国大厦外枪击案2人死亡,3.2
穆罕默德-穆尔西宣誓就任埃及总统,穆尔西宣誓就任埃及总统,4.4
袭击阿富汗境内的NATO基地，15人丧生,援助人员在阿富汗袭击中获释,1.0
也门自杀式爆炸和无人机袭击致30人死亡,伊拉克一连串袭击事件造成至少六人死亡,1.0
申奥失败后托雷斯继续前进,托雷斯获得第4名，错失第六届奥运会机会,3.0
巴基斯坦开始拆除本-拉登大院。,巴基斯坦拆除乌萨马-本-拉登的藏身之处,2.8
苏丹指责以色列向喀土穆发射武器,苏丹指责以色列空袭军火厂。,3.6
参众两院就薪资税措施达成协议,谈判者就国会薪资税减税法案达成协议,3.8
热带风暴艾萨克浇灌海地，席卷古巴。,热带风暴艾萨克威胁大坝,1.4
外国亲巴勒斯坦活动家试图进入西岸。,100名亲巴勒斯坦人士试图在艾伦比进入以色列。,2.2
世界股市因欧盟、美国刺激政策的希望而上涨,美联储刺激政策的希望，股市上涨,3.0
戈尔-维达尔去世，享年86岁：传奇作家、剧作家、政治家去世。,戈尔-维达尔(Gore Vidal)，著名作家、剧作家，86岁逝世。,4.0
希腊债务协议截止日期前世界股市下跌,希腊债务协议截止日期前亚洲股市下跌,2.4
南非警察开枪打死30名矿工,南非警方称杀死30多名矿工,4.2
艾萨克淹没海地，向古巴、佛罗里达州进发。,艾萨克接近海地无家可归的地震人口,2.4
英国向叙利亚反对派伸出援手,谁关心叙利亚人民？,1.2
奥巴马放宽对年轻移民的遣返规定,美国放宽对年轻人的驱逐规则。 纳波利塔诺,4.0
微软的Surface是对未来的一次豪赌。 分析师,微软的Surface平板电脑很有前途，但问题依然存在,3.8
"""白鬼 ""布尔格的女友被判8年","黑帮老大 ""惠特尼 ""布尔杰的女友被判8年监禁",3.6
毛里塔尼亚总统被军队枪杀,毛里塔尼亚总统遭枪击,3.8
男子在布雷维克的审判中自焚,男子在布雷维克的审判外自焚,4.6
美军无人机袭击致巴基斯坦西北部10人死亡,美军无人机在巴基斯坦击毙10名武装分子嫌疑人,3.8
"9,000名美国海军陆战队员将离开冲绳。",美海军陆战队9000人将迁出冲绳：声明。,5.0
玩具反斗城免收分期付款计划费用,沃尔玛降低了假日分期付款计划的费用。,1.8
伊朗扩大了核浓缩活动。 原子能机构的报告,伊朗加强敏感核工作--原子能机构,3.0
迪斯科女王唐娜-萨默尔去世，享年63岁。,唐娜-夏日，迪斯科女王,3.0
伊拉克袭击杀害将军和四名警察,在伊拉克的袭击造成将军和另外4人死亡,4.0
伊朗西北部地震至少80人死亡,伊朗西北部地震造成180人死亡，1300人受伤。,2.6
"巴西的 ""流行明星牧师 ""获得了巨大的新舞台。","巴西的 ""流行明星牧师 ""获得了巨大的新舞台。",5.0
华盛顿 逾百人在医疗保险诈骗大检查中被起诉,华盛顿 法院在阿拉巴马州的案件中支持投票权法,0.6
普京宣称在俄罗斯总统选举中获胜,普京声称在总统选举中获胜,4.2
克林顿准备为奥巴马而战,克林顿是奥巴马的坚强后盾,1.0
罗姆尼宣布保罗-瑞安为竞选伙伴,罗姆尼选择瑞安为GOP竞选伙伴,4.4
欧洲市场因希腊救助希望而上涨,欧洲各国部长准备批准希腊救援计划,2.2
愛德華茲1項罪名不成立，其他罪名無效,爱德华兹在一项罪名上被判无罪；在其他罪名上被判无效。,4.6
乌克兰举重运动员被禁赛四年,乌克兰选手科罗布卡被禁赛四年,4.2
枪手可能拍下了学校的屠杀事件,凶手可能拍摄了法国校园枪击案,3.0
港股收盘跌0.28,港股开盘上涨0.62点,1.6
自杀式炸弹手袭击阿尔及利亚安全基地,自杀式炸弹袭击尼日利亚教堂,0.8
泰国： 伊朗人计划袭击以色列人,马来西亚将引渡袭击以色列人的伊朗人。,1.0
以色列军事法庭驳回巴勒斯坦绝食者的上诉,以色列与巴勒斯坦绝食者达成协议,1.2
复仇者》创下票房纪录,饥饿游戏》刷新票房纪录,1.6
"普京 ""赢得俄罗斯总统选举","普京 ""赢得 ""俄罗斯总统选举",4.2
俄罗斯人投票时普京投下选票,普京将赢得俄罗斯总统选举,1.4
联合国首长找到了自己的声音，对中国问题保持谨慎态度,洞察力。 联合国负责人找到了自己的声音，但在中国问题上仍保持谨慎态度,4.8
利比亚人开始交出武器,利比亚人向军队转让武器,3.2
英国坎特伯雷大主教转战剑桥,坎特伯雷大主教将在分歧中下台,2.4
旁遮普邮件在罗塔克附近出轨，19人受伤。,旁遮普邮件在哈里亚纳邦罗塔克附近出轨，19人受伤。,4.2
"乔治-齐默尔曼 ""将被指控杀害特雷冯-马丁""。",官员称乔治-齐默尔曼将在特雷冯-马丁案中受到指控。,4.0
印度毛派叛军提出谈判解救意大利人质,印度： 毛派叛军就释放意大利人进行谈判,3.8
据报道，纽约帝国大厦发生枪击案，两人死亡。,城市房间。 帝国大厦枪击案,2.8
巴基斯坦自杀式爆炸事件中五人死亡,巴基斯坦工厂大火至少63人死亡,1.0
宾夕法尼亚州立大学橄榄球运动员对制裁作出反应,宾夕法尼亚州立大学橄榄球队被NCAA制裁,2.4
以色列必须释放或审判长期绝食的巴勒斯坦人。,以色列部长希望巴勒斯坦领导人下台,0.5
联合国报告称叙利亚双方都在滥用权利,北约领导人淡化土耳其与叙利亚冲突的风险。,1.0
被控焚烧古兰经的女孩躲了起来,被控焚烧古兰经的女孩被保释,3.2
法国警告叙利亚使用化学武器,联合国关注叙利亚可能出现化学武器的情况,2.2
中西部地区恐怕会出现危及生命的风暴,"中西部地区恐将出现 ""危及生命 ""的风暴",4.4
"芝加哥教师罢工接近尾声，达成 ""框架 ""协议",总罢工结束。 Histadrut与财政部达成协议,0.8
印尼总统将访问英国,印尼总统将访问澳大利亚,1.4
风暴推迟了共和党大会的开始,佛罗里达州遭受暴风雨袭击，共和党大会推迟举行。,4.4
军方称，至少有两名纳托人员在阿富汗直升机坠毁事件中丧生。,官员：至少18人在阿富汗炸弹袭击中丧生,0.8
米尔斯校长必须辞职--讲师,约翰-埃文斯-阿塔-米尔斯总统必须立即辞职--德国新民党。,2.6
迈阿密热火队赢得NBA总决赛,迈阿密热火队夺得NBA冠军,5.0
日本关闭最后一座核反应堆,日本本周末关闭最后一座核电站,4.2
瑞安航空对爱尔兰航空的新竞标,瑞安航空负责人称赞报告的结论,1.2
俄罗斯空军庆祝建军100周年,俄罗斯空军成立100周年,4.4
6名北约士兵在阿富汗被杀,北约士兵在阿富汗被杀,2.2
米特-罗姆尼的超级星期二,罗姆尼在GOP超级星期二的竞争中领先桑托勒姆。,1.6
普京宣誓就职，俄罗斯经济增长下滑,普京宣誓就任俄罗斯总统，任期6年。,2.4
阿奎尔、第一集团停止肺癌试验，股价大跌。,肺癌研究被搁置，ArQule股价大跌,3.4
少年和父亲在车祸中丧生,恐怖车祸中的3名遇难者被点名,1.6
印尼发生6.1级地震,印尼巴布亚发生6.1级地震 -- 美国地质调查局,4.2
阿富汗动乱进入第五天，2名美国人被杀,阿富汗动乱持续，两名美国军官被谋杀,4.2
官员们。 罗姆尼将得到特勤局的保护,奥巴马谈特勤局丑闻,0.6
日本首相呼吁加快海啸废弃物处理速度,日本迎来地震和海啸灾害一周年纪念日,1.0
叙利亚战斗机飞行员向约旦投诚,叙利亚总理投奔约旦,1.4
阿拉伯叙利亚共和国； 阿拉伯叙利亚共和国： 叙利亚难民(截至2012年6月28日),阿拉伯叙利亚共和国； 安南回国前叙利亚有70多人遇害,1.2
自杀式炸弹手在阿富汗炸死16人,自杀式炸弹袭击者在尼日利亚教堂杀害12人,1.2
"航空公司取消 ""flytilla ""活动人士前往TA的机票。","英国航空公司因以色列反对取消 ""Flytilla ""机票",3.2
西班牙要求拯救银行,因古巴持不同政见者死亡而受审的西班牙人。,0.2
南中国海的浑浊水域,南中国海的和平存在,1.4
斯里兰卡寻求对巴基斯坦的单日复兴,高级记者在巴基斯坦被杀,0.6
SpaceX与国际空间站对接。 接下来，公共出行？,SpaceX龙与国际空间站对接,3.8
"百万布偶游行 ""为奥巴马支持PBS辩护",百万布偶游行计划捍卫美国对PBS的支持。,4.0
叙利亚反对派参加和解谈判,叙利亚反对派委员会将在法国设立特使,1.4
Sensex因预算蓝调下跌193点,罗姆尼不会主动提出预算差异,1.0
Facebook将IPO规模提升25个百分点，募集资金150亿美元,Facebook将IPO规模提升25%。,3.6
伊朗议会对不屑一顾的艾哈迈迪内贾德提出质疑,伊朗议会质询总统艾哈迈迪-内贾德,4.0
也门自杀式袭击造成7名士兵死亡：官员,官员：阿富汗自杀式汽车炸弹至少造成7人死亡。,1.6
总统投票让埃及人两极分化,共和党总统候选人在南部竞选中发生冲突,0.8
又有三名美军士兵在阿富汗遇害,北约士兵在阿富汗被杀,1.8
警方将巴士事故死亡人数提高到8人,罗德尼-金的死亡被裁定为意外,0.4
四名外国士兵在阿富汗东部被杀,2名英军士兵在阿富汗内鬼袭击中丧生。,0.8
红十字会工作人员在巴基斯坦遇害,在巴基斯坦被绑架的英国红十字会医生被发现被斩首,3.6
阿富汗和美国政府就有争议的夜袭签署协议,阿富汗人和美国签署了关于夜袭的协议。,3.8
中国矿难造成10人死亡,中国卡车事故造成20人死亡,1.6
澳大利亚可以在温迪队中超越英格兰,澳大利亚总理在领导权问题上的压力下奋不顾身,0.4
抗议Pussy Riot的判决,阴部暴动的判决受到了人们的欢迎。,3.4
"特勤局迎来 ""最大的丑闻 ""妓女问题","特勤局性丑闻 ""后悔",2.2
科威特： 活动人士冲击叙利亚大使馆；两人受伤,活动人士冲击叙利亚驻科威特大使馆,3.4
昂山素季访问爱尔兰的细节,热烈欢迎昂山素季的历史性访问,3.4
钥匙说，Marae访问失去了一个机会,钥匙希望Waitangi marae的访问能留下来,2.2
挪威纪念大屠杀周年,挪威纪念布赖维克屠杀事件一周年,3.8
女子被掉落的碎石砸死,当一个盟友拒绝时,0.0
降息后澳股上涨1%,RBA再次降息,1.0
德国警告希腊。 不改革就没有更多的钱,欧元区对希腊。 没有改革就没有拯救,2.6
奥巴马将会见枪击案受害者家属,奥巴马将会见蝙蝠侠枪支受害者,3.2
奥巴马扩大了对罗姆尼的领先优势，尽管就业数据。 路透社/益普索调查,"罗姆尼以大会 ""反弹 ""领先奥巴马。 路透社/益普索调查",1.0
多伦多枪击案两死19伤,芬兰枪击案2死7伤,1.4
教皇的管家看到了什么--因梵蒂冈泄密而被捕的助手。,教皇的管家因梵蒂冈泄密丑闻被捕,3.4
反普京抗议者在莫斯科形成人链子,反普京抗议者组成人链,3.8
华盛顿的《国会法案》以980万美元的价格成交。,乔治-华盛顿的美国宪法副本以980万美元的价格成交。,2.6
湖人队在1-4开局后解雇了教练迈克-布朗。,湖人队在1-4开局后解雇了迈克-布朗,4.4
"加拿大穆斯林发布法特瓦反对 ""名誉杀人",美国和加拿大伊玛目发出反对名誉杀人的法特瓦。,3.4
联合国将讨论叙利亚决议,联合国大会将对叙利亚决议进行表决,3.6
"士兵 ""无法回忆起 ""屠杀事件","美军士兵 ""不记得大屠杀",4.4
利比亚总理在抗议原内阁后任命新内阁,利比亚议会否决新内阁，解除总理职务,1.2
4名外国士兵在阿富汗东部被杀,据报道，4名法国士兵在阿富汗遇害。,3.8
叙利亚部队冲击中部城镇,叙军轰炸霍姆斯，俄罗斯警告内战爆发,2.5
巴方：20人在反伊斯兰教电影抗议活动中死亡,巴基斯坦伊斯兰堡反伊斯兰教电影抗议活动中25人受伤。,2.2
惠特尼-休斯敦的死因可能需要数周的时间,调查人员寻求惠特尼-休斯顿之死的答案。,1.8
N韩国警告将对韩国演习进行报复。,北方警告将对首尔的海军演习计划进行报复。,3.6
两关的故事。 纽约巨人队是如何赢得超级碗的？,两害相权取其轻，超级碗的胜利。,1.4
以色列对加沙的新一轮袭击中一人死亡,医务人员说，在以色列对加沙的新一轮袭击中，有两人死亡。,3.6
德国可能就叙利亚危机向俄罗斯施压,俄罗斯在叙利亚问题上是怎么想的？ 简要指南,1.0
M23高速公路车祸四人严重受伤,四人在高速公路上受伤,3.6
联合国援助主任阿莫斯与红新月会一起进入巴巴阿姆尔。,红十字会说，叙利亚被围困的巴巴阿姆尔已经荒废了。,2.0
尼日利亚骚乱中数十人死亡,肯尼亚冲突中数十人死亡,1.0
埃及主要总统候选人简介,埃及总统选举第二天,1.2
演员加扎拉去世，享年81岁,演员本-加扎拉去世，享年81岁,4.4
英国淘金热让对成本的抱怨沉默不语,2名英军士兵在阿富汗内鬼袭击中丧生。,0.6
雪崩埋葬了至少100名巴基斯坦士兵。,雪崩埋葬了100多名巴基斯坦士兵。,4.6
通胀率降至15个月低点：分析师怎么说？,通胀率降至15个月低点,4.6
科曼不会削减计划生育的资金来源,苏珊-G-科曼在计划生育经费削减问题上发生了逆转。,3.0
外汇&amp; 黄金 25 八月 2012,外汇与黄金 2012年7月19日,2.2
伊朗称联合国核谈判将继续进行,"伊朗称与联合国的核谈判具有 ""建设性",2.8
农业企业。 加州发现疯牛病,美国农业部确认加州出现疯牛病病例,4.2
英国石油公司以55.5亿美元出售墨西哥湾部分资产,英国石油公司将墨西哥湾资产以55.5亿美元的价格出售给平原公司。,3.6
300名潜在的吉米-萨维尔受害者：警方,英国：300名潜在萨维尔虐待受害者浮出水面,3.6
阿姆斯特朗从Livestrong辞职,阿姆斯特朗从Livestrong站下来,4.6
美军无人机袭击在巴基斯坦击毙5名武装分子,美军无人机空袭打死也门16名武装分子嫌疑人,1.8
叙利亚政府不会停止攻击,"叙利亚反对派报告 ""大屠杀",1.0
中国股市周五午间收高,中国股市周五午间走高,4.6
