2 Palestinians killed in Israeli airstrikes,Four Palestinians killed in IAF strike,2.4
Pakistan condemns U.S. drone strikes,Pakistan convoy heads to protest US drone strikes,3.2
Massive Hurricane Sandy bears down on U.S. East Coast,"Hurricane Sandy gains speed, batters US east coast",4.0
Sarkozy to File Complaint in Gadhafi Funding Claim,Sarkozy to sue after Gaddafi cash claim bursts into campaign,3.6
"The Note's Must Reads for Wednesday July 4, 2012","The Note's Must-Reads for Wednesday, May 30, 2012",2.0
'Iran will attack Tel Aviv if Israel strikes',Senior cleric: Iran will attack Tel Aviv if Israel strikes,4.4
Gusmao consolidates power in East Timor elections,Supreme Court possibilities if Romney wins election,0.0
Pena Nieto wins Mexico presidential vote: exit polls,Poll: Putin to win Russia presidential vote,0.6
Syria tells Russia some troops have pulled out of Homs,Syria says troops have begun pullout  video,3.4
Nigeria plane crash: No survivors,4 Chinese among Nigeria plane crash victims,2.6
Explosion at Venezuela Refinery Kills at Least 39,Venezuela mourns oil refinery blast deaths,2.8
Strong earthquake hits Mexico,Strong earthquake strikes near Acapulco,3.6
"Russia, China veto UN resolution on Syria killings","Russia, China in double veto of UN Syria resolution",3.8
Pakistani plane crashes with 127 on board,Pakistani Plane Crashes With 130 People On Board,2.6
UN security council orders global sanctions against Haqqani network in Afghanistan,UN orders global sanctions against Haqqani network,4.4
Erdogan and Putin talked in raised voice,Foreign militants killed in Somalia in strike on car,0.0
Saudi Arabia arrests suspected militants with al-Qaeda links,"Saudi Arabia arrests suspected militants, state media reports",4.0
Hurricane Sandy Closes in on US East Coast,Hurricane Sandy takes aim at US East Coast,4.8
"Chicago teachers strike: Vacations for students, for good or ill",Chicago teacher strike poses test for unions,2.2
Panetta says Afghanistan role to shift from combat in 2013,Panetta: Afghanistan Tops NATO Conference Topics,1.6
Four men admit London Stock Exchange bomb plot,Four men admit London bombs plot,4.0
Israel threatens action against Gaza aid ship,Israel attacks in Gaza Strip after rocket fire,1.6
Bodies Found at Russian Jet Crash in Indonesia,12 bodies found at Russian jet crash in Indonesia,3.8
Syria urges refugees to return,Syria's tenuous truce takes hold,1.0
US soldier kills up to 16 civilians in Afghanistan,US soldier kills up to 16 Afghan civilians in shooting spree,4.2
Rupert Murdoch: I was the victim of a cover up,Rupert Murdoch set for second day of grilling,1.2
Barack Obama's bodyguards sent back to US after prostitution scandal,Barclays boss falls to rate fixing scandal,0.4
China's yuan rises to new high against USD Wednesday,China's yuan advances to 6.3103 against USD Wednesday,3.8
Nissan to sell steer-by-wire cars,Nissan to offer steer-by-wire systems in some Infiniti cars,4.0
Tibetan monk dies after setting himself on fire in protest against Chinese rule,Teenage Tibetan monk dies after setting himself on fire in China,3.8
Mumbai is 2nd costliest Indian city to live in,Tech capital Bangalore costliest Indian city to live in: Survey,1.0
"Man, 19, quizzed over teen murder",Man quizzed over Megan-Leigh murder,3.8
"Israel kills Hamas commander, bombs Gaza targets","Israel airstrikes kill Hamas commander, 5 others",3.4
Gusmao consolidates power in East Timor elections,Gusmao powers on in East Timor,3.6
UN monitors yet to reach site of Syrian 'massacre'  video,UN monitors unable to reach site of Syria killings,4.4
NATO Condemns Syria's Downing of Turkish Military Jet,NATO strongly condemns Syria's downing of Turkish jet,4.8
Syria rebels attack Lebanese post near border: army,Turkish army stages tank exercises near Syria border,0.8
Five killed in China building collapse,At least 20 killed in Syria Saturday,0.2
Syrian forces launch new attacks,Syria forces launch Aleppo attack,3.4
Gazans fire 2 rockets into Israel; no injuries,Gazans fire 89 rockets; cabinet approves reserve call-up,1.4
Former Nazi death camp guard Demjanjuk dead at 91,"John Demjanjuk, convicted Nazi death camp guard, dies aged 91",4.6
Boris Johnson re-elected London mayor,Johnson re-elected London mayor,3.8
Breivik drops far-right salute in court,Breivik gets 21-year sentence,1.0
Second teenager charged with murder,Brother of EastEnders actress Gemma McCluskie is charged with her murder,1.4
French Fear New Serial Killer After Murders,Jersey Murder Trial: Killer 'Hearing Voices',0.8
US: Madoff brother to plead guilty in NY in fraud,Madoff's brother to plead guilty to fraud,4.2
Hollande defeats Sarkozy in French presidency vote,Polls open across France in presidential election,1.8
Libyan government retakes Tripoli airport,Libyan militia takes control of Tripoli airport,3.2
Clinton warns Kenya of cost of election violence,Clinton warns Kenya on cost of election unrest,4.6
Arkansas Supreme Court strikes down execution law,Arkansas Justices Strike Down Death Penalty,4.6
S. Africa's former president Mandela discharged from hospital,Mandela Discharged From Hospital,4.2
UN envoy in Turkey for talks on Syria,NZ to increase exports to China,0.2
Islamist Morsi Wins Egypt's Presidential Election,Al-Shater to run in presidential election in Egypt,1.0
"Donna Summer, the queen of disco","Donna Summer, Queen of Disco, Dies at 63",1.6
"Bangladesh Muslims torch Buddhist shrines, police say",Muslims torch Buddhist temples,3.6
U.S. Drone Kills Five Militants in Pakistan,Six Police Officers Killed in Attacks in Dagestan,0.4
Mali future interim president readies to take office,Pope rips into dissident priests on celibacy,0.0
"9 killed, 168 injured in latest Cairo clashes","10 killed, 12 injured in E. Afghan airport suicide blast",1.2
Romney wins Maine Republican caucuses,"Romney, in comeback, has narrow Maine caucus win",3.8
Court in Bahrain rejects medics' last rally appeal,Bahrain rejects activists' appeal,3.8
Hurricane Sandy powers toward Eastern Seaboard,Hurricane Sandy moves towards US,3.6
Clinton calls for friends of Syria to unite,Plastic artist calls for greater support for new talents,0.0
JK Rowling launches her first adult novel,Syria launches ground assault in Aleppo,0.0
Algerian government parties dominate elections,Algerian national turnout of parliamentary vote reaches 44.38 pct,2.4
Security official killed in Yemen,Security personnel killed in Pakistan raid,0.6
US stocks fall as Greek talks lumber; Apple falls,US stocks slip on Wall Street as Greek talks drag on,3.2
Romney picks Ryan as vice presidential running mate: source,Romney to tap Ryan as vice presidential running mate,5.0
NATO sticks to transition roadmap in Afghanistan: Rasmussen,NATO helicopter makes hard landing in E. Afghanistan,1.0
Mubarak faces verdict in murder trial,Mubarak's sons face new charges of insider trading,1.4
No blocks to investment,India allows Pakistan investment,2.0
Blast kills 11 in northwestern Pakistan,Bomb Kills 19 In Northwest Pakistan,2.6
5 aid workers freed in operation in Afghanistan,Suicide bomber kills 37 at mosque in Afghanistan,0.8
Two NATO soldiers killed in Afghanistan,NATO Soldier Killed in Afghan Blast,3.6
Nadal tumbles into French Open final,Nadal through to seventh French Open final,4.0
Russian TV reports foiled attempt on Putin,"Russia, Ukraine foiled plot to kill Putin, report says",3.2
Putin claims victory in Russia's presidential election,Putin wins disputed Russian presidential election,4.4
Remains of 167 bodies found in Mexican cave,Remains of 167 people found in Mexico cave,5.0
orphaned alps massacre girl returns to uk,Alps attack: Girl returns to UK,4.0
Obama team raises debate stakes,Obama takes offensive against Romney in debate,2.8
Two Kenyan ministers among 6 killed in plane crash,Poland honors president killed in 2010 plane crash,0.8
Thousands gather for new Russian anti-Putin rally,Thousands gather in Moscow for rival rallies,2.8
Google names new Motorola Mobility CEO,Google appoints Dennis Woodside to run Motorola Mobility,3.8
Massive Hurricane Sandy bears down on U.S. East Coast,Hurricane Sandy takes aim at US East Coast,4.4
Another rocket hits Eshkol; no injuries,2 rockets hit Eshkol; none injured,3.4
Thousands more Syrian refugees flee to Turkey overnight,"8,000 Syrian refugees flee to Turkey overnight",3.8
Assange appeals extradition to UK's top court,Assange to appeal extradition to UK's top court,4.0
Strong quake jolts most parts of Pakistan,Strong quake hits eastern Indonesia,2.0
Lebanese Gunmen Clash Over Syria Crisis,Syrians hold solution to Syria crisis,1.0
Mob kills man for burning Quran,Pakistani Mob Kills Man 'for Burning Koran',4.0
US drone strike kills four in North Waziristan,U.S. drone strike kills 10 in northwest Pakistan: officials,1.8
Salvador Dali painting snatched from New York gallery,Salvador Dali painting snatched in NYC,4.6
Putin claims victory in Russia's presidential election,Will Putin's Election Victory in Russia Be Greeted with Protests?,1.8
Sarkozy announces re-election bid,France's Nicolas Sarkozy makes his reelection bid official,4.2
"US, UK in pact to release emergency oil stocks","US, UK Set to Agree Emergency Oil Stocks Release",4.6
Eurozone unemployment stays at record 11 percent,Eurozone unemployment at record high in June,3.0
French Socialist Party wins parliament victory,French Socialists win absolute parliament majority,3.8
"Salafi Islamists, police clash in Tunis - witnesses",Second Islamist hunger striker dies in a Tunisian prison,0.6
Strauss-Kahn investigated in French prostitution ring,Dominique Strauss-Kahn faces questions over French prostitution ring,3.8
Romney wins Florida Republican primary,Romney eyes US Republican primary endgame,1.8
US drone strike kills four in North Waziristan,Suspected drone strike kills 4 in Pakistan,2.6
2 Traffic Accidents Leave 47 Dead in China,3 traffic accidents leave 56 dead in China,2.4
Head of CIA resigns over affair,Hall of Fame beckons for Capriati,0.0
France's Strauss-Kahn charged with involvement in prostitution vice ring,Strauss-Kahn charged in prostitution vice ring,4.0
Sony reports record annual loss,Sony forecasts record annual loss of $6.4bn,3.6
12 killed in Gaza in Israeli airstrikes,"Ictu, Ibec in move on airline strike",0.4
9 killed in attacks after deadly Iraq day,19 Killed in Iraq Attacks ahead of Ramadan End,1.4
Barclays hit by fresh U.S. investigations,Barclays hit by fresh US probe,4.4
US closes embassy in Syria (AP),Closed roads in Armenia,0.4
EU heaps new sanctions on Syria,EU imposes new sanctions on Syrian regime,4.4
Russians rally against Putin's rule,Tens of thousands rally against Putin's rule (AP),3.4
Bahrain Grand Prix Underway Amid Protests,Bahrain race goes ahead amid unrest,4.0
China stocks open flat Monday,Chinese stocks open mixed Wednesday,1.4
Sheryl Crow says has benign brain tumor,Sheryl Crow Has a Benign Brain Tumor,4.6
Afghan parliament approves U.S.-Afghan security pact,Afghan parliament approves U.S. partnership,3.8
"Two German tourists, two pilots killed in Kenya air crash",Senator Reid involved in Las Vegas car crash: CNN,0.6
"Israeli, Palestinian negotiators quietly meet","Israeli, Palestinian negotiators meet in Jordan",3.6
US astronaut Neil Armstrong dead at 82,US astronaut Neil Armstrong dies,3.6
Amnesty: Syria rebels also committing abuses,Amnesty investigator: Syria rebels also committing abuses,4.2
Mitt Romney wins Republican primary in Indiana,Romney wins Florida Republican primary,1.6
East German rights activist Gauck elected president,Joachim Gauck elected as German president,4.0
South Africa starts investigating mine violence,South Africa hosts 'peace talks' in mine standoff,2.4
"3 dead, 27 injured in SW China accident",35 dead and 165 missing in India boat accident,0.4
Santorum Romping To Minnesota Victory,Santorum wins Kansas caucuses,1.0
Space legend Neil Armstrong dies,First man on moon Neil Armstrong dies at 82,4.0
U.S. and Turkey weigh no-fly zones for Syria,"Turkey, US weigh no-fly zones for Syria",4.8
Man arrested over double murder,WA man arrested in police drug raid,0.8
Florida counties extend early voting,Fla. Democrats want extended early voting hours,2.8
Warship sets sail for Falklands,British Warship Sets Sail for Falklands,3.8
"Newcastle 2-0 Liverpool: Match report, pictures & video highlights","QPR 1-2 West Ham: Match report, pictures & video highlights",1.0
Palestinian prisoners to end hunger strike,Progress reported in Palestinian prisoner hunger strike talks,2.8
Police: Four killed in German hostage taking incident,Palestinians: 12 killed in IDF strike in northern Strip,1.0
Egypt lets Mubarak PM back in presidential race,Egypt confirms Mubarak's PM back in presidency race,4.25
Syrian journalists killed in capital,US Marines killed in base attack,0.6
GOP candidate Romney to call to arm Syrian rebels,US helping get arms to Syria rebels,2.4
U.N. observer patrol arrives at Syria massacre site,UN observers reach Syria massacre village,4.4
American Airlines and Pilots Agree on a New Contract,Romney pledges to 'stand with Israel' on Iran threat,0.0
Greek PM to announce new election,Greek PM calls for May 6 general election,2.8
Government of Canada Supports Montral Women Leading Change,Government of Canada Supports Women's Safety in Regina,1.6
No problem if Mulayam forms Third Front: Congress,No problem if Mulayam forms third front: Digvijay,3.2
Bradley triumphs at Firestone as Furyk fades,Bahrain court upholds sentences against uprising leaders,0.0
Plane crash in Ghana kills at least 10,Plane Crash in Ghana: How the international media reported it,2.2
Six US troops killed in Afghan bomb attack,6 NATO troops killed in Afghanistan,1.8
Syria forces launch Aleppo attack,Syrian forces kill 54 ahead of Annan peace mission,1.6
"Romney, Obama fight for edge on Medicare","Obama, Romney compete for undecideds, stoke base",1.0
BBC director general resigns over 'shoddy journalism',BBC Director General Resigns amid Newsnight Scandal,3.6
Rick Santorum wins Kansas caucuses,Rick Santorum notches a victory in Kansas caucuses,4.8
"In Islamist-led Egypt, Coptic Church names new pope",Egyptian Christians choose new pope,3.2
US pledge to rebuild Haiti not being met,US Pledge to Rebuild Haiti Not Being Met,5.0
Chinese stocks close higher Thursday,Chinese stocks open mixed Wednesday,1.0
Greece to vote on 2013 budget; protesters gather,Greece to vote on 2013 budget,3.6
"U.S., EU Cautiously Welcome Iran's Proposal To Restart Nuclear Talks","U.S., EU welcome Iran's offer to restart nuclear talks",4.0
Clinton warns Kenya of cost of election violence,Clinton warns Kenya on repeat of 2007 vote chaos,2.8
Anti-American Protests Over Film Expand to Nearly 20 Countries,Anti-American fury sweeps Middle East over film,3.8
Journalists hail London Olympics opening,Israeli delegation marches in 2012 Olympics opener,1.0
Aust stocks open lower,Tokyo stocks open lower,1.5
WikiLeaks begins publishing two million Syria emails,WikiLeaks Releasing Trove of Syria Documents,3.4
Palestinians: 2 Gaza militants killed in Israeli airstrike on coastal strip,Officials: Gaza man killed in Israeli airstrike (AP),3.0
Mali's President Hands in Resignation,Mali's President Formally Resigns,4.6
Three killed in Nigeria suicide bombers attack,60 killed in Nigeria cattle market attack,1.4
"FACTBOX-Security developments in Iraq, February 1","FACTBOX-Security developments in Pakistan, March 13",1.6
HRW: Jordan biased against Palestinians from Syria,Jordan biased over Palestinians from Syria,4.2
Israel among top arms exporters in world: report,Israel among top arms exporters and importers,3.8
Egyptians to vote for new president,Somali MPs to elect new president,0.8
Federer Wins 7th Wimbledon Title,Federer captures 7th Wimbledon title,5.0
Qaida leader calls for kidnap of Westerners in Egypt,Al-Qaida Leader Urges Kidnapping of Westerners,3.6
China stocks close mixed Friday,Chinese stocks close higher midday Friday,2.6
43 killed in bus crash,15 killed in crash in India,1.6
Putin sworn in as Russian president,Putin sworn in as Russia's president for 6 years,4.0
China trade returns to surplus in March,Tense calm returns to south Tel Aviv,0.0
Highlights of the Vice Presidential debate,Five things to watch in the presidential debate,2.2
"Full Episode: Nightline 6/29: Katie Holmes, Tom Cruise to Divorce","Custody, images at stake in Cruise-Holmes divorce",1.4
Syrian regime denies role in Houla massacre,Syria blames rebels for Houla massacre of over 100,3.0
South Sudan accuses Sudan of bombings ahead of talks,S. Sudan accuses Sudan of bombing in blow to talks,4.4
Nine killed in gun attack in Pakistan,Five million citizens get unofficial salary in Ukraine,0.0
"Syria demands guarantees, rebels say peace plan doomed",Syria demands written guarantee for troop pullback,3.2
Minn. terminal reopens after evacuation,Minn. Terminal Reopens After Bag Causes Evacuation,3.8
Golf: Westwood takes lead in Dubai Desert Classic,Westwood in front a Dubai Desert Classic,4.0
Sudan Blocks YouTube Over Anti-Islam Film,Pakistan's PM orders YouTube halt over anti-Islam film,2.8
Polls open in Russian presidential election,Polls close in Senegal's presidential election,1.4
Chavez leaves again for Cuba for radiotherapy,Chavez set for more radiotherapy in Cuba,4.4
Romanian president declared victory,Chinese president concludes state visit to Denmark,0.6
Russians rally support for Orthodox church over Pussy Riot controversy,Russian Orthodox Church rallies faithful after criticism,3.6
Clinton lands in India to breathe life into ties,Clinton Warns Against Undermining Grameen Bank,1.4
Mali interim leader takes office,Mali's Interim President Sworn Into Office,4.2
Putin Declares Victory In Russian Presidential Vote,Putin 'wins' Russia's presidential election,3.8
AL renews condemnation on Syria's violence,U.S. closes embassy in Damascus due to Syria violence,1.6
EU slaps sanctions on Assad family,EU sanctions Assad's wife; mortars hit Homs,3.4
Air Force Instructor Faces Sentencing for Rape,Women testify at Air Force instructor's sentencing,1.8
More than 30 striking miners killed,More than 30 striking miners killed in South Africa,3.8
Iron Dome intercepts 17 rockets,Iron Dome intercepts two rockets fired at Beersheba,2.6
Mali Islamists destroying 'more Timbuktu shrines',Mali Islamists destroy more holy Timbuktu sites,4.5
China stocks end higher on PMI at midday,Chinese stocks open higher Thursday,1.8
Scientists Resurrect Flowers from Prehistoric Seeds,"Nintendo trims red ink, lowers forecast for year",0.0
Man convicted in Vatican leaks case,"Butler to be tried in ""Vatileaks"" case",2.6
"Romney, Paul vie for Maine caucus win",Romney has narrow Maine caucus win,2.8
Sectarian clashes rock Lebanese city of Tripoli,"Sectarian clashes rock Lebanese city, 3 killed",3.8
Repsol blasts Argentina over nationalization of YPF,Repsol blasts Argentina over oil nationalization,3.4
"Several dead, 550 injured in Argentina train crash",49 feared dead in Buenos Aires train crash,1.4
Aung San Suu Kyi to address British MPs,Burma's Aung San Suu Kyi to address parliament on June visit,4.0
Sheriff: Man recovers stolen car 42 years later,US man recovers car 42 years after theft,4.0
"Google CEO says Android important, not critical","Larry Page says Android important, not critical",4.0
Iran may cut oil exports to more EU states,Iran MPs say ready to ban oil exports to some EU states,3.6
Factory Fires Kill At Least 260 in Pakistan,At Least Six Dead in Pakistan Gunfight,0.8
Australian among four on plane missing in Indonesia,Iranian painter Mansoureh Hosseini dies,0.0
Romney vows to restore 'promise of America',Romney Promises to 'Restore America',3.8
Santorum's 3-year-old daughter hospitalized,'Kony 2012' director hospitalized,0.6
Mandela released from hospital,Israeli president released from hospital,1.2
Jaya Prada all set to join BJP,"Jaya Prada likely to join BJP, Amar Singh to decide for her",3.8
Hezbollah's Nasrallah warns US over anti-Islam film,Hezbollah calls for more anti-Islam film protests,2.8
Nadal tops Djokovic for 7th French Open title,Tennis: Nadal defeats Djokovic for Monte Carlo title,3.2
Childcare costs rise by nearly 6%,"Childcare 'costing 15,000 a year'",3.0
Obama urges decisive action on Europe debt crisis,Obama urges Europe to act quickly on crisis,3.4
Beef burger mix recalled over salmonella concerns,Choc powder recalled over salmonella concerns,1.0
"Obama, Romney Prepare for First Debate","Obama, Romney prepare to debate",4.2
First significant gas found offshore Kenya,Raiders kill 38 in latest land clashes in Kenya,0.8
Red Cross worker killed in Pakistan,Kidnapped UK aid worker killed in Pakistan,2.2
8 rockets fired from Gaza into southern Israel; none hurt,Ten rockets from Gaza land in southern Israel; none hurt,3.4
U.S. soldier killed in shooting incident in S. Afghanistan,Five NATO soldiers killed in Afghanistan,1.6
Polls close in Egyptian presidential election,Press Releases: Yemeni Presidential Election,0.8
Police 'did not link' Savile claims,BBC faces questions for pulling Savile case,1.2
Eurozone unemployment stays at record 11 percent,Eurozone unemployment hits record high,3.4
James Murdoch quits BSkyB,James Murdoch quits role at BSkyB,4.2
Iconic science fiction writer Ray Bradbury dies at 91,Science fiction legend Ray Bradbury dead at 91,4.8
Egypt presidential election May 23-24,US presidential election 2012,0.6
Four French soldiers killed in Afghan suicide blast,Four foreign soldiers killed in Afghan east,3.4
UN observers find traces of Syrian massacre,UN team investigates Syrian massacre,4.0
AP poll: Majority in US have prejudice against blacks,AP Poll: Majority Harbor Prejudice Against Blacks,3.6
AP Source: Redskins to trade for No. 2 pick,Redskins trade for No. 2 pick,4.2
China says defense budget to rise 11.2% in 2012,China's defence spending to rise 11.2%,4.0
String of Iraq blasts kills at least 32,Strong Italy Quake Kills at Least Six,0.0
Ecuador President Correa says no decision made on Assange asylum,Ecuador yet to decide on Assange's asylum,3.8
US offers US$10 mil. for Pakistan militant,US offers $10 million for Pakistani militant chief,3.8
6 NATO troops killed in Afghanistan IED attack,6 NATO troops killed in Afghanistan,3.8
Osama Bin Laden Wives to Be Jailed,Osama Bin Laden movie to be filmed in India,0.8
Egyptians vote in landmark presidential election,Egyptians go to polls in historic election,4.0
"JetBlue pilot who disrupted flight declared insane, not guilty",JetBlue pilot who caused disruption on flight not guilty,3.8
Tsunami warning: No need for SA to panic,Tsunami warning after Aceh quake,2.2
US Hands Over Bagram Prison to Afghan Authorities,U.S. transfers Bagram prison to Afghan control,4.8
Jeremy Hunt distances himself from adviser who 'overstepped the mark',Jeremy Hunt clings on as SpAd quits over News Corp emails,2.0
Obama praises U.S.-Latin America trade ties,Obama Secret Service agents sent home,0.4
Blitzbokke ousted by Fiji,Blitzbokke beaten by NZ,2.0
Obama and Romney focus on swing-states,Team Anna yet to decide on contesting state polls,0.4
'Grenade attack' kills one and injures at least 11,Sex attack on woman investigated,0.2
'Scores of bodies' found in Syria,Eight more bodies found on ship,1.4
Shooter charged with murder of US black teen,Thoughts on race relations under a black president,0.8
Jonny Bairstow and Eoin Morgan shine for England in Mumbai,Bairstow hits ton in India tour match,1.8
How wind farm developers 'use camera tricks to make turbines look smaller than they really are',Wind farm developers using 'tricks' to make turbines look smaller,4.4
US drone kills six militants in Pakistan: officials,US missiles kill 15 in Pakistan: officials,2.4
Nigeria: Nigerian troops swarm after 40 killed in student massacre,Nigeria police make arrests after college massacre,2.6
Nerves Calmed -- For Now : Markets Jump on Relief over Spanish Bank Bailout,Focus Shifts to Greece After Spain Secures Bank Bailout,2.2
Heavy Fighting Reported in Syria's Aleppo,Heavy fighting reported in Damascus,1.4
France says Greece must show credibility for eurozone,France's Hollande backs Greece but urges credible reform,1.8
Avengers sets box office record,The Hunger Games breaks US box office record,1.2
4 French Soldiers Reported Killed in Afghanistan,British Soldier Killed In Afghanistan,1.0
Spanish bailout dilemma gets more acute,Spanish dilemma gets more acute,3.4
NATO soldier dies in Afghanistan,Two Aust soldiers wounded in Afghanistan,0.6
Chinese stocks open lower Wednesday,China stocks open lower Friday,2.4
Palestinian leadership condemn Israeli FM call to oust Abbas,Palestinian leadership backs Fatah-Hamas Doha deal,1.0
Mitt Romney wins Maryland GOP primary,Romney wins Maryland Republican primary,4.8
Man finds car on eBay 42 years after it was stolen,Texas man finds his car 42 years after it was stolen,3.6
Sylvester Stallone's son found dead in Hollywood,"Sylvester Stallones son, Sage Stallone, found dead in Hol",3.4
NATO: 4 aid workers rescued from Afghan insurgents,5 aid workers freed in operation in Afghanistan,2.8
Russia jails Pussy Riot protest punks for two years,Russian court to rule in Pussy Riot trial,1.8
Israel bars German writer Grass from visiting over poem,Israel bars German author Grass over poem,4.4
"The Note's Must-Reads for August 1, 2012","The Note's Must Reads for Wednesday July 4, 2012",1.8
NATO US troop detained over shooting of Afghan civilians,U.S. says saddened by shooting on Afghan civilians,2.4
Hollande wins French presidential election,East Timor votes in presidential election,1.6
