科技股纳斯达克综合指数上涨20.96点，至1595.91点，收于12个月以来的最高水平。,"科技类的纳斯达克综合指数<.IXIC>攀升了19.11点，或1.2%，至1,615.02点。",2.4
美国检察官在持续打击互联网诈骗和侵权行为的过程中，已经逮捕了130多人，并没收了1700多万美元。,在美国三个政府机构周五宣布的互联网欺诈大扫除中，已有130多人被捕，价值1700万美元的财产被没收。,4.6
"查韦斯说，调查人员有信心他们已经解决了 ""至少一个这方面的火灾""。","阿尔布开克市长马丁-查韦斯说，调查人员认为，随着这些人的被捕，他们有信心 ""至少解决了一起火灾""。",3.8
被控使用假手榴弹征用4月在基韦斯特降落的古巴飞机的男子周五被判处20年监禁。,一名古巴建筑师因使用两枚假手榴弹在4月劫持了一架从古巴飞往佛罗里达的客机，周五被判处20年监禁。,4.4
美国-VISIT项目主任吉姆-威廉姆斯说，到11月中旬，亚特兰大的许多到达旅客将被打上指纹和拍照。,美国-VISIT项目主任吉姆-威廉姆斯说，到11月中旬，检查人员将对抵达亚特兰大的许多外国乘客进行指纹和拍照。,4.2
听证会发生在五角大楼首次挑出一名军官达拉格不处理丑闻的第二天。,在听证会召开一天后，五角大楼首次挑出一名军官--达拉格，因为他没有处理这一丑闻。,5.0
"内罗毕万圣大教堂教务长Peter Karanja牧师说：""圣公会'正在与英国圣公会疏远'。",在内罗毕，万圣大教堂的教务长彼得-卡兰迦牧师说，美国圣公会正在疏远英国圣公会。,5.0
人口减少的县将是弗米利、波西和麦迪逊。,Vermillion、Posey和Madison县的人口将减少。,5.0
2月被起诉的斯瓦茨曾辩称，新罕布什尔州是指控他的错误地点。,斯沃茨曾寻求驳回指控，称新罕布什尔州是指控他的错误地方。,3.4
他们上周末在莱佛士医院接受进一步评估。,他们在周末接受了更多的测试，现在在莱佛士医院住院。,3.2
当炸弹在Casa de España爆炸时，顾客们正在吃晚饭和玩宾果。,在Casa de Espaa，顾客们正在吃晚餐和玩宾果时，一枚炸弹爆炸了。,5.0
普洛夫斯基说，委员会不会调查，因为三年的诉讼时效已经过期。,普洛夫斯基说，由于诉讼时效已过，该小组不会开始正式调查。,4.4
如果间谍罪名成立，他可能面临死刑。,间谍罪和协助敌人罪可判处死刑。,3.6
根深蒂固的利益集团正在将自己定位为控制网络的咽喉，他们正在游说FCC帮助和教唆他们。,"它可能会死，因为根深蒂固的利益集团正在将自己定位为控制互联网的卡口，他们正在游说FCC帮助和教唆他们。""",3.2
但教会成员和观察家表示，他们预计这个决定可能会给许多圣公会成员带来问题。,但教会成员和观察家说，他们预计这里的决定可能会给一些相信圣经禁止同性恋的圣公会教徒带来教义问题。,3.8
"斯奎尔斯是 ""雅典娜 ""号有效载荷的主要研究者--每辆漫游车所携带的科学仪器的集合。",康奈尔大学科学家Steve Squyres是这次任务科学仪器的首席研究员。,4.2
军方说，到目前为止，它已经在战役中杀死了12名叛乱分子，并抓获了9名叛乱分子，因为有6名士兵受伤。,军方表示，到目前为止，在这次战役中，军方已经击毙了16名叛军，俘虏了9名叛军，其中一名士兵死亡，6名士兵受伤。,3.0
Express Scripts ESRX.O股价在纳斯达克下跌3.6%，收于66.89美元。,在纳斯达克早盘晚些时候的交易中，Express Scripts ESRX.O的股价下跌约4%，至66.73美元。,3.0
警方对Shevaun Pennington发起了国际追捕，因为她周六与31岁的Toby Studabaker一起逃跑。,Shevaun Pennington在周六早上安排与31岁的Toby Studabaker见面后失踪。,3.0
律师和其他熟悉联邦调查的人说，它仍然专注于坎贝尔，尽管检察官拒绝讨论调查。,虽然联邦检察官拒绝讨论调查，但律师和其他熟悉调查的人说，它仍然专注于坎贝尔。,4.8
道琼斯工业平均指数.DJI下跌58.69点，跌幅0.64%，报9137.86点。,"蓝筹股道琼斯工业平均指数.DJI下跌86.56点，或0.94%，至9,109.99点，稍早放弃超过1%。",2.5
和平规则》在路易斯安那德比中击败了《滑稽潮》。,但无论是他还是和平规则，都无法阻止滑稽塞德抽身而去。,2.25
波音公司表示，最终协议预计将在未来几周内签署。,"波音发言人鲍勃-萨林表示，大韩航空的交易预计将在 ""未来几周内 ""敲定。",3.0
EDS的股价周四收于18.51美元，上涨6美分。,EDS股价周四收于18.51美元，在纽约证券交易所上涨6美分。,3.667
一个分裂的最高法院周一裁定，国会可以强制全国的公共图书馆为电脑配备反色情过滤器。,最高法院周一表示，政府可以要求公共图书馆在电脑上配备反色情过滤器，拒绝了图书馆员关于法律相当于审查的投诉。,3.6
这个弱点存在于VBA在主机应用程序打开文档时查看传递给它的文档属性的方式。,微软的Visual Basic for Applications在打开文档时检查传递给它的文档属性的方式存在漏洞。,3.8
在2400万张电话投票中，50.28%的人支持斯图达德，使他领先艾肯13万票。,在2400万张电话投票中，斯塔德只领先艾肯13万票。,3.4
消费者还是要从有线电视运营商那里拿到一张降频安全卡，才能插上这套设备。,要收看付费电视，消费者会将有线电视服务提供的安全卡插入电视机中。,3.4
"但是，我们决定选择欧洲财团的发动机，因为这是最佳的整体解决方案，而且由于在价格上做了大量的努力""。","不过，我们决定选择欧洲财团的引擎作为最佳的整体解决方案。""",3.8
食品和药物管理局拒绝了ImClone公司2001年销售Erbitux的申请，理由是伪劣的研究。,美国食品和药物管理局在2001年12月拒绝了ImClone最初的申请，称试验进行得很草率。,2.8
批评者说，法律侵犯了公民自由，众议院司法委员会主席詹姆斯-森森布伦纳（James Sensenbrenner，R-Wis）说他对这一点很敏感。,众议院司法委员会主席詹姆斯-森森布伦纳（James Sensenbrenner）表示，他对公民自由的投诉很敏感。,3.75
"道奇队连续赢得了他们的第六场比赛他们自2001年以来最长的连胜，因为他们以3-2战胜了科罗拉多州，周三在道奇体育场的25,332名观众面前。","道奇队连续赢得了他们的第六场比赛，也是他们过去九场比赛中的第七场比赛，他们周三在道奇体育场的25,332名观众面前以3-2击败科罗拉多。",4.4
这些州的当局表示，到目前为止，他们已经搜查了宾夕法尼亚州、俄亥俄州、密歇根州、伊利诺伊州和印第安纳州。,到目前为止，当局还对宾夕法尼亚州、俄亥俄州、印第安纳州和密歇根州的地区进行了搜查。,3.75
30年期公债US30YT=RR坚挺31/32，使其收益率从4.22%降至4.16%--再创新低。,30年期公债<US30YT=RR>24/32坚挺，收益率达到4.18%，此前再创历史新低4.16%。,2.75
Lay曾辩称，交出文件将侵犯他的第五修正案规定的不得自证其罪的权利。,Lay拒绝交出文件，声称他有第五修正案中反对自证其罪的权利。,3.8
斯特雷霍恩说，这是德克萨斯州历史上第一次有主计长没有认证拨款法案。,斯特雷霍恩在周四的新闻发布会上表示，这是主计长第一次拒绝预算。,3.2
如果不考虑这些费用，分析师平均预期每股亏损11美分。,接受汤森金融第一电话调查的分析师曾预计，持续经营业务每股亏损约11美分。,3.8
安全专家警告说，一种新的群发蠕虫正在互联网上广泛传播，有时会冒充微软创始人的电子邮件。,反病毒厂商周一表示，一种新的蠕虫病毒已经在互联网上迅速传播，有时会假装成微软董事长比尔-盖茨的电子邮件。,4.8
萨赫勒先生说，警方已经确认了据信在周六进行了五次几乎同时的攻击的14个小组中的七具尸体。,他说，警方已经确认了14名轰炸机中的7具尸体，这些轰炸机在周五晚上几乎同时发动了5次突袭。,4.0
现在只有新泽西州禁止持有学习者许可证或中级许可证的人在开车时使用手机、传呼机或其他无线设备。,此外，NTSB还向NHTSA建议各州立法，禁止持有学习者许可证和中级许可证的人在驾驶时使用手机。,1.4
密歇根大学在6月份美国最高法院推翻了之前录取本科生的方式后，今天发布了新的招生政策。,密歇根大学计划周四发布新的本科招生政策，因为其录取要求在6月被美国最高法院驳回。,4.2
阿拉伯半岛电视台上周播放的录音带似乎是为了煽动攻击。,阿拉伯半岛电视台上周播出的一盘录音带，可能是迄今为止萨达姆在战争中幸存的最有力证据。,1.8
公司没有详细说明更换和维修的费用。,但公司官员预计，更换工程的费用将达到数百万美元。,2.0
"迪安在10个城市的 ""不眠之夏 ""巡演中告诉记者，他认为在德克萨斯州的竞选活动是一种挑战。","今天，迪恩结束了他在芝加哥和纽约为期四天、十座城市的 ""不眠之夏 ""巡演。",2.6
"""我觉得如果我和罗西意见分歧太大，就会失去工作。""她说。","卡文德确实说过。 ""我觉得如果我和罗西意见分歧太大，我就会失去工作。""",3.25
"美国的这一决定激起了欧盟委员会的愤怒反应，该委员会称此举 ""在法律上没有依据，在经济上没有根据，在政治上没有帮助""。","欧盟强大的执行机构--欧盟委员会将此举描述为 ""在法律上没有理由，在经济上没有根据，在政治上没有帮助""。",3.75
Cripps-Prawak女士上周五离开，两天后该部门推出了一项通过医生办公室分发医用大麻的计划。,医疗准入办公室主任Cindy Cripps-Prawak在该部门推出通过医生办公室分发大麻的计划后离职。,4.25
Morgenthau说，在2001年和2002年期间，Beacon Hill的40个账户中仅有4个账户的电汇总额就超过了32亿美元。,Morgenthau说，从2001年到2002年，在Beacon Hill开设的40个账户中，有4个账户的电汇总额超过了32亿美元。,4.75
去年，他竞选民主党州长提名未果。,他去年竞选民主党德州州长提名，但在初选中输给了千万富翁托尼-桑切斯。,3.25
全国最大的零售商已经告诉其100家顶级供应商，他们必须在2005年1月25日之前开始在所有货物托盘上使用电子标签。,沃尔玛已经告诉其前100家供应商，他们需要在2005年1月25日之前安装无线射频识别系统，以便在供应链中跟踪货物的托盘。,3.75
他被送往医院，对颈部进行预防性X射线检查。,哈维被带到圣卢克医院进行预防性的颈部X光检查，结果是阴性。,3.25
法案说，接受这种堕胎的妇女不能被起诉。,根据该法案，接受这种堕胎的妇女不能被起诉。,5.0
议会中有103名民主党人，47名共和党人。,民主党人在议会中占主导地位，而共和党人则控制着参议院。,2.0
"""我来到华盛顿基本上是为了建立关系，并确保我们向加州提供更多的联邦资金，""施瓦辛格在与国会共和党人会面后说。","""我来到华盛顿基本上是为了建立关系，确保我们获得更多的联邦资金，""施瓦辛格在一次会议后说。",4.2
劳动力市场的最新快报略好于经济学家的预期；他们预测上周的申请人数将不低于41万。,尽管就业市场存在问题，但最新的劳动力市场快报略好于经济学家的预期。,3.4
27岁的Chante Jawan Mallard周一受审，被控一级谋杀罪。,27岁的Chante Jawaon Mallard被控谋杀和篡改证据。,3.0
琳达-桑德斯在联邦法院承认了六项指控，包括敲诈、洗钱和阴谋。,菲普斯前助手琳达-桑德斯和鲍比-麦克兰姆都承认了包括敲诈在内的联邦指控。,2.75
维旺迪股价在巴黎收盘上涨3.8%，报15.78欧元。,北京时间0841，维旺迪股价在巴黎上涨0.3%，报15.62欧元。,2.6
微软已经将自由发布的Linux软件确定为其销售的最大威胁之一。,该公司已经公开将Linux作为最大的竞争威胁之一。,3.4
现年58岁的安东尼奥-蒙泰罗-德卡斯特罗（Antonio Monteiro de Castro）现任集团拉丁美洲和加勒比地区业务总监，将于同日起担任首席运营官。,BAT还表示，拉丁美洲和加勒比地区总监Antonio Monteiro de Castro将于2004年1月1日出任首席运营官。,3.6
"""旋转和操纵性的公共关系和宣传不是答案，""它说。","报告还说，""旋转 ""和操纵性的公共关系 ""不是答案""，但也不是回避辩论。",3.6
11月11日，在距离高速公路约两英里的奥贝茨汉密尔顿中央小学发生了另一起与狂欢有关的枪击事件。,最近一次与狂欢有关的枪击事件是11月11日在奥贝茨的汉密尔顿镇小学发生的枪击事件，距离高速公路约两英里。,4.8
周二，央行如预期般维持利率稳定，但也宣布整体风险偏重于疲软，并警告通缩风险。,央行政策委员会如外界普遍预期的那样，暂时保持利率稳定，但却出乎市场意料地宣称整体风险偏重于弱势。,4.0
在四名北韩记者在主要媒体中心外与十几名抗议北韩侵犯人权行为的韩国活动家对峙后，爆发了战斗。,当至少四名北朝鲜记者从大邱媒体中心冲出，与十几名抗议北朝鲜侵犯人权行为的活动家对峙时，问题就爆发了。,3.4
Dusty与肾癌抗争了一年多。,2001年，尘子因癌症做了手术，切除了一个肾脏。,2.4
卡德罗夫没有受伤，但他的4名保镖也在被杀之列。,但Itar-Tass通讯社说，他的4名保镖也在被炸死的人中。,3.0
该委员会估计，2001年加州因避税而损失了13.4亿美元，是所有州中损失最多的。,该委员会估计，2001年加州因公司避税而损失9.37亿美元。,2.75
官员们没有说明美军是否越境进入叙利亚境内，对叙利亚边防军如何参与其中也含糊其辞。,美国官员没有说明美军是否根据情报行事，越境进入叙利亚境内，并对叙利亚卫队如何参与其中含糊其辞。,4.0
VeriSign在9月15日推出了Site Finder服务。,围绕VeriSign三周前推出的Site Finder服务的战斗仍在继续。,1.75
她说，德鲁斯仍被关押在监狱，现在被隔离。,德鲁斯昨晚被隔离关押在同一监狱。,4.5
他们的领导人Abu Bakr al-Azdi于6月自首；他的副手在最近与沙特部队的枪战中被打死。,他们的领导人Abu Bakr al-Azdi于6月投降；他的副手最近在与沙特部队的枪战中被打死。,5.0
在弗雷塔斯的开庭陈述之后，金县高级法院法官查尔斯-梅特尔将审判休庭，直到感恩节周末之后。,金县高级法院法官Charles Mertel随后将休庭至周一。,3.0
该文件指出，谷歌的投资者包括著名的风险投资公司Kleiner Perkins Caufield & Byers和红杉资本。,谷歌在早期阶段的支持者包括位于加州的斯坦福大学以及风险投资公司Kleiner Perkins和红杉资本。,2.8
7月1日是香港回归中国统治六周年纪念日。,1997年7月1日，香港回归中国六周年纪念活动，为这次集会蒙上了阴影。,2.667
Palm周三宣布了收购Handspring的计划，Handspring是由Jeff Hawkins创办的公司，被许多人视为Palm掌机之父。,Palm周三表示，计划收购叛逆的Palm联合创始人Jeff Hawkins创建的Handspring公司。,4.0
在棉兰老岛发生一连串袭击事件，包括三起爆炸事件后，政府最近搁置了与马来西亚斡旋的摩洛伊斯兰解放阵线的和平谈判。,在棉兰老岛发生一系列袭击事件，包括三起致命的爆炸事件后，政府最近搁置了由邻国马来西亚促成的和平谈判，并将其归咎于摩洛伊斯兰解放阵线。,4.25
该公司上年同期实现利润5430万美元，合每股22美分。,这比去年同期有所增长，当时公司盈利5430万美元，合每股22美分。,4.176
周一加入波士顿的还有马萨诸塞州的沃特镇、萨格斯和弗拉明汉姆社区。,除了波士顿，沃特镇、萨格斯和弗雷明汉也将在周一实现无烟化。,3.0
作为美国支持的中东和平计划的一部分，以色列士兵一夜之间推倒了西岸10个小型定居点前哨的空活动房屋和水塔。,以色列士兵昨天开始拆除西岸的定居点前哨，这是以色列在新的中东和平计划下的一项义务。,3.8
工会尚未透露将针对哪家连锁店。,工会表示，稍后会透露将针对哪家连锁店。,4.6
"把所有的东西都拿出来。""位于纽约市的全国零售咨询公司Davidowitz & Associates董事长霍华德-达维维茨说。","无论是否无辜，""她都是受损的商品，""纽约一家全国性零售咨询公司Davidowitz & Associates的董事长霍华德-戴维维茨说。",1.4
更新的产品包括Pylon Pro、Pylon Conduit、Pylon Anywhere和Pylon应用服务器。,桌面端新产品包括最新版本的Pylon Conduit和Pylon Pro。,2.8
土耳其当局表示，所有自杀式炸弹袭击者都是土耳其人。,安卡拉说，这四名自杀式炸弹袭击者都是土耳其人。,4.2
4月，它曾预测经营收益在每股60至80美分之间。,柯达预计本季度每股收益为5美分至25美分。,1.0
从佛罗里达州到阿拉斯加，成千上万的狂欢者发誓要推动更多的合法权利，包括同性婚姻。,数千名狂欢者在庆祝这一决定时，发誓要推动更多的合法权利，包括同性婚姻。,4.2
其他具有这种地位的还有埃及、以色列和澳大利亚。,像以色列和澳大利亚这样的国家已经拥有这种地位。,2.5
研究结果出现在周三的《美国医学会杂志》（新闻-网站）上。,该结果将发表在周三出版的《美国医学会杂志》上。,3.5
此外，h2210的摇篮还有空间为第二块电池充电。,h2200的座架有为第二块电池充电的空间。,4.75
"14名库尔德人中有一人指着英语/土耳其语词典中的 ""难民 ""一词。","一个人挥舞着一本英土词典，指着 ""难民 ""一词。",3.5
"""霍华德先生说：""执法机构和情报部门之间的密切合作是当前打击恐怖主义的核心。",他说，区域执法机构和情报部门之间的密切合作是打击恐怖主义的核心。,4.0
该集团表示，2006年，该市场的销售额将反弹29.6%，达到213亿美元。,2006年，亚太地区将增长7.9%，达到818亿美元。,2.0
美国第一装甲师的罗伯特-拉姆齐上尉说，上午11点左右，一辆卡车在楼外爆炸，大院的一面外墙已经倒塌。,美国第1装甲师罗伯特-拉姆齐上尉说，上午11点左右，一辆卡车在楼外发生了爆炸。,3.2
今年北秋，美军教官将与北非四国的士兵合作，进行巡逻和收集情报。,今年晚些时候，指挥部将派出教官与北非四国士兵一起执行巡逻和情报收集任务。,3.8
"""这些数字正变得灾难性，""急诊室医生协会主席Patrick Pelloux博士说。","法国急诊医生协会主席帕特里克-佩鲁说：""这是不可接受的。",2.5
"科维罗对这位49岁的老人说：""不管你受到了什么惩罚，肯定是绰绰有余的。""他的家人、朋友和支持者挤满了半个法庭。","""先生，你的遭遇，作为惩罚，当然是绰绰有余。""科维罗说。",3.0
这位母亲还在诉讼中称，她被其中一名看守性侵。,这位母亲还辩称，在1998年的冲突中，她遭到一名警卫的性侵犯。,4.0
是的，从今天起，从AMD或富士通购买的闪存将被冠以Spansion的品牌。,Spansion闪存解决方案由AMD和富士通在全球提供。,2.625
全球最大的两家汽车制造商表示，由于夏末的销售狂潮引起的行业反响比预期的要大，他们上个月在美国的销量下降幅度超过了预期。,由于夏末的疯狂销售引发了大于预期的行业反弹，通用汽车公司和排名第二的福特汽车公司的国内销量下降幅度都超过了预期。,3.2
一场热带风暴周日在墨西哥湾迅速发展，预计到周一晚上将袭击德克萨斯州或路易斯安那州海岸的某个地方。,周日，一场热带风暴在墨西哥湾迅速发展，周一晚上袭击路易斯安那州海岸某处陆地时，可能会有飓风级的风力。,4.0
周四的压力可能会上升，有线电视体育网ESPN计划对最后一轮进行全国报道。,今天的压力会更大，ESPN计划对最后一轮进行全国性的报道，话语权更加困难。,3.2
帕塔基赞扬了亚伯拉罕的决定，LIPA主席理查德-凯塞尔说，电缆应该永久保持运行。,"LIPA主席Richard Kessel表示，这意味着电缆可以 ""按照我们认为合适的方式 ""使用。",2.4
Dynes在AT&T贝尔实验室担任物理学家22年后，于1991年来到加州大学圣地亚哥分校。,Dynes自1991年起在加州大学圣地亚哥分校工作，此前他在AT&T贝尔实验室工作了22年，研究超导体和其他材料。,3.6
脑膜炎是指脊髓液和大脑周围组织的感染。,脑膜炎是指人的脊髓和大脑周围的液体感染。,4.6
市长帕克（Joe T. Parker）周四晚些时候表示，当第一次爆炸发生时，三名工人是两名男子和一名女子，他们在建筑物内。,市长乔-T-帕克说，第一次爆炸发生时，失踪的工人有两男一女，都在楼内。,4.4
"总部设在伦敦的NCRI官员Ali Safavi告诉路透社。 ""我们谴责这次突袭，我们认为这次突袭是非法的，在道义上和政治上都是不正当的""。","""我们谴责这次突袭，我们认为这次突袭是非法的，在道义上和政治上都是不正当的，""总部设在伦敦的全国反贪局官员阿里-萨法维通过电话告诉路透社。",4.6
它在他手中爆炸，但这位意大利前总理却毫发无伤。,寄给普罗迪的信弹在他手中爆炸，但他没有受伤。,3.6
Halabi的军事律师，空军少校James Key否认了这些指控，这些指控可能会被判处死刑。,据美联社报道，代表al-Halabi的律师、空军少校James Key III否认了这些指控。,3.2
"瓦克萨尔在给法院的信中说。 ""我把我的家庭撕碎了。",在争取宽大处理的过程中，瓦克萨尔向法院、员工和家人道歉。,2.0
杰罗说，自5月初以来，该市已收到1400份蓝鸟和乌鸦死亡的报告。,他说，自5月初以来，该市已收到1400份报告。,2.8
"但享受吸烟权利的自由组织Forest说：""提到禁烟这个词，大家都知道那里发生了什么。","森林，享受吸烟权利的自由组织说，它已经用 ""有趣和不相信 ""来迎接柳叶刀的呼吁。",1.6
一旦换股，贝星将拥有合计约295万股SCO普通股，占公司已发行股份的17.5%。,此次投资使总部位于加州拉克斯普尔的BayStar获得了290多万股SCO普通股，占该公司流通股的17.5%。,4.0
欧佩克产油国在周三的会议上将向独立石油出口国施压，要求它们为卡特尔的下一次减供做出贡献，以允许伊拉克石油回归。,欧佩克本周将向独立出口商施压，要求其支持该卡特尔的下一次减供，以防止伊拉克恢复出口削弱油价。,2.8
联邦贸易委员会(FTC)今天要求国会给予更多的授权，以打击不需要的互联网垃圾邮件，目前垃圾邮件占所有电子邮件流量的一半。,联邦贸易委员会昨天要求国会授予更广泛的权力，以攻击迅速增长的垃圾邮件问题，新的研究表明，垃圾邮件占所有电子邮件流量的一半。,5.0
联邦大陪审团周二对他们进行了起诉；该文件被封存，直到昨天才允许当局进行逮捕。,联邦官员说，该文件直到周四上午仍被封存，以便当局在西部五个州进行逮捕。,3.4
"自始至终反对这些行动的人，现在都在试图寻找新的理由，说这不是正确的做法。""","""现在的情况是，自始至终反对这一行动的人，都在试图寻找新的理由来解释为什么这不是正确的事情。""",4.0
理查德-米勒在接受了肝脏移植手术后仍在住院，但他的妻子已经康复。,57岁的理查德-米勒（Richard Miller）在救命的肝脏移植手术中幸存下来，但仍在住院治疗。,3.2
无法立即联系到Sequent代表对上合组织的公告发表评论。,今天下午，无法联系到上合组织的发言人发表评论。,3.8
雇主覆盖的人口比例从2001年的62.3%下降到去年的61.3%。,从雇主处购买保险的美国人比例从2001年的62.6%和2000年的63.6%下降到61.3%。,3.2
世界排名第二的Lleyton Hewitt指责网球专业人员协会的恶意，包括据称去年试图欺骗他拒绝药物测试。,世界排名第二的Lleyton Hewitt指责他的职业同行长期以来的恶意，包括去年试图欺骗他拒绝药物测试。,4.0
MSN Messenger 6将于北京时间周三下午6点开始提供下载，下载地址为http://messenger.msn.com/download/v6preview.asp。,根据微软的说法，MSN Messenger 6软件将从太平洋时间周三上午11点开始提供。,3.25
"对于此次事件，我已经承认自己的行为不妥。""","""我已经承认我的行为不妥。""他说。",4.25
