Un attentat suicide au Yémen tue 7 soldats : les fonctionnaires,Un attentat suicide à la voiture piégée en Afghanistan fait au moins sept morts : les fonctionnaires,1.6
Le vote présidentiel polarise les Égyptiens,Les candidats à la présidence du GOP s'affrontent dans les courses du Sud,0.8
Trois autres soldats américains tués en Afghanistan,Un soldat de l'OTAN tué en Afghanistan,1.8
La police porte à 8 le nombre de morts dans un accident de bus,La mort de Rodney King jugée accidentelle,0.4
Quatre soldats étrangers tués dans l'est de l'Afghanistan,2 soldats britanniques tués dans une attaque d'initiés afghans,0.8
Un employé de la Croix-Rouge tué au Pakistan,Un médecin de la Croix-Rouge britannique kidnappé au Pakistan est retrouvé décapité,3.6
Les gouvernements américain et afghan signent un accord sur un raid nocturne controversé,Les Afghans et les Etats-Unis signent un accord sur les raids nocturnes,3.8
L'accident d'une mine en Chine tue 10,Un accident de camion en Chine fait 20 morts,1.6
L'Australie peut éclipser l'Angleterre dans le vent,Le Premier ministre australien sous pression,0.4
Protestations à l'occasion du verdict de l'émeute des chattes,Le verdict de l'émeute des chattes accueilli avec défi,3.4
"Les services secrets voient leur ""plus grand scandale"" sur les prostituées","Le scandale sexuel des services secrets : ""regret"".",2.2
Le Koweït : Des militants prennent d'assaut l'ambassade syrienne ; deux blessés,Des militants prennent d'assaut l'ambassade de Syrie au Koweït,3.4
Détails de la visite d'Aung San Suu Kyi en Irlande,Accueil enthousiaste pour le voyage historique d'Aung San Suu Kyi,3.4
"Selon Key, la visite de Marae est une occasion perdue",Key veut que la visite de Waitangi marae reste,2.2
La Norvège célèbre l'anniversaire du massacre,La Norvège célèbre l'anniversaire du massacre de Breivik,3.8
Une femme tuée par la chute de débris,Quand un allié décline,0.0
Les actions Aust en hausse de 1% après la baisse des taux d'intérêt,La RBA propose une nouvelle réduction des taux,1.0
L'Allemagne met en garde la Grèce : Plus d'argent sans réformes,Zone euro à la Grèce : Pas de sauvetage sans réformes,2.6
Obama va rencontrer les familles des victimes de fusillades,Obama va rencontrer les victimes de Batman,3.2
Obama élargit son avance sur Romney malgré les données sur l'emploi : Sondage Reuters/Ipsos,"Romney prend le dessus sur Obama avec le ""rebond"" de la convention : Sondage Reuters/Ipsos",1.0
"Deux morts, 19 blessés dans une fusillade à Toronto","Deux morts, 7 blessés en Finlande par balle",1.4
Ce qu'a vu le majordome du pape - arrestation d'un collaborateur à cause de fuites au Vatican,Le majordome du pape arrêté dans le cadre d'un scandale concernant des fuites au Vatican,3.4
Les manifestants anti-Poutine forment une chaîne humaine à Moscou,Les manifestants anti-Poutine forment une chaîne humaine,3.8
"Les Actes du Congrès de Washington se vendent à 9,8 millions de dollars","L'exemplaire de la Constitution américaine de George Washington se vend 9,8 millions de dollars",2.6
"Mike Brown, entraîneur des Lakers après le départ 1-4",Les Lakers virent Mike Brown après le départ du 1-4,4.4
Les musulmans canadiens émettent une fatwa contre les crimes d'honneur,Les imams américains et canadiens émettent une fatwa contre les crimes d'honneur,3.4
L'ONU va se saisir de la résolution sur la Syrie,L'Assemblée de l'ONU va voter une résolution sur la Syrie,3.6
Un soldat ne se souvient pas du massacre,"Un soldat américain ""ne se souvient pas d'un massacre"".",4.4
Le Premier ministre libyen nomme un nouveau cabinet après les protestations sur le projet de loi,"L'assemblée libyenne rejette le nouveau cabinet, démet le PM",1.2
4 soldats étrangers tués dans l'est de l'Afghanistan,4 soldats français auraient été tués en Afghanistan,3.8
Les forces syriennes prennent d'assaut le centre ville,"Les forces syriennes bombardent Homs, la Russie met en garde contre une guerre civile",2.5
Pak : 20 morts dans les manifestations contre le cinéma anti-islamique,"25 blessés lors d'une manifestation contre le cinéma anti-islamique à Islamabad, au Pakistan",2.2
La cause de la mort de Whitney Houston pourrait prendre des semaines,Les enquêteurs cherchent des réponses à la mort de Whitney Houston,1.8
La Corée du Nord met en garde contre des représailles pour un exercice de la Corée du Sud,Le Nord met en garde contre des représailles pour le plan d'exercice naval de Séoul,3.6
Un conte de deux passages : Comment les New York Giants ont gagné le Super Bowl,Le moindre des deux maux triomphe au Super Bowl,1.4
Un mort dans la nouvelle frappe israélienne sur Gaza,Deux morts dans la nouvelle frappe israélienne sur Gaza : les médecins,3.6
L'Allemagne va probablement faire pression sur la Russie au sujet de la crise syrienne,Que pense la Russie de la Syrie ? Un guide succinct,1.0
Quatre personnes gravement blessées dans l'accident de l'autoroute M23,Quatre blessés dans un accident d'autoroute,3.6
"Le chef de l'aide des Nations unies, Amos, entre dans Baba Amr avec le Croissant-Rouge","Le Baba Amr assiégé de Syrie est désert, selon la Croix-Rouge",2.0
Des dizaines de morts dans les émeutes nigérianes,Des dizaines de morts dans les affrontements au Kenya,1.0
Profils des principaux candidats à la présidence égyptienne,Deuxième jour de l'élection présidentielle égyptienne,1.2
L'acteur Gazzara mort à 81 ans,L'acteur Ben Gazzara meurt à 81 ans,4.4
La ruée vers l'or britannique fait taire les griefs sur les coûts,2 soldats britanniques tués dans une attaque d'initiés afghans,0.6
Une avalanche enterre au moins 100 soldats pakistanais,Une avalanche a enseveli plus de 100 soldats pakistanais,4.6
L'inflation tombe à son niveau le plus bas depuis 15 mois : ce qu'en disent les analystes,L'inflation tombe à son niveau le plus bas depuis 15 mois,4.6
Komen ne réduira pas le financement du Planned Parenthood,Susan G Komen dans le cadre de la réduction du financement du Planned Parenthood,3.0
Forex &amp ; Or 25 août 2012,Forex & Or 19 juillet 2012,2.2
L'Iran affirme que les négociations nucléaires de l'ONU vont se poursuivre,"L'Iran juge ""constructives"" les discussions sur le nucléaire avec l'ONU",2.8
L'agroalimentaire : La maladie de la vache folle trouvée en Californie,L'USDA confirme un cas de maladie de la vache folle en Californie,4.2
"BP vend certains actifs du Golfe du Mexique pour 5,55 milliards de dollars","BP vend des actifs du Golfe du Mexique à Plains pour 5,55 milliards de dollars",3.6
300 victimes potentielles de Jimmy Savile : la police,Royaume-Uni : 300 victimes potentielles d'abus de Savile émergent,3.6
Armstrong quitte Livestrong,Armstrong se retire de Livestrong,4.6
Un drone américain tue 5 militants au Pakistan,Les attaques de drones américains tuent 16 militants présumés au Yémen,1.8
Le gouvernement syrien n'arrêtera pas les attaques,"L'opposition syrienne rapporte un ""massacre"".",1.0
Les actions chinoises clôturent en hausse vendredi midi,Les stocks chinois en hausse vendredi midi,4.6
Myanmar : L'opposition prétend que Suu Kyi a gagné,Les électeurs du Myanmar sont optimistes car le parti de Suu Kyi prétend gagner,3.2
La cote d'Obama baisse dans les sondages pour ses rivaux républicains,La grande victoire hispanique d'Obama inquiète les républicains,1.0
Deux soldats de l'Aust blessés en Afghanistan,4 soldats étrangers tués dans l'est de l'Afghanistan,1.2
Le nouveau chef de l'opposition syrienne veut une aide sans conditions,L'opposition syrienne s'unit alors qu'Israël tire des coups de semonce,1.0
Le conflit des mines en Afrique du Sud fait au moins 30 victimes,L'accident de train en Afrique du Sud fait 26 victimes,0.8
"Les forces syriennes bombardent Homs, la Russie met en garde contre une guerre civile","Les forces syriennes bombardent Homs, Lavrov arrive pour des pourparlers",2.6
Report des résultats de l'élection présidentielle en Égypte,Report du résultat des élections égyptiennes,4.2
La date limite est passée sans nouvelles sanctions contre l'Iran,L'UE se rapproche des nouvelles sanctions contre l'Iran,1.6
Le tueur russe arrêté nie tout lien avec l'émeute de la Chatte,Des dizaines de personnes arrêtées lors d'une manifestation contre la tour de télévision russe,0.8
Le mémorial norvégien rend hommage à 77 victimes de massacres,La Norvège célèbre l'anniversaire du massacre,2.8
Un général américain d'Afghanistan lié au scandale Petraeus,Un haut général américain lié au scandale Petraeus,3.8
Baisse des stocks chinois après la réduction du RRR - 14 mai,Les actions chinoises gagnent du terrain lundi midi,2.0
"La Corée fait des progrès ""significatifs"" dans le domaine des réacteurs nucléaires - AIEA",N. La Corée s'engage à renforcer sa dissuasion nucléaire,2.8
Le président des Maldives démissionne après une mutinerie policière et des protestations,Le président des Maldives démissionne après des semaines de protestations,3.4
"Une frappe de l'OTAN ""tue des civils"" en Afghanistan",Deux soldats de l'OTAN tués en Afghanistan,0.8
Al-Qaida dit avoir capturé 70 soldats yéménites dans la bataille d'Abyan,"Al-Qaïda s'affronte, des explosions tuent 35 soldats au Yémen",1.4
"Un avion de la marine s'écrase dans des appartements américains, des pilotes s'éjectent",Un jet de la marine américaine s'écrase sur des immeubles d'habitation en Virginie,3.4
Les stocks de la Chine augmentent mercredi,Les actions américaines ouvrent plus haut malgré le manque de PIB,0.8
L'IDF va déployer l'Iron Dome dans le centre d'Israël,Une importante tempête de neige déverse des barils sur les plaines centrales,0.0
4 personnes tuées lors d'une attaque de drones américains au Pakistan,Un drone américain tue 3 personnes au Pakistan,3.0
"Un adolescent américain détenu dans le cadre d'un attentat à la voiture piégée du ""Jihad"" à Chicago",Un adolescent de Chicago arrêté dans le cadre d'un attentat à la voiture piégée à Chicago,3.4
"PC David Rathband : les craintes du frère jumeau pour son ""meilleur ami"".",David Miliband : mon frère et un retour au vieux Labour,0.2
Les forces syriennes s'apprêtent à reprendre Alep,Le régime syrien veut reprendre la ville d'Alep,4.4
Une équipe parlementaire de 20 membres et une équipe commerciale part pour l'Inde,Le secrétaire d'État au commerce prend un congé,0.0
Wall Street s'ouvre plus bas,Wall Street se termine de façon mitigée,2.0
Les actions européennes rebondissent sous l'effet de la relance chinoise,Le prix du pétrole augmente en raison des espoirs de relance,0.8
Les contrats à terme sur les indices boursiers annoncent un début de baisse,Les contrats à terme sur les indices boursiers signalent des pertes anticipées,4.4
Un homme accusé d'avoir blessé un député lors d'un attentat,Un homme accusé de meurtre dans un appartement,1.4
"Nokia s'excuse pour la ""fausse"" publicité",Les États-Unis renoncent à des avenants pour l'aide au Pakistan,0.0
Un drone américain tue 5 militants au Pakistan,Un drone tue quatre militants présumés au Pakistan,3.0
Les rebelles syriens quittent Homs assiégée,Les rebelles syriens se retirent du quartier assiégé de Homs,4.4
Les États-Unis ordonnent au personnel non essentiel de quitter le Soudan et la Tunisie,Les États-Unis ordonnent au personnel non essentiel de quitter la Tunisie et le Soudan,4.0
Moubarak critique l'Egypte,Moubarak en Égypte dans un état critique,4.6
Assad dit que les mercenaires sont derrière les troubles en Syrie,Assad accuse les Etats-Unis d'avoir alimenté le soulèvement syrien,3.33333333333333
Le Premier ministre japonais dissout la Chambre basse pour les élections,L'Iran et les puissances mondiales prêts pour les négociations sur le nucléaire,0.0
Deux morts dans la nouvelle frappe israélienne sur Gaza : les médecins,"5 morts dans les frappes sur Gaza, des militants font barrage à Israël",2.0
"Un avion de la marine s'écrase sur des bâtiments de Virginie, faisant six blessés","Un avion de la marine s'écrase dans des appartements en Virginie9, avec des blessés",3.2
Un soldat de l'OTAN tué en Afghanistan du Sud,Un soldat britannique tué dans le sud de l'Afghanistan,3.2
Le taux de chômage en Espagne atteint un nouveau sommet,Le nombre de chômeurs en Espagne atteint un nouveau sommet,4.2
La Turquie brouille les jets près de la frontière,La Turquie envoie des avions à la frontière syrienne,3.6
Deux morts en Syrie : les violences après la surveillance des terres par l'ONU,Deux ans d'interdiction de dopage pour Contador,0.0
"Un civil, transfuge tué en Syrie, selon une ONG",Des tireurs syriens tuent trois officiers syriens : ONG,1.0
Taïwan secouée par un fort tremblement de terre,La Chine secouée par deux tremblements de terre,1.2
"Paul Tucker, de la Banque d'Angleterre, entaché par le désordre du Libor",L'adjoint de la Banque d'Angleterre refuse d'ordonner le truquage des taux,2.8
La Croix-Rouge dit qu'elle négocie l'arrêt des combats en Syrie pour obtenir de l'aide,La Croix-Rouge négocie un cessez-le-feu avec la Syrie pour apporter de l'aide,4.4
Les forces syriennes tirent sur des civils dans un bus,Les forces syriennes et les rebelles s'affrontent près de la Turquie,0.8
Le Parlement allemand soutient massivement l'accord de sauvetage de la Grèce,Le Parlement allemand approuve le plan de sauvetage de la Grèce,4.4
Les bombardements et les affrontements se poursuivent en Syrie,"Bombardements, affrontements alors que l'opposition syrienne cherche des armes",3.4
Les réformes de la Birmanie entraînent un assouplissement des sanctions américaines,Les militants birmans disent qu'il faut ralentir l'assouplissement des sanctions,2.4
Usain Bolt gagne le 200m - réaction de Steven Howard,Les gains de la téléphonie mobile sur Facebook stimulent la croissance des revenus : réaction,0.2
Des dizaines de morts dans l'attaque d'un centre de villégiature des Talibans,La police indienne nomme 3 Iraniens dans l'attaque d'une ambassade,0.4
L'Est de la Syrie en proie à de violents combats avant le scrutin,De lourds combats secouent l'est de la Syrie - résidents,3.8
"Le yuan chinois s'affaiblit à 6,3282 contre le dollar lundi","Le yuan chinois se replie à 6,2697 contre le dollar jeudi",2.8
7 morts dans la fusillade d'une école chrétienne,5 blessés dans la fusillade d'une école de l'Ohio,1.4
La brigade antiterroriste indonésienne tue deux militants présumés,La police indonésienne abat des militants présumés à Bali,3.2
Élection aux États-Unis : Mitt Romney concède sa défaite alors que Barack Obama remporte son second mandat,Romney concède l'élection à Obama par téléphone,4.0
Les Arméniens votent aux élections législatives,"Le vote du parlement arménien, un test pour le président",3.2
Sachin Tendulkar est assermenté comme sénateur indien,Le député Sachin Tendulkar dit non à un bungalow du gouvernement,1.6
Un jet de la marine s'écrase dans un immeuble d'habitation,Un jet de la marine américaine s'écrase sur des immeubles d'habitation en Virginie,3.6
Romney remporte une grande victoire dans les primaires de Porto Rico,Romney remporte les primaires de l'Illinois,1.5
Yahoo ! va nommer le PDG de Google Mayer : rapport,"Yahoo nomme Mayer, directeur général de Google",4.2
Un soldat américain accusé de massacre en Afghanistan engage un éminent avocat spécialisé en droit pénal,Un soldat américain accusé d'avoir tué des civils afghans est identifié,2.0
"Un tremblement de terre de magnitude 6,0 frappe le nord de l'Italie : USGS","Un séisme de magnitude 5,9 frappe le détroit de Sunda, en Indonésie : USGS",1.6
Le gouvernement américain désigne officiellement le réseau Haqqani comme terroriste,Les États-Unis désignent le réseau Haqqani comme terroriste,4.4
Course automobile : Bouton le plus rapide lors du premier essai de F1 de l'année,Button se vante de son meilleur temps après la première pratique,3.0
Les Rangers votés en Division 3,Les Rangers votés en troisième division,4.8
Le maire de Newark sauve son voisin du feu,Le maire de Newark sauve un voisin d'une maison en feu,4.2
Manifestations de la F1 à Bahreïn,Une journée de rage à Bahreïn,2.25
Réouverture de la bourse de New York mercredi,DealBook : Les bourses se préparent à ouvrir,3.0
Le tir de mortier de Homs tue 105 personnes,L'offensive Homs tue 200 personnes,2.6
Des centaines d'étudiants d'honneur tués dans une fusillade dans l'Ohio,Funérailles de la victime de la fusillade dans l'Ohio,2.0
"Les bombes dans le sud de la Thaïlande tuent 5 personnes, en blessent 50","En Thaïlande, les bombes tuent 14 personnes et en blessent 340",3.0
Les législateurs américains franchissent une nouvelle étape dans les nouvelles sanctions contre l'Iran,Les législateurs somaliens vont voter pour le nouveau président,0.2
"Barack Obama admet que les Etats-Unis ont ""plus d'armes nucléaires qu'il n'en faut"".","Un tireur français veut ""mourir les armes à la main"".",0.4
2 roquettes ont été tirées dans la région d'Eshkol ; aucun blessé,10 fusées en 20 minutes au Conseil régional d'Eshkol,1.8
"Les travailleurs handicapés ""trahis"" protestent contre les fermetures de Remploy",Le 1er mai est marqué par des protestations contre les mesures d'austérité,0.6
Les rebelles de la RD Congo tuent des gardes forestiers,Les rebelles tuent deux gardiens de parc dans l'est du Congo,4.0
Neuf soldats pakistanais tués dans une embuscade,Le commerce : Le Pakistan et l'Inde acceptent de prendre une longueur d'avance,0.8
74 morts en Egypte violence dans le football,Au moins 73 personnes meurent lors de l'invasion des terrains de football égyptiens,3.2
Les troubles dans un Nigeria tendu font au moins 95 morts,Les tremblements de terre du sud-ouest de la Chine font au moins 50 victimes,0.2
L'ouragan Sandy touche terre dans le sud-est de la Jamaïque : NHC,L'ouragan Sandy atteint la Jamaïque,3.0
Remarques avec le Premier ministre Elkeib après leur rencontre,Remarques avec le ministre des affaires étrangères Koichiro Gemba,1.5
Barrick en pourparlers avec une entreprise chinoise au sujet d'actifs africains,L'aide d'Obama en Chine après le veto de la Syrie,1.2
"Les attaquants des centres commerciaux ont utilisé la stratégie du ""moins c'est plus"".","Au Kenya, les attaquants ont utilisé la stratégie du ""moins c'est plus"".",3.0
La faiblesse des bénéfices entraîne la baisse des actions,La faiblesse des bénéfices entraîne la baisse des actions à Wall Street,3.8
6.8 Le tremblement de terre frappe les îles Salomon,"Un séisme de magnitude 6,3 frappe les îles Salomon : USGS",3.2
Une fuite d'ammoniac liquide tue 15 personnes à Shanghai,Une fuite d'ammoniac liquide tue au moins 15 personnes à Shanghai,4.6
Les Amis de la Syrie reconnaissent la coalition de l'opposition comme représentant légitime du peuple syrien,Les Etats-Unis et les Amis de la Syrie reconnaissent l'opposition comme seul représentant,4.0
Weiner reste dans la course à la mairie de New York au milieu d'un nouveau scandale de sexting,Weiner fait fi du dernier scandale sexuel en ligne,3.0
Le nombre de morts augmente dans un accident d'avion en Russie,39 morts dans un accident d'autocar en Italie,0.0
Les médias indiens : Sommet du Commonwealth,Le Premier ministre indien snobe le sommet du Commonwealth,2.8
Le chef de la police militaire syrienne fait défaut à l'opposition,Le chef de la police militaire syrienne fait défaut aux rebelles,5.0
Le Boeing 787 Dreamliner prend feu ; le stock prend une raclée,Le stock de Boeing s'effondre après l'incendie du 787 Dreamliner,4.6
Yvette Cooper soutient le projet de loi sur le mariage homosexuel,La Maison Blanche soutient le mariage homosexuel,2.6
Cinq morts dans l'accident d'un autocar belge,Des adolescents parmi les 5 morts dans un accident de bus belge,3.8
Des hommes armés enlèvent sept travailleurs étrangers au Nigeria,Sept travailleurs étrangers kidnappés au Nigeria,3.4
Un touriste suisse victime d'un viol collectif en Inde,"Un groupe de touristes suisses violés en Inde, selon la police",5.0
"Les Palestiniens s'affrontent aux forces israéliennes en Cisjordanie, à Jérusalem",Les Palestiniens s'affrontent aux forces de sécurité à la Banque W.,4.2
Les avions israéliens frappent à l'intérieur de la Syrie,Israël lance une attaque aérienne sur la Syrie,4.6
Les Iraniens votent à l'élection présidentielle,Keita remporte l'élection présidentielle au Mali,0.4
100 morts dans les nouveaux affrontements tribaux au Darfour,9 morts dans le nouvel affrontement tribal au Darfour,2.8
Report de la protestation contre les attaques de drones américains à Pak,6 personnes tuées lors de l'attaque d'un drone américain au nord-ouest du Pakistan,1.4
12 personnes tuées dans un accident de bus au Pakistan,10 morts dans un accident de la route au nord-ouest du Pakistan,3.2
Carney met la barre haute pour le changement à la BoE,Carney met la barre haute pour les changements à la Banque d'Angleterre,5.0
8 personnes arrêtées après l'effondrement d'un immeuble au Bangladesh,Quatre personnes arrêtées alors que le nombre de bâtiments au Bangladesh s'élève à 352,2.4
Un kamikaze tue 3 personnes sur une base américaine en Afghanistan,Des kamikazes attaquent une base américaine en Afghanistan,2.8
"Les Afghans affluent dans les universités, alors même que les talibans se profilent",Le gouverneur du district afghan fait défection aux talibans,0.6
La Corée du Nord reporte les réunions de famille avec le Sud,"La Corée du Nord ""reporte"" les unions familiales avec la Corée du Sud",5.0
"Les recettes d'Apple manquent encore, l'iPhone déçoit",L'agence commerciale américaine interdit l'importation de l'iPhone 4 pour Samsung,0.6
Des hommes armés tuent 10 touristes étrangers dans le nord du Pakistan,Des hommes armés tuent 11 alpinistes étrangers au Pakistan,3.4
David Beckham annonce sa retraite du football,David Beckham prend sa retraite du football,4.4
Matt Smith quitte le Doctor Who après 4 ans,Matt Smith quitte l'émission Doctor Who de la BBC,4.0
Des générations divisées sur le mariage homosexuel,Le sommet du G20 s'achève sur un désaccord avec la Syrie,0.0
23 personnes tuées dans des attentats à la voiture piégée en Irak,10 morts dans un attentat à la bombe en Irak,1.6
Un homme qui s'est immolé par le feu dans un centre commercial national meurt de ses blessures,"Un homme ""qui s'est mis le feu"" au National Mall meurt",5.0
Les attaques des talibans tuent 17 civils en Afghanistan,Une série d'attentats tue 10 policiers en Afghanistan,1.4
Le ministre égyptien survit à une tentative d'assassinat,"Le premier ministre syrien ""survit à une tentative d'assassinat"".",1.6
L'ex-première dame Barbara Bush quitte l'hôpital du Texas,L'ancienne première dame Barbara Bush quitte l'hôpital,4.6
Schumacher dans le coma après un accident de ski,Michael Schumacher toujours dans le coma après un accident de ski,4.0
11 personnes tuées dans l'attaque d'un commissariat de police chinois,Onze personnes tuées dans l'attaque d'un commissariat de police en Chine,5.0
Bradley Cooper et JJ Abrams parlent du tournage d'un biopic de Lance Armstrong,Bradley Cooper en pourparlers pour jouer le rôle de Lance Armstrong dans un biopic,4.0
"Un avion de Boeing s'écrase en Russie, 50 morts","Un avion de ligne Boeing s'écrase dans la ville russe de Kazan, 50 morts",3.8
"Les ministres européens sont ""déterminés"" à résoudre le scandale de la viande de cheval",Les ministres européens discutent du scandale de la viande de cheval,4.4
Un parti d'opposition thaïlandais boycotte les élections générales,L'opposition thaïlandaise annonce un boycott électoral,4.8
Bangladesh : 540 morts dans l'effondrement d'un immeuble : l'armée,L'effondrement d'un immeuble au Bangladesh fait plus de 1 000 morts,2.6
"Jagan Reddy est transféré à l'hôpital, la crise électrique continue à Seemandhra",Telangana : Jagan va passer jeudi à l'hôpital ; le black-out continue à Seemandhra,4.2
Le président de la République centrafricaine renversé par les rebelles,"Le président de la République centrafricaine, le Premier ministre démissionne",2.6
Le Brésil à égalité avec l'Angleterre (2-2) et le Maracana rouvre ses portes,Le Brésil tenu par l'Angleterre 2-2 à la réouverture du Maracana,5.0
Incendie en Californie : 1 900 personnes sur les lignes de front alors que les pompiers s'efforcent de limiter les dégâts (+vidéo),"Le feu de forêt californien se développe mais les pompiers progressent, selon les autorités",3.8
George W. Bush met en garde contre un débat amer sur l'immigration,George W Bush pèse dans le débat sur l'immigration,3.0
"Mandela hospitalisé, réagissant au traitement",Mandela hospitalisé après avoir cessé de parler,3.4
La Russie condamne l'essai nucléaire de la Corée du Nord,La Corée du Sud confirme que la Corée du Nord a procédé à un troisième essai nucléaire controversé,1.2
Des centaines d'ouvriers d'usines de vêtements malades au Bangladesh,Des centaines de personnes tombent malades dans une usine du Bangladesh,4.4
Un attentat suicide au Yémen tue des soldats,Une femme kamikaze tue 16 personnes dans une gare russe,2.0
18 personnes piégées dans l'explosion d'une mine de charbon russe,Dix morts dans l'explosion d'une mine de charbon en Russie,2.8
Des manifestants thaïlandais s'introduisent dans le quartier général de l'armée,Des manifestants thaïlandais prennent d'assaut le quartier général de l'armée,4.6
Israël mène une attaque aérienne sur la Syrie,Israël lance un nouveau raid aérien contre la Syrie,4.4
