"La meilleure façon de faire sortir de l'argent est de se débarrasser du lobby, de tout ce qui s'y rattache.",La meilleure façon de le faire tourner en rond est de faire sortir de l'argent.,3.0
"J'ai des années de droits ""Neener Neener"". En général, je reçois des soins plutôt décents.","J'ai des années de droits ""Neener Neener"" ; ce sont des crackers.",3.4
Dutchy Quelqu'un a-t-il des nouvelles de Dutchy ?,"@NickFun, Quelqu'un a-t-il des nouvelles de Dutchy ?",3.6
"Commodity Expanded Value-Form, .",Forme élémentaire de la valeur en capital des marchandises .,3.6
Vous êtes un chrétien.,Vous n'êtes donc pas chrétien.,1.4
Et le simple fait qu'aujourd'hui ?,Je le répète : et le simple fait qu'aujourd'hui ?,4.0
La morale n'a absolument rien à voir avec ça !,et la morale et l'honnêteté ont tout à voir avec cela.,2.0
"""Oh, tu es tellement bon !","Vous êtes une si mauvaise personne !""",1.8
Fern Je pense que des histoires comme celle-ci sont stupides.,- loup Je trouve que des histoires comme celle-ci sont stupides.,3.6
LA FORMATION DE CYCLONES N'EST PAS ATTENDUE DANS LES PROCHAINES HEURES.,LA FORMATION DE CYCLONES TROPICAUX N'EST PAS PRÉVUE.,3.4
Ne comprenez-vous pas ce que cette série de mots signifie ?,"Ne comprenez-vous pas ce que le mot ""dirigé"" implique ?",1.2
Il n'y a pas de liberté de religion.,Il n'y a pas de liberté d'expression.,1.2
Originally Posted by SolInvictus Le messahe de toutes les écritures est l'unité.,Publié à l'origine par SolInvictus Ah.,2.4
"Combien de temps après l'effacement, l'enfant doit-il retourner à l'école ?","Combien de temps après l'effacement, cela ne devrait-il plus déranger l'enfant ?",3.0
"Un homme et une femme sont différents, oui.","Les hommes et les femmes sont différents, oui ?",3.4
La double incrimination permet en fait d'obtenir l'annulation d'un jury.,"Pour ce qui est de la légalité, je peux recourir à la nullité du jury.",2.2
Facilitateur : Montrez-moi l'enfant intelligent.,Facilitateur : Et pourquoi est-elle l'enfant muet ?,1.0
la fiction religieuse N'est-ce pas redondant et répétitif ?,N'est-ce pas redondant et répétitif ?,3.2
Posté à l'origine par anabelle Quel est le problème ?,"Publié à l'origine par Vienna Pour ""dire"" quoi ?",0.0
Cracklin' Rosie de Neil Diamond Nous sommes tous des vaisseaux remplis de nombreuses merveilles.,Jingle Bell Rock de Bobby Helm Nous sommes tous des vaisseaux remplis de nombreuses merveilles.,1.6
Certaines personnes ont une confiance totale dans les personnes qui dirigent ces institutions.,Les autres n'ont aucune confiance dans les personnes qui dirigent ces institutions.,1.6
La monnaie courante a commencé comme une œuvre de fiction.,Il s'est terminé comme une œuvre de fiction.,2.2
"Si ce n'était pas une vie, alors il ne pourrait pas naître.","Si elle n'était pas vivante, elle ferait une fausse couche toute seule.",3.0
"GL, Terral C'est absolument incroyable.",Salut Ollie : C'est absolument incroyable.,2.4
Supposons que nous ayons % de blancs et % de noirs.,Imaginez un endroit où il y a % de blancs et % de noirs.,3.77777777777778
La liberté d'expression a des conséquences !,"Si la liberté d'expression a des conséquences, alors elle n'est pas libre.",2.11111111111111
"""Les fées n'existent pas"" - bien.","""Les farfadets n'existent pas"" - bien.",1.0
"Si c'est le cas, dites que c'est pour cette raison qu'elles ne sont pas vraies.","S'il vous plaît, ce n'est pas vrai.",3.2
-Ne pas en parler et ne rien faire.,est encore pire que d'en parler et de ne rien faire.,2.8
"""Être contre les armes nucléaires"" ne signifie pas ""ne pas vouloir utiliser d'armes nucléaires"".","""Être contre l'utilisation des armes nucléaires"" signifie ""ne pas vouloir utiliser d'armes nucléaires"".",1.4
Ma nièce est mariée à un homme noir.,Ma grande nièce est à moitié noire.,1.4
La population du Royaume-Uni est d'un peu plus d'un million d'habitants.,La population japonaise est de près d'un million d'habitants.,1.0
J'ai tiré sur le shérif Nous sommes tous des vaisseaux remplis de nombreuses merveilles.,Nous sommes tous des vaisseaux remplis de nombreuses merveilles.,3.4
J'espère que ce n'est rien.,J'espère que tout va bien !,2.0
L'argent que j'ai dépensé pour adopter le Velociraptor.,C'est peut-être mon sommet. L'argent que j'ai dépensé pour adopter le Velociraptor.,4.2
"Alors, vous croyez vraiment chaque mot de ce que Terral a écrit ?","GL, Terral Hi Corn : Alors, vous croyez vraiment chaque mot de ce que Terral a écrit ?",4.2
"Qu'est-ce qui ne l'est pas, comment ce qui a été vendu ?","Ce n'est pas la façon dont il a été vendu, gb.",1.6
Je sais que je détesterais être lui.,Je détesterais être lui aussi.,4.4
il n'y avait pas d'armes.,"Bien sûr, il n'y avait pas d'armes.",4.6
C'est tellement stupide qu'il faut que ce soit vrai.,Il est amusant de penser que cela pourrait même être vrai.,3.0
La responsabilité personnelle est-elle importante ?,"Encore une fois, la responsabilité personnelle.",4.4
Remarquez-vous les absurdités que vous dites ?,"Et pour être juste, remarquez-vous les absurdités que vous dites ?",4.57142857142857
Je suppose que je l'ai sorti du derrière du recensement avec un chapeau haut de forme.,Le recensement a-t-il un arrière-train en chapeau haut de forme ?,2.6
En quoi cela est-il défavorable à Bush ?,Où est le penchant contre Bush ?,4.4
"Si ce n'était pas des conneries, ce ne serait pas de l'homéopathie.","C'est une logique simple. Si ce n'était pas des conneries, ce ne serait pas de l'homéopathie.",4.8
"Je ne l'ai jamais accusé de sur-milligramer, rien.",Je ne l'ai jamais accusé de falsifier une balle de base-ball.,0.4
Le sauvetage a été plus important que les nouvelles de TARP Bloomberg.,Le renflouement était plus important que le TARP Ce titre est trompeur.,3.8
Mes parents m'ont dit que c'est mauvais pour vous.,Les officiers m'ont dit que c'était mauvais pour vous.,2.0
Sa position est que c'est à l'individu d'assumer le risque.,Sa position est telle qu'elle est actuellement.,1.0
I. EXIGENCES ATLANTIQUES .,EXIGENCES DU PACIFIQUE .,0.8
Pour en savoir plus : Vous n'avez jamais rencontré quelqu'un qui soit pro-avortement ?,Vous n'avez jamais rencontré quelqu'un qui soit pro-avortement ?,4.8
Je n'ai aucun problème avec ceux qui ont de l'argent !,"J'ai beaucoup de problèmes avec ces hommes, beaucoup trop pour les déclarer ici !",0.2
"Nixon, Ford et Carter ont fermé les champs pétrolifères ?",Non a fermé les champs pétrolifères.,2.0
"Je ne veux pas d'un président qui ""s'en soucie"".",Je ne veux pas d'un président qui soit charismatique.,1.0
Il n'est pas nécessaire d'être en état de mort cérébrale.,Je n'ai pas de modèle proposé.,0.0
aucune preuve de missile.,pas de témoins de missiles.,3.2
Mes professeurs m'ont dit que c'est mauvais pour vous.,Les officiers m'ont dit que c'était mauvais pour vous.,2.2
"Mon Dieu, c'est moi qui ai le ticker de la grossesse.",J'ai le ticker de la grossesse.,4.2
Il n'est donc pas omnipotent.,Alors il est malveillant.,1.4
"chapeau en papier d'aluminium pour la face du chien, quelle taille portez-vous ?","chapeau en papier d'aluminium pour le sergent, quelle taille portez-vous ?",3.0
Comme cet enfant qui a été tué par balle lors d'un crime lié à la marijuana.,Ou le garçon d'un an abattu à l'aide d'armes automatiques par des trafiquants de marijuana.,4.2
"Si vous sautez pour faire un coup, vous êtes pénalisé.","Si votre bâton frappe un gars au visage, vous êtes pénalisé.",2.6
Toute l'énergie électrique provient de la batterie.,La totalité de l'énergie électrique provient en fin de compte de l'alternateur.,2.4
Savez-vous combien de passagers ont témoigné ou ce qu'ils ont dit ?,Combien de passagers ont déclaré avoir vu un iceberg ?,2.4
Imaginez un endroit avec un % d'hommes et un % de femmes.,Imaginez un endroit où il y a % de blancs et % de noirs.,1.6
Le scénario A suppose que le taux de croissance du CO s'accélère de 0 %/an.,"Il suppose que le taux de croissance du méthane s'accélère de 0,%/an.",1.75
"Ils ont en fait montré une tendance au refroidissement depuis, en raison du récent déclin.",obtenir une tendance au refroidissement en raison du récent déclin.,4.6
Nous sommes tous des vaisseaux remplis de nombreuses merveilles.,Landon Memory de CATS Nous sommes tous des navires remplis de nombreuses merveilles.,3.0
Je le répète : ils ne sont pas aussi souverains qu'ils l'étaient auparavant.,Ils ne sont pas aussi souverains qu'avant.,4.5
"Cependant, il ne serait pas déconnecté et totalement indigne de confiance.",Loin de tout contact et indigne de confiance ?,4.25
Ce sont surtout les Hollandais.,"En fait, ce ne sont que les Hollandais.",3.6
"On parle encore des anges et des épingles communes, n'est-ce pas ?","@Lustig Andrei, On parle encore des anges et des épingles communes, non ?",4.8
revendications sur le personnage de Travon Et quand ai-je fait cela ?,blogs inclinés Et quand ai-je fait cela ?,2.6
% Combien d'argent le PP reçoit-il pour les services d'avortement ?,Combien dépense-t-on pour les services d'avortement ?,2.6
Pourquoi cette transaction a-t-elle eu lieu.,La transaction a-t-elle eu lieu ?,2.4
Il n'y a plus de post-fécondation des ovules.,Il n'y a plus de spermatozoïdes.,2.4
Lacey - bienvenue !,"En tout cas, bon retour.",4.0
"Plus de vérification des faits : Je ne sais pas pourquoi quelqu'un fait tout un plat du $, bet.","Je ne sais pas pourquoi quelqu'un fait tout un plat du $, bet.",4.4
"Si vous n'avez pas fait de réclamations, dites-le simplement.",Je n'ai fait aucune réclamation.,2.4
Aucun Thatcherite ne pourra jamais se dire libertaire.,C'est pourquoi je suis offensé lorsque les Thatcherites se disent libertaires.,2.4
le problème n'est pas de savoir qui a de l'argent.,le problème est de savoir qui n'a pas d'argent.,2.46666666666667
Mais croyez-vous vraiment qu'il y avait un iceberg dans ces eaux ?,Je ne crois pas qu'il y ait eu le moindre iceberg à proximité du Titanic.,2.8
pas d'astros ou d'orioles ; le mauvais jour pour le jeu des orioles est gelé pour moi.,Le jour du jeu des loriots est gelé pour moi.,3.0
"Si c'est le cas, beaucoup de flics devraient prendre des médicaments de prescription.","Si c'est le cas, beaucoup d'inventeurs, d'écrivains devraient prendre des médicaments sur ordonnance..",2.4
Dites-nous quelles étaient les accusations.,"Oui, quelles sont ses charges.",4.0
Ce sont des psychopathes partiels.,Ted Bundy était-il un psychopathe partiel ?,1.8
Ceux qui ignorent l'histoire sont condamnés à la répéter.,ooo frappe DEUX ceux qui ignorent l'histoire sont condamnés à la répéter.,4.2
ce n'est PAS un déploiement de guerre.,ce n'est pas un déploiement officiel.,2.4
Nutrax Le pluriel de l'anecdote n'est pas une donnée Les messieurs ont-ils besoin de chaperons ?,Nutrax Le pluriel de l'anecdote n'est pas une donnée,3.6
"Très bien, je viens d'arriver.","pas bien Bien, je viens d'arriver.",4.0
H et moi avons tous les deux lu les livres et nous avons pensé que le film se déroulait si rapidement.,"Je n'ai pas lu les livres, mais j'ai vu le film aujourd'hui.",3.0
Mais ce n'est pas la scène Moloch.,C'est la scène Moloch.,2.4
"@Lustig Andrei, Donc Lyndon Johnson et John Kennedy étaient compatibles ?","@edgarblythe, Donc Lyndon Johnson et John Kennedy étaient compatibles ?",4.4
Vous devez vous décider.,Vous devez peaufiner vos compétences en matière de logique.,0.6
Celui qui est rentré chez lui à pied et s'est endormi.,Celui qui en a trois rentre chez lui et bat sa femme.,1.4
- Admin DrPizza et moi avions oublié que vous étiez un petit pisseux pleurnichard.,et j'avais oublié que tu étais un petit pisseux pleurnichard.,3.8
"L'argument était ""Albert Einstein n'est pas allé à l'université"".","OMG, ""Einstein n'est pas allé à l'université.""",4.2
"Gains en capital, taux supérieur : pour cent.","Impôt sur le revenu, taux maximum : pour cent.",2.4
La bêtise est inexcusable.,Il est inacceptable d'être ivre.,1.0
Il n'a pas été drôle depuis des années.,Il n'a plus été drôle depuis l'émission de Larry Bud Melman.,3.4
"Si l'univers a une explication de son existence, cette explication est Dieu.",L'univers a donc une explication de son existence.,2.4
Qu'est-ce que nous obtenons en échange de la lutte que nous menons pour eux ?,------ ----------- Qu'est-ce que nous obtenons en échange de la lutte que nous menons pour eux ?,5.0
Cela n'empêcherait pas de plaisanter sur les mariages.,Et je ne me bats pas pour le mariage.,1.2
"S'ils étaient juifs, je les appellerais juifs.","S'ils étaient catholiques, je les appellerais catholiques.",2.2
C'était une grande dame.,C'était une dame sympathique.,4.0
Il n'est pas riche parce qu'il a du succès.,Pourquoi détester les gens parce qu'ils ont du succès ?,0.8
Pas aussi irrité que vous.,Vous semblez aussi irrité qu'Henry.,1.75
C'est une question de bon sens et de raisonnement déductif.,Cela a perturbé votre bon sens et votre raisonnement déductif.,2.5
Vous l'avez déjà fait - nous avons un musulman au pouvoir en ce moment même.,-Nous avons un chrétien en fonction en ce moment.,0.8
J'ai dit qu'elle n'a jamais eu à faire partie d'une force de travail.,Ann Romney n'a jamais eu à sortir et à faire partie de la population active.,3.4
"À ma connaissance, DreamTech n'a jamais été éjaculé.",Il n'a jamais été éjaculé à ma connaissance.,3.0
Je n'ai pas dit que nous étions devenus mous depuis / Rand.,J'ai dit que VOUS vous étiez ramolli.,1.2
Nous pensons tous que nous obtenons ce que nous attendons.,"La plupart du temps, % du temps, nous obtenons ce que nous attendons.",3.8
"Abject Ben, arrêtez de chercher des excuses à cet homme.","Ben, arrêtez de chercher des excuses à cet homme.",4.4
A moins que ce ne soit différent dans les différents pays ?,"Donc, la forme courte, oui, elle est probablement différente dans les différents pays.",3.6
La nouvelle étude n'étaye pas votre demande.,Les preuves matérielles n'appuient pas votre demande.,2.2
Il a dit à TOUS les niveaux.,Mais il a dit TOUS les niveaux.,4.6
"La morale n'existe pas, donc techniquement, rien ne peut être moralement mauvais.","Je demande encore une fois si Dieu n'existe pas, est-ce que quelque chose peut être moralement mauvais ?",2.2
Je pensais que c'était surtout les Hollandais.,Ce sont surtout les Hollandais.,4.0
Toyland par Johnny Mathis Nous sommes tous des vaisseaux remplis de nombreuses merveilles.,L'œil du tigre Nous sommes tous des vaisseaux remplis de nombreuses merveilles.,3.2
Laissons cela se jouer au tribunal.,Rien n'empêche cette chose de jouer au tribunal.,3.8
Faire partie d'un gang n'est pas un crime.,Commettre un crime dans un gang est un crime.,1.8
Je proposerais un marché à l'Iran.,"Chuck, je proposerais un marché à l'Iran.",4.2
"Oui, ils sont tous deux différents.",Les opinions sont différentes.,1.2
Il ne s'agit pas d'imposer une morale.,C'est imposer une loi.,1.1
Annie a-t-elle déjà utilisé sa sexualité de cette manière ?,Un mot : Zombies Annie a-t-elle déjà utilisé sa sexualité comme ça ?,3.8
COMMUNICATION PURE : Vous avez deux vaches.,LIBERTARIEN/ANARCHO-CAPITALISME : Vous avez deux vaches.,2.4
Vous devriez mettre les scientifiques sur un piédestal.,Pourquoi les gens comme vous mettent les scientifiques sur un piédestal ?,3.4
Que cherchent-ils à cacher ?,J'ai alors demandé : Que cherchent-ils à cacher ?,3.6
Cela vous rendrait partiellement responsable de leur mort.,"Cela ferait de vous une sorte d'accessoire, je pense.",3.0
"""Voulez-vous payer pour d'autres soins de santé ?""","""Voulez-vous mettre votre ceinture de sécurité ?""",0.0
Ils ne sont pas aussi souverains qu'avant.,Je le répète : ils ne sont pas aussi souverains qu'ils l'étaient auparavant.,4.4
Je ne vois pas Obama comme le moindre des deux maux.,Je ne le vois pas du tout comme un démon.,2.0
Ou celui-ci par Jim Croce Nous sommes tous des vaisseaux remplis de nombreuses merveilles.,Nous sommes tous des vaisseaux remplis de nombreuses merveilles.,3.2
Le fait est qu'un enfant non armé a été assassiné.,Le fait est qu'un enfant noir non armé a été assassiné.,3.4
"Zimmerman a répondu : ""Que faites-vous ici ?","Martin a dit : ""Pourquoi me suivez-vous ?""",0.9
"L'irrationalité qui fait cela, j'ai un problème.",Je n'ai aucun problème avec une religion qui ne fait pas ça.,1.6
"Si je suis en colère, il apparaîtra dans un de ces scanners..","Si je suis hyperactif, il apparaîtra dans un de ces scanners..",3.2
"Si vous voulez acheter des actions ordinaires de XYZ Inc. pour un montant de plusieurs milliards de dollars, qui s'en soucie ?","Si vous voulez acheter une maison ou un SUV, encore une fois, qui s'en soucie ?",1.4
milliards . Tout le monde dans le monde au niveau de prospérité actuel du Mexique.,"Tout le monde dans le monde au niveau de ""prospérité"" actuel de l'Afrique du Nord-Ouest.",1.53333333333333
"Si vous répondez oui et non, vous êtes probablement honnête.",Si vous répondez non à mais oui à alors vous êtes probablement honnête.,3.1
"Parfois, je fantasme sur le pouvoir.","Parfois, moi aussi, je fantasme de faire plier les gens avant ma volonté démente.",4.2
Mes parents m'ont dit que c'est mauvais pour vous.,Mon shérif m'a dit que c'était mauvais pour vous.,2.8
Atlas Shrugged C'est aussi un excellent interprète en termes d'idiotie flagrante.,C'est aussi un excellent interprète en termes d'idiotie flagrante.,3.6
Comment Martin ne saurait-il pas que ce n'est pas le cas ?,Comment Martin ou quelqu'un d'autre pourrait-il connaître ses intentions en se basant sur ses actions ?,2.4
La réglementation fait intervenir le gouvernement dans tout.,"""Faire participer le gouvernement à tout ?""",2.4
C'est une question de bon sens et de raisonnement déductif.,Cela a perturbé votre bon sens et votre raisonnement déductif.,2.5
"Oui, dans mon argumentation, j'ai supposé que tous les emballages seraient recyclables.",C'est ce que j'ai également supposé dans mon argumentation.,2.8
L'annulation par le jury ne signifie pas qu'une loi est inconstitutionnelle.,L'annulation du jury signifie qu'une loi n'est pas constitutionnelle ?,3.6
Ce n'est qu'un tas de cellules.,"Je suis ""un tas de cellules"".",2.2
Le travail de Mann était entièrement consacré aux mathématiques.,Le travail de Mann et du HS était axé sur les anneaux des arbres.,1.6
"Je suis vraiment désolé d'entendre ça, Kelly.","Je suis vraiment désolé, Kelly.",4.0
Je n'aime pas les bières aromatisées.,Je n'aime pas beaucoup les boissons aromatisées.,3.0
J'espère que tout va bien !,J'espère que votre LO est en ordre.,1.6
toute femme qui veut un contrôle des naissances peut l'obtenir.,Toute femme qui le souhaite peut se faire avorter.,1.6
S Comme vous le souhaitez : Voyez-vous Hitler tuer des Juifs ?,Voyez-vous Hitler tuer des Juifs ?,4.6
Et je suis ton ami Mitt.,Votre bon ami Mitt.,4.0
Cela signifie qu'il s'agit d'une option AN.,Cela ne veut pas dire que c'est une mauvaise option.,1.6
Je pense que vous devez relire ce que j'ai écrit.,Vous devez relire ce que j'ai écrit.,5.0
Supposons que nous ayons % de blancs et % de noirs.,Imaginez un endroit où il y a % de blancs et % de noirs.,3.77777777777778
"Maman est entrée et a dit : ""C'est quoi ce bruit ?""","Mes enfants sont entrés et ont dit : ""C'est quoi ce papa ?",1.8
"Mon meilleur, Kutte Mon ex-fiancé n'utiliserait pas les médecins de l'armée ou de la marine.",Jay Mon ex-fiancé n'utiliserait pas les médecins de l'armée ou de la marine.,3.6
Le titulaire a déposé une lettre de trois pages.,Les juges ordonnent le dépôt d'une lettre de trois pages.,2.8
"Lustig Andrei, Lustig, est d'accord.","@Lustig Andrei, Merci, Lustig.",2.2
Cela éclipse le vieux record de .,Cela bat le record journalier établi en .,4.8
"Zimmerman a répondu : ""Que faites-vous ici ?","Martin a dit : ""Pourquoi me suivez-vous ?""",0.9
"Je ne sais pas si c'est légitime, mais j'ai entendu dire qu'il est un peu suicidaire.","Donc, je ne sais pas si c'est légitime, mais oui.",1.6
Taxe d'habitation La taxe d'habitation n'a-t-elle pas été gelée pour la plupart des gens ?,La taxe d'habitation n'a-t-elle pas été gelée pour la plupart des gens ?,4.8
Votre schtick devient rassis.,Votre misogynie devient désordonnée.,0.4
Est-ce ainsi que cela fonctionne ?,"Non, ce n'est pas comme ça que ça marche.",1.6
"Inspirez, expirez, passez à autre chose.","buwhahahaha Inspirez, expirez, avancez.",4.4
attendre qu'ils deviennent plus cohérents et plus proches les uns des autres.,attendre que les contractions se renforcent et se rapprochent.,3.8
Obama est extrême et de gauche.,Obama fait partie de l'extrême gauche.,4.8
"@Frank Apisa, c'est à vous de choisir le nom que vous voulez lui donner.","@Cyracuz, c'est à vous de choisir le nom que vous voulez lui donner.",2.5
La nullité du jury n'a rien à voir avec la constitutionnalité des lois.,L'annulation du jury signifie qu'une loi n'est pas constitutionnelle ?,2.6
De quelle conviction parliez-vous auparavant ?,Quelle serait cette condamnation ?,4.4
J'ai donc lu l'OP et devinez ce que j'ai découvert.,"En outre, j'ai trouvé ceci : J'ai donc lu l'OP et devinez ce que j'ai découvert.",4.6
Le gouvernement ne détermine pas si vous êtes marié ou non.,Le gouvernement n'est pas obligé de vous déclarer marié avant que vous puissiez vous marier.,3.6
La démocratie est une menace pour la liberté.,La démocratie n'a rien à voir avec la liberté.,1.8
Salut Pro et Corn : Combien de fils prévoyez-vous de fabriquer ?,Combien de fils prévoyez-vous de fabriquer ?,4.0
Dites-moi exactement quel système ne fonctionne pas en ce moment ?,Quel système ne fonctionne donc pas pour nous ?,4.0
"Oh, et affirme à nouveau que le mariage est un droit humain fondamental.",Surtout après avoir déclaré que le mariage est un droit humain fondamental.,4.0
Pourquoi les Russes sont-ils à Damas ?,Les Russes à Damas !,4.2
"Oui, c'est une question de dilution.","Euh, ce n'est pas comme ça que la dilution fonctionne.",1.8
"Oui, je ne pense pas que ce soit si controversé que ça non plus.",Je ne pense pas que ce qu'elle dit soit si controversé.,3.8
"L'opération Chaos, c'est simplement le vote des gens.","Le chaos, c'est simplement le fait que les gens votent.",4.0
Posté à l'origine par JonD Doubtful.,Publié à l'origine par eleanor.ellis,1.2
Le gaz classique Nous sommes tous des vaisseaux remplis de nombreuses merveilles.,La chanson thème de Cheers : Nous sommes tous des vaisseaux remplis de nombreuses merveilles.,3.0
Je le répète : ils ne sont pas aussi souverains qu'ils l'étaient auparavant.,Ils ne sont pas aussi souverains qu'avant.,4.5
La morale n'a absolument rien à voir avec ça !,et la morale et l'honnêteté ont tout à voir avec cela.,2.0
"Je vais avoir des conversations avec Cornell West, mon cher frère.",j'ai des conversations avec cornell west Qu'est-ce que c'est que ça ?,3.0
Il n'y a pas de guerre au Moyen-Orient.,"Il n'y a pas de ""WAR"" au Moyen-Orient.",4.6
Il n'avait aucune intention de l'appréhender.,- Je n'ai pas dit qu'il avait l'intention de l'appréhender.,2.4
Nous sommes tous des vaisseaux remplis de nombreuses merveilles.,Mettez un peu d'amour dans votre cœur Nous sommes tous des vaisseaux remplis de nombreuses merveilles.,3.6
"Vous êtes ""un tas de cellules"".","Je suis ""un tas de cellules"".",2.4
Qu'est-ce qu'une fille douche ?,Tu es une fille de merde.,1.4
L'annulation du jury signifie qu'une loi n'est pas constitutionnelle ?,Non. L'annulation du jury ne signifie pas qu'une loi est inconstitutionnelle.,2.0
Ce n'est définitivement plus ce que c'était.,a été voté Ce n'est définitivement plus ce que c'était.,4.0
Il incombe au fabricant d'un produit de convaincre les consommateurs qu'il est sûr.,Le fabricant doit convaincre le gouvernement qu'il est sûr.,3.4
Je pense que vous passez à côté de l'essentiel avec les entrepreneurs.,"Encore une fois, je pense que vous passez à côté de l'essentiel de la citation de Twain.",0.8
"""Les cyclopes n'existent pas"" - bien.","""Les gobelins n'existent pas"" - bien.",1.6
"""C'était une maladie mentale, maintenant qu'est-ce qu'on vous apprend ?""","Il a déclaré qu'il s'agissait d'une maladie mentale en , comment peut-on parler de sectarisme ?",1.6
Landon et c'est donc Noël Nous sommes tous des vaisseaux remplis de nombreuses merveilles.,Jouer avec le feu Nous sommes tous des vaisseaux remplis de nombreuses merveilles.,1.8
Bush n'obtient aucun crédit pour le budget sous sa direction.,"Et, Obama n'a aucun crédit pour le budget sous sa direction.",1.8
. Les pécheurs ne vont pas au ciel.,Ou le péché est enlevé dès l'entrée au ciel.,1.8
"Combien de temps après l'effacement, l'enfant doit-il retourner à l'école ?","Combien de temps après l'effacement, cela ne devrait-il plus déranger l'enfant ?",3.0
Holly Holy Nous sommes tous des vaisseaux remplis de nombreuses merveilles.,Dites ce que vous voulez Nous sommes tous des vaisseaux remplis de nombreuses merveilles.,3.8
"Quelle a été la ""réponse"" à Chicago ?",Quelle sera la réponse en Californie ?,1.2
Tout cela n'a aucun sens.,"Vous voyez, cela n'a aucun sens.",4.2
Qui a soi-disant fait fonctionner les chambres à gaz homicides ?,Rafraîchissez-vous la mémoire : Qui a soi-disant fait fonctionner les chambres à gaz homicides ?,4.8
"Par conséquent, l'explication de l'existence de l'univers est Dieu.","Si l'univers a une explication de son existence, cette explication est Dieu.",3.6
