A plane is taking off.,An air plane is taking off.,5.0
A man is playing a large flute.,A man is playing a flute.,3.8
A man is spreading shreded cheese on a pizza.,A man is spreading shredded cheese on an uncooked pizza.,3.8
Three men are playing chess.,Two men are playing chess.,2.6
A man is playing the cello.,A man seated is playing the cello.,4.25
Some men are fighting.,Two men are fighting.,4.25
A man is smoking.,A man is skating.,0.5
The man is playing the piano.,The man is playing the guitar.,1.6
A man is playing on a guitar and singing.,A woman is playing an acoustic guitar and singing.,2.2
A person is throwing a cat on to the ceiling.,A person throws a cat on the ceiling.,5.0
The man hit the other man with a stick.,The man spanked the other man with a stick.,4.2
A woman picks up and holds a baby kangaroo.,A woman picks up and holds a baby kangaroo in her arms.,4.6
A man is playing a flute.,A man is playing a bamboo flute.,3.867
A person is folding a piece of paper.,Someone is folding a piece of paper.,4.667
A man is running on the road.,A panda dog is running on the road.,1.667
A dog is trying to get bacon off his back.,A dog is trying to eat the bacon on its back.,3.75
The polar bear is sliding on the snow.,A polar bear is sliding across the snow.,5.0
A woman is writing.,A woman is swimming.,0.5
A cat is rubbing against baby's face.,A cat is rubbing against a baby.,3.8
The man is riding a horse.,A man is riding on a horse.,5.0
A man pours oil into a pot.,A man pours wine in a pot.,3.2
A man is playing a guitar.,A girl is playing a guitar.,2.8
A panda is sliding down a slide.,A panda slides down a slide.,4.6
A woman is eating something.,A woman is eating meat.,3.0
A woman peels a potato.,A woman is peeling a potato.,5.0
The boy fell off his bike.,A boy falls off his bike.,4.8
The woman is playing the flute.,A woman is playing a flute.,5.0
A rabbit is running from an eagle.,A hare is running from a eagle.,4.2
The woman is frying a breaded pork chop.,A woman is cooking a breaded pork chop.,4.2
A girl is flying a kite.,A girl running is flying a kite.,4.0
A man is riding a mechanical bull.,A man rode a mechanical bull.,4.0
The man is playing the guitar.,A man is playing a guitar.,4.909
A woman is dancing and singing with other women.,A woman is dancing and singing in the rain.,3.0
A man is slicing a bun.,A man is slicing an onion.,2.4
A man is pouring oil into a pan.,A man is pouring oil into a skillet.,4.2
A lion is playing with people.,A lion is playing with two men.,3.4
A dog rides a skateboard.,A dog is riding a skateboard.,5.0
Someone is carving a statue.,A man is carving a statue.,3.75
A woman is slicing an onion.,A man is cutting an onion.,2.75
A woman peels shrimp.,A woman is peeling shrimp.,5.0
A woman is frying fish.,A woman is cooking fish.,4.0
A woman is playing an electric guitar.,A woman is playing a guitar.,3.6
A baby tiger is playing with a ball.,A baby is playing with a doll.,1.6
A person is slicing a tomato.,A person is slicing some meat.,1.75
A person cuts an onion.,A person is cutting an onion.,5.0
A man is playing the piano.,A woman is playing the violin.,1.0
A woman is playing the flute.,A man is playing the guitar.,1.0
A man is cutting up a potato.,A man is cutting up carrots.,2.375
A kid is playing guitar.,A boy is playing a guitar.,3.8
A boy is playing guitar.,A man is playing a guitar.,3.2
A man is playing guitar.,A boy is playing a guitar.,3.2
A little boy is playing a keyboard.,A boy is playing key board.,4.4
A man is playing a guitar.,A man is playing an electric guitar.,3.75
A dog licks a baby.,A dog is licking a baby.,4.75
A woman is slicing an onion.,A man is cutting and onion.,3.2
A man is playing the guitar.,A man is playing the drums.,1.556
A woman is slicing a pepper.,A woman is cutting a red pepper.,3.938
A man is playing the drums.,A man plays the drum.,5.0
A woman rides a horse.,A woman is riding a horse.,5.0
A man is eating a banana by a tree.,A man is eating a banana.,4.0
A cat is playing a key board.,A man is playing two keyboards.,1.6
A man chops down a tree with an axe.,A man cut a tree with an axe.,4.75
A kid plays with a toy phone.,A little boy plays with a toy phone.,3.5
A man is riding a motorcycle.,A man is riding a horse.,1.4
A man is riding a motorcycle.,A man is riding a horse.,1.4
A squirrel is spinning around in circles.,A squirrel runs around in circles.,4.0
A man and a woman are kissing.,A man and woman kiss.,5.0
A man is getting into a car.,A man is getting into a car in a garage.,3.833
A man is dancing.,A man is talking.,0.6
A man is playing the guitar and singing.,A man is playing the guitar.,2.917
A person is cutting mushrooms.,A person is cutting mushrooms with a knife.,4.2
A tiger cub is making a sound.,A tiger is walking around.,2.0
A person is slicing onions.,A person is peeling an onion.,2.6
A man is playing the piano.,A man is playing the trumpet.,1.6
A woman is peeling a potato.,A woman is peeling an apple.,2.0
A pankda is eating bamboo.,A panda bear is eating some bamboo.,4.2
A person is peeling an onion.,A person is peeling an eggplant.,2.0
A monkey pushes another monkey.,The monkey pushed the other monkey.,4.8
A squirrel runs around in circles.,A squirrel is moving in circles.,4.4
A man is tying his shoe.,A man ties his shoe.,5.0
A boy is singing and playing the piano.,A boy is playing the piano.,3.0
A dog is eating water melon.,A dog is eating a piece of watermelon.,4.25
A woman is chopping broccoli.,A woman is chopping broccoli with a knife.,4.25
A man is peeling a potato.,A man peeled a potatoe.,3.8
A woman is playing a guitar.,A man plays a guitar.,2.4
A woman is slicing tomato.,A man is slicing onion.,1.6
A man swims underwater.,A woman is swimming underwater.,2.0
A man and woman are talking.,A man and woman is eating.,1.6
A small dog is chasing a yoga ball.,A dog is chasing a ball.,4.0
The men are playing cricket.,The men are playing basketball.,2.2
A man rides off on a motorcycle.,A man is riding on a motorcycle.,4.4
A man is playing a guitar.,A man is singing and playing a guitar.,3.6
The man talked on the telephone.,The man is talking on the phone.,3.6
A man is fishing.,A man is exercising.,0.5
A man is levitating.,A man is talking.,0.8
Two boys are driving.,Two bays are dancing.,0.6
A man is riding on a horse.,A girl is riding a horse.,2.6
A man is riding a bicycle.,A monkey is riding a bike.,2.0
A man is slicing potatoes.,A woman is peeling potato.,2.2
A woman is peeling a potato.,A man is slicing potato.,2.4
A man is playing a guitar.,Someoen is playing guitar.,3.6
A woman is slicing a leek.,A woman is slicing ginger.,2.2
The man cut a paper plate.,A man is cutting a paper plate.,4.8
The man is playing the guitar.,A man is playing the flute.,1.643
A man is playing the piano.,The man is playing the violin.,1.75
A woman is slicing up some meat.,A woman is breading some meat.,2.25
A man is playing on his keyboard.,A man is playing a keyboard piano.,4.0
The lady chopped up the green onions.,The lady cut up a green onion.,4.8
Someone is sitring noodles in water.,A woman is boiling noodles in water.,3.2
Lionel Richie is dancing on the ceiling.,Lionel Ritchie dances while standing on the ceiling.,4.0
A man is playing a piano.,A person is playing the piano.,4.4
A woman is playing flute.,A woman plays on a flute.,4.6
A boy is checking a calender.,A boy is looking at a calendar.,3.8
A woman is cutting an onion.,A woman is chopping onions.,4.8
A man is playing guitar.,A man plays a guitar.,4.857
A woman is using a sewing machine.,A woman is sewing on a machine.,5.0
A woman is flipping pancakes.,A cartoon chef is flipping pancakes.,2.533
A man is running on the road.,A car is driving down the road.,1.0
A man is riding on a horse.,A man is talking on a phone.,1.0
A man is riding a bike.,A man is riding on a horse.,2.0
A woman is dancing.,A man is eating.,0.143
A man is playing a piano.,A man is playing a flute.,2.0
A man is playing a flute.,A man is playing a piano.,1.6
A man is spinning.,A man is dancing.,1.6
A monkey is swinging from limb to limb.,A monkey is swinging from tree to tree.,3.4
The people got off the train.,The people got off the train at the station.,4.0
A dog is jumping on a trampoline.,A dog bounces on a trampoline.,4.8
A boy is playing an instrument.,A man is playing a trumpet.,2.5
A woman plays the guitar.,A man sings and plays the guitar.,1.75
A woman is picking a can.,A woman is slicing a tomato.,1.0
A man is climbing a rope.,A man climbs up a rope.,5.0
A man is lifting a car.,A man is climbing a wall.,1.4
A man and woman are driving down the street in a jeep.,A man and woman are driving down the road in an open air vehicle.,4.0
The shirtless man sat in a chair.,A shirtless man is sitting on a chair.,3.8
Two women are wrestling.,Two women are wrestling on the floor.,4.0
The puppy played with a blue tennis ball.,A puppy is playing with a tennis ball.,4.0
A kangroo is eating something.,A kangaroo is eating.,4.8
A cat is playing a piano.,A man is playing a guitar.,0.6
The man cut some carpet with a knife.,A man is cutting carpet with a knife.,4.75
A woman is riding a motorized scooter down a road.,A man is riding a motor scooter.,2.2
someone is slicing a vegetable.,Someone is slicing a tomato.,3.0
A woman is dancing.,A man is talking.,0.0
A dog licks up a baby's drool.,A dog licks a baby.,2.2
A man is rowing a boat.,A man is slicing a tomato.,0.4
A man cuts up potatos.,A man slices potatoes.,4.8
A woman is chopping up garlic.,The woman is dicing garlic.,4.8
An animal run in circles.,A squirrel runs in circles.,3.8
A man is walking slowly across a rope bridge.,A boy is walking across a bridge.,3.0
A man is playing the guitar.,A man seated in a room is playing the guitar.,4.0
A man plays the flute.,A man is playing a flute.,5.0
A woman cracks two eggs into a glass bowl.,A woman is cracking an egg into a bowl.,3.8
A man is cutting a fish.,A man guts a fish.,3.0
Two men are packing suitcases into the trunk of a car.,The men are putting suitcases into the car's trunk.,4.4
A man pours oil on some tomatos.,The man poured oil on the cut tomatoes.,3.8
A man is slicing something.,A man is slicing a bun.,3.0
A man is paddling a canoe.,A man is playing a harp.,0.667
A man and woman are walking together through the woods.,A man and woman are walking arm in arm through a wooded area.,4.0
The woman picked up the kangaroo.,A woman picks up a baby kangaroo.,3.75
Fish are swimming.,A fish is swimming.,4.133
Two women mix something in a food processor.,Two women make something in a blender.,4.0
A person is surfing a large wave.,A person is surfing.,3.6
A man is playing a guitar.,A man is stabbing a target.,1.2
A man is playing a flute in a band.,A man is playing a guitar.,1.6
The man spread butter on the loaf of bread.,A man is spreading butter onto bread.,4.0
A person is boiling noodles.,A woman is boiling noodles in water.,4.0
A group of people dance on a hill.,A group of people are dancing.,3.2
A man is dancing outside.,A man is playing flute.,1.0
A woman is feeding a man.,A woman is mixing meat.,1.0
A man is putting a pan into an oven.,A woman is cutting an onion.,0.6
A woman is sitting at a desk.,A woman is riding a donkey.,0.4
Medics transport a patient on a stretcher.,A doctor rushes a patient on a stretcher.,3.4
A woman is playing a flute on stage.,The woman is playing the flute.,3.6
Two baby pandas are playing.,Two pandas are laying together.,3.0
A baby is laughing.,A baby is laughing and giggling.,4.0
A man is playing a guitar.,A boy is playing a piano.,1.2
A man is folding paper.,A woman is slicing a pepper.,0.6
Three women are dancing.,The man is dancing.,1.6
The cats are playing with each other.,Two cats are fighting each other.,2.6
A person is writing.,A person is writing with a pencil.,3.6
A man is running.,A man is running down a road.,3.5
The woman is rolling dough.,A woman is flouring and rolling dough.,3.765
A woman is adding spices on a meat.,Woman is adding sugar to meat.,2.75
A woman is adding oil on fishes.,A woman is pouring water on fish.,2.25
A young boy is holding a guitar.,A little boy is playing a guitar.,2.75
A cheetah is running.,A cheetah is running across a field.,3.8
The man is eating pizza.,A man is eating a slice of pizza.,4.8
An orangutan is riding a bus.,A monkey is riding on a bus.,3.6
A man and a woman talk in a diner.,A man and a woman are riding on a bicycle.,1.2
A man is playing a guitar.,A man is cleaning a glass door.,0.4
A girl is singing and playing a guitar.,A young man is singing while playing the guitar.,2.4
A girl is communicating with sign language.,A young girl is using sign language.,3.941
A woman is doing weight exercises.,A woman is doing her hair.,0.5
A man is getting inside a car.,An elderly man is getting into a red car.,3.75
A big green ball knocks a potato over.,A large green ball hits a potato.,4.0
A cat is playing keyboards.,A cat is playing a piano.,3.0
Two dogs swim in a pool.,Dogs are swimming in a pool.,4.2
The man used a chopper to chop the onion.,The man used a machine to chop up a potatoe.,2.0
A woman slices tofu.,A woman is cutting tofu.,5.0
A herd of deer are crossing the street.,A herd of caribou are crossing a road.,3.0
The person is riding the horse.,A man is riding a horse.,3.8
Someone is feeding a animal.,Someone is playing a piano.,0.0
Someone is slicing tortila's.,Someone is riding a horse.,0.0
Someone is mixing ingrediants.,Someone is sewing things.,0.25
A rooster pecks at a dead mouse.,A chicken is pecking at a dead mouse.,4.0
A woman holds a kangaroo.,A woman is picking up a kangaroo.,3.25
A man is playing with frogs,A cat is playing with a camera.,0.75
Two men are talking.,Two men are playing guitar.,1.5
A man spreads butter on a big piece of bread.,A man is smearing butter on a slice of garlic bread.,3.5
A man is running across a high wire.,A man is running on rope.,3.0
A man is mowing a lawn.,A woman is cutting a lemon.,0.2
A man is opening a door.,A man is playing a guitar.,0.8
A man is slicing a potato into pieces.,A man is cutting a potato.,4.2
The woman is cutting cooked octopus.,A woman is chopping octopus.,3.8
A man is punching through boards.,A dog is running through water.,0.4
A man is dancing.,A man is eating bread.,0.8
Someone is playing a piano.,A man is playing a guitar.,1.2
Two foxes are eating from a plate on a brick patio.,Foxes are eating from a plate.,2.8
A boy is playing a key-board.,A boy is playing the piano.,3.2
A person plays a keyboard.,Someone is playing a keyboard.,5.0
A man is shooting a gun.,A man is spitting.,0.0
Someone is slicing an onion.,Someoen is peeling a potato.,1.0
A man is swimming.,A woman is slicing meat.,0.0
A man is playing the guitar.,A man plays an acoustic guitar.,3.75
A woman is slicing a pumpkin.,A woman is riding an elephant.,0.4
A woman is dancing.,A woman is kneading dough.,0.4
A woman is cracking eggs into a bowl.,A woman is placing skewers onto a rack.,0.6
A car is moving through a road.,A car is driving down the road.,4.0
Someone is greasing a pan.,Smeone is laying down.,0.4
A man is playing guitar.,A man is draining pasta.,0.4
A woman is drinking vodka.,A woman is exercising.,0.4
A woman is cutting meat into pieces.,A woman is cutting up some meat.,4.8
A man is rinsing a steak.,A man is playing a guitar.,0.6
A man is selling items.,A man is cleaning the house.,0.8
A man is jumping a wall.,A man jumps onto a short wall.,3.2
Runners race around a track.,Runners compete in a race.,3.2
A man is kicking a soccer ball.,A man is mixing a bowl.,0.6
A woman is frying something.,A woman is riding a horse.,0.6
A cat is licking a sucker.,A woman is slicing cucumber.,0.0
A woman is dancing by a fire.,A woman is taking a bath.,1.4
The man is slicing a fish open.,A man is slicing a potato.,2.2
Butter is melting in a pan.,A man is melting butter in a pan.,3.6
Three boys are dancing.,Kids are dancing.,3.111
A woman is playing a game with a man.,A man is playing piano.,0.6
The man is driving a white car.,A man is giving an interview.,0.4
A man drove his car.,A man is driving a car.,4.25
A car backs out of a space.,A car is backing out of a blocked lane.,3.0
A man puts some cheese on a pizza.,The man sprinkled cheese on the pizza.,5.0
The boy is playing the piano.,A boy plays a piano.,5.0
The man played his guitar.,A man is playing a guitar.,3.75
A man is riding a horse.,A man is playing a keyboard.,0.2
A man is walking on a rope.,A man is riding a mo-pad.,0.4
A girl is playing a flute.,A band is playing on a stage.,1.286
People step off a train.,A group of people get off a train.,4.6
A woman is sewing on a machine.,A woman is breading some meat.,0.6
A dog is looking into swimming pool.,A dog is walking around a pool.,2.0
A man is buttering a piece of bread.,A man is applying butter to bread.,5.0
A man is cutting tomatoes into pieces.,A woman is cutting some vegetables.,1.8
Three teenage girls danced in the room.,Some teenage girls are dancing for the camera.,2.4
A lion is walking.,A lion is pacing in a pen.,2.4
A man shooting a car.,A man is cutting a potato.,0.4
A black horse is running around.,The horse is running.,4.2
A woman is deveining shrimp.,A man is dancing in rain.,0.0
A man is riding a horse.,A woman is washing a freezer.,0.0
A man walks down a path.,A man walks across a tight rope.,0.8
A man is slicing a potato.,A woman is cutting a jalepeno.,1.4
A dog is barking at a ball.,A dog swims after a tennis ball.,1.5
A kid runs away from a fish swinging around on a fishing pole.,A little kid is running around a fishing pole.,2.5
A man is walking along a path through wilderness.,A man is walking down a road.,2.5
An elderly man is speaking at a podium.,A man is making a speech at the podium.,3.5
A man riding a horse in slow motion.,A man is riding on a horse.,3.4
A person is cutting some burrata cheese.,The person is slicing cheese.,3.8
The man is shooting an automatic rifle.,A man is shooting a gun.,3.8
A man is crushing garlic with the back of a knife.,A woman is slicing meat with a knife.,1.5
A woman is filing her fingernails with an emery board.,A woman is feeding her baby with a bottle.,0.5
A man is riding a skateboard.,A woman is cutting a potato.,0.0
A woman is taking a shower.,A man is riding a white horse.,0.0
A  man is dancing.,A man is riding a horse.,0.8
A man is rowing a boat.,A man is shooting off a gun.,0.85
A man is swinging from a rope attached to the ceiling.,A man is swinging on a rope.,3.4
A woman is riding a horse on a beach.,A man is carrying another man on his back.,0.4
A man holds a small animal in one hand.,A man shows off a small monkey.,1.75
A person is folding a square paper piece.,A man is folding paper.,3.25
A person is frying meat in a pan.,A person is holding a skunk.,0.75
A chimpanzee is hurting a woman.,A man is driving a car.,0.0
The woman is peeling shrimp.,The man is holding a lemur.,0.0
Two zebras are playing.,Zebras are socializing.,4.25
A woman is slicing butter.,A woman slices tofu.,1.8
Some men are playing guitars.,Three men are playing guitars and singing together.,3.2
The elephants sprayed water on themselves.,Elephants spray themselves with water.,3.6
A dog sat at the counter of a store.,The dog is standing at the counter.,2.6
Someone drills a hole in a strip of wood with a power drill.,A man drills a hole in a piece of wood.,3.2
A woman is slicing some vegetables.,The woman is dicing garlic.,2.8
A badger is burrowing a hole.,A badger is digging the earth.,4.6
A woman is water skiing on a lake.,A man is playing a flute.,0.0
A girl is playing a violin.,A baby is laughing and giggling.,0.25
A helicopter is landing on a helipad.,A helicopter lands.,3.923
A woman is cutting up a chicken.,A woman is slicing meat.,2.75
A woman is cutting a cucumber.,A man is playing a guitar.,0.0
A woman rides an elephant in front of an adoring crowd.,A woman rides an elephant.,3.0
A puppy is sliding backwards along the floor.,A puppy is pushing itself backwards.,3.8
A woman splits garlic cloves.,A woman is breaking a head of garlic into cloves.,4.6
A dog is looking into swimming pool.,A dog is walking along the edge of a pool.,2.6
A woman mixes a beauty treatment in a glass.,A woman is mixing a cream in a glass with a spoon.,3.6
A man is drawing a picture.,A person is drawing.,3.6
A woman is picking tomatoes.,A woman is pouring batter into a bowl.,1.0
A man is looking at a computer monitor.,A man is using a laptop.,2.75
The boy is riding a tricycle.,A woman is riding a water scooter.,1.25
Two men compete in a tire rolling race.,Two people flipped tractor tires in a race.,2.75
A person is cutting a meat.,A person riding a mechanical bull,0.0
A man is playing a violin.,A woman is using a sewing machine.,0.0
The baby crawled through the doorway.,A baby is crawling across the floor.,2.4
A man is playing keyboard.,A person is playing a piano.,2.2
A man is smelling two pizzas.,A woman is feeding a man.,0.2
A monkey pulls the tail of a dog.,A monkey is teasing a dog at the zoo.,2.8
A dog lies on his back on a wooden floor.,A dog is laying on the floor.,4.0
A woman is frying something in the pan.,A man is playing his guitar.,0.0
A man puts seasoning in a bowl of water.,The man added seasoning to water in a bowl.,5.0
An elderly woman is pouring oil into a frying pan.,A tied man is putting into water.,0.0
A woman is chopping an onion.,A woman is slicing partially into half of an onion.,3.2
The woman picked up the kangaroo.,A woman is carrying a kangaroo.,3.5
A dog biting on a can.,A dog opens a can of food.,1.75
A woman is deboning a fish.,A man catches a fish.,1.25
A man is mowing grass.,A man is busting concrete.,0.833
A cat is watching a TV.,A man is slicing a leave.,0.0
The boy is stuck in the door of the doghouse.,A child is stuck in a dog house.,3.75
People flip into a swimming pool.,Men are falling into a pool.,2.75
A woman swims underwater.,A woman is swimming.,3.8
A man is playing a guitar.,A woman is dancing.,0.2
An airplane is flying in the air.,A South African Airways plane is flying in a blue sky.,3.4
A bear is running from two dogs.,A bear is fighting wolves.,1.4
A woman is resting in a floating raft.,A woman relaxes in an inner tube.,3.8
A man is dieing in an operating room.,A man is kissing a woman in stage.,0.4
A man is holding a leaf.,A woman is watching television.,0.0
A person is riding a horse.,A woman is slicing potatoes.,0.0
A woman is slicing octopus.,A man is playing the guitar.,0.0
A man is breaking water jugs.,A woman is peeling garlic.,0.2
A man is playing a guitar.,A woman is cutting vegetable.,0.0
A girl is eating a cupcake.,A man is slicing a cucumber.,0.0
The little girl played on the grass with a dog and a ball.,A baby plays with a dog and ball.,3.8
People ride and paddle a raft.,Four people are floating on a raft.,2.25
The lady cut up a potatoe.,A man is cutting a potato.,2.4
The missile exploded.,A rocket exploded.,3.2
A dog is playing in the snow.,A dog is pawing at a fly in the carpet before it.,1.6
A woman is dancing with other women.,A woman is shredding chicken.,0.4
A boy is pushing a van.,A person is slicing a tomato.,0.0
A boy is making some dance steps.,A boy is pouring something from a pitcher.,0.4
A woman is opening a soda and drinking it.,A woman is riding on an elephant.,0.6
A man is assembling speaker parts.,A man is playing the guitar.,1.0
The dog walked along the edge of the pool.,A dog is walking along a pool.,4.6
Butter is being put into a bowl.,A man cutting butter into a mixing bowl.,4.25
Raccoons are eating.,A man is eating.,1.5
Someone fell off a horse.,A man gets knocked off of a horse.,3.5
A woman peels an apple.,A man pops wheelies on a motorcycle.,0.0
A man is taking some math classes.,A man is rinsing a steak.,0.0
Animals are playing in water.,Two men are playing ping pong.,0.0
A man is riding a horse and jumping over obstacles.,A man is kicking a soccer ball.,0.333
A person is doing pencil tricks with his hand.,A person is slicing carrots in half.,0.333
The person lit the cameras on fire.,A person is blow torching cameras.,3.333
The man is slicing the tape from the box.,A man is cutting open a box.,4.333
A man is fishing in the river.,A man is singing while walking down the sidewalk.,0.8
A man is riding a bike.,A woman is dancing in the street.,0.2
A man is doing push-ups.,A woman is cutting some octopus.,0.0
A man is playing guitar.,A woman is slicing up some pork.,0.0
The little boy is singing and playing the guitar.,A baby is playing a guitar.,2.8
A woman is powdering her face.,The woman is tapping her fingers on the table.,0.8
A woman is peeling a potato.,A lion is walking around.,0.0
A woman is firing a rifle.,A man is performing stunts.,0.25
A woman puts a garland over a man's shoulders.,A man pours water over a pilots head.,0.5
An old woman is shaking hand with a man.,A man and a woman shake hands.,3.75
The woman is waterskiing.,A woman is wake boarding on a lake.,1.75
Trees are bending in storm.,Trees are hit by very hard winds.,2.667
A man and woman is riding in a car.,A woman is frying shrimp.,0.4
A man is moving a tree limb.,The woman is playing the violin.,0.0
A man plays a piano.,A woman is playing the violin.,1.0
A person pours oil on a skillet.,A person is dicing an onion.,0.8
The animal is eating.,A woman is dancing.,0.0
The woman is walking her dog.,A woman walks her dog down the street.,4.0
A group of people sing.,Some people are singing.,5.0
The cat is drinking milk.,A cat is licking from a saucer of milk.,4.4
A girl is making eyelid.,A woman is applying eyeshadow.,2.0
